symptom_id,symptom_name,category,description,related_body_system,search_name,source
24001,Insulinoma,general,HPO HP:0012197: A type of tumor of the pancreatic beta cells that secretes excess insulin and can result in hypoglycemia.,general,insulinoma,HPO
24002,Intcrn Space-occupying Lesion Found On Dx Imaging of Cnsl,dermatological,ICD-10-CM R90.0: Intracranial space-occupying lesion found on diagnostic imaging of central nervous system,integumentary,intcrn space occupying lesion found on dx imaging of cnsl,ICD-10-CM
24003,Intellectual Deterioration,general,"HPO exact synonym for Mental Deterioration. HPO HP:0001268: Loss of previously present mental abilities, generally in adults.",general,intellectual deterioration,HPO
24004,Intellectual Disability,general,"HPO HP:0001249: The term intellectual disability or intellectual developmental disorder is used to describe significantly sub-average intellectual and adaptive functioning based on clinical assessment and as measured by individually administered, appropriately normed, standardized and validated tests of intellectual functioning and adaptive behavior, with onset during the developmental period from infancy through adolescence.",general,intellectual disability,HPO
24005,"Intellectual Disability, Borderline",general,HPO exact synonym for Borderline Intellectual Disability. HPO HP:0006889: Borderline intellectual disability is defined as an intelligence quotient (IQ) in the range of 70-85.,general,intellectual disability borderline,HPO
24006,"Intellectual Disability, Mild",general,"HPO exact synonym for Mild Intellectual Disability. HPO HP:0001256: Mild intellectual disability (ID) is defined as a type of ID characterized by mildly sub-average adaptive functioning and intellectual functioning, with an intelligence quotient (IQ) the range of 50-69.",general,intellectual disability mild,HPO
24007,"Intellectual Disability, Moderate",general,"HPO exact synonym for Moderate Intellectual Disability. HPO HP:0002342: Moderate intellectual disability (ID) is defined as a type of ID characterized by moderately sub-average adaptive functioning and intellectual functioning, with an intelligence quotient (IQ) the range of 35-49.",general,intellectual disability moderate,HPO
24008,"Intellectual Disability, Profound",general,"HPO exact synonym for Profound Intellectual Disability. HPO HP:0002187: Profound intellectual disability (ID) is defined as a type of ID characterized by profoundly sub-average adaptive functioning and intellectual functioning, with an intelligence quotient (IQ) below 20.",general,intellectual disability profound,HPO
24009,"Intellectual Disability, Severe",general,"HPO exact synonym for Severe Intellectual Disability. HPO HP:0010864: Severe intellectual disability (ID) is defined as a type of ID characterized by severely sub-average adaptive functioning and intellectual functioning, with an intelligence quotient (IQ) the range of 20-34.",general,intellectual disability severe,HPO
24010,Intellectual Impairment,general,"HPO exact synonym for Cognitive Impairment. HPO HP:0100543: Abnormal cognition is characterized by deficits in thinking, reasoning, or remembering.",general,intellectual impairment,HPO
24011,Intense Attachment to Unusual Objects,general,HPO HP:5200133: Human Phenotype Ontology term HP:5200133: Intense Attachment to Unusual Objects.,general,intense attachment to unusual objects,HPO
24012,Intense Psychological Distress to Cues,mental_health,HPO HP:0032941: Intense or prolonged psychological distress occurs when individuals are exposed to internal or external cues that symbolize or resemble an aspect of the traumatic event or events.,mental_behavioral,intense psychological distress to cues,HPO
24013,Intensity,general,HPO exact synonym for Severity. HPO HP:0012824: The intensity or degree of a manifestation.,general,intensity,HPO
24014,Intention Tremor,neurological,"HPO HP:0002080: A type of kinetic tremor that occurs during target directed movement is called intention tremor. That is, an oscillatory cerebellar ataxia that tends to be absent when the limbs are inactive and during the first part of voluntary movement but worsening as the movement continues and greater precision is required (e.g., in touching a target such as the patient's nose or a physician's finger).",nervous,intention tremor,HPO
24015,Intercalary Polydactyly,general,HPO exact synonym for Mesoaxial Polydactyly. HPO HP:0100260: The presence of a supernumerary finger or toe (not a thumb or hallux) involving the third or fourth metacarpal/tarsal with associated osseous syndactyly.,general,intercalary polydactyly,HPO
24016,Intercostal Muscle Weakness,neurological,"HPO HP:0004878: Lack of strength of the intercostal muscles, i.e., of the muscle groups running along the ribs that create and move the chest wall.",nervous,intercostal muscle weakness,HPO
24017,Intercostal Pain,pain,ICD-10-CM R07.82: Intercostal pain,general,intercostal pain,ICD-10-CM
24018,Intercostal Retractions,general,HPO HP:0030864: A pulling inward of the soft tissues between the ribs upon inhalation. This is a sign of increased use of the chest muscles for breathing and is a manifestation of respiratory distress.,general,intercostal retractions,HPO
24019,Intercrural Pterygium,general,HPO HP:0009757: A pterygium (or pterygia) in the intercrural (groin) region.,general,intercrural pterygium,HPO
24020,Interdigital Finger Polydactyly,general,HPO exact synonym for Mesoaxial Hand Polydactyly. HPO HP:0006159: The presence of a supernumerary finger (not a thumb) involving the third or fourth metacarpal with associated osseous syndactyly.,general,interdigital finger polydactyly,HPO
24021,Interdigital Loops,general,HPO HP:0100888: Human Phenotype Ontology term HP:0100888: Interdigital Loops.,general,interdigital loops,HPO
24022,Interface Hepatitis,general,HPO HP:0032220: Inflammation of the liver characterized by a mononuclear cell infiltrate whereby portal inflammatory cells extend through the limiting plate between the portal tract and liver parenchyma.,general,interface hepatitis,HPO
24023,Interferon-alpha High in Blood,general,HPO exact synonym for Increased Circulating Interferon-alpha Concentration. HPO HP:0034513: An elevation in the concentration of interferon alpha measured in the blood circulation.,general,interferon alpha high in blood,HPO
24024,Interhemispheric Cyst,general,"HPO HP:0032327: Cystic collection (sac-like, fluid containing pocket of membranous tissue) located in the interhemispheric fissure, with or without communication with the ventricular system.",general,interhemispheric cyst,HPO
24025,Interhypothalamic Adhesion,general,HPO HP:0033105: An abnormal parenchymal band connecting the medial margins of the left and right hypothalami across the third ventricle.,general,interhypothalamic adhesion,HPO
24026,Interictal EEG Abnormality,general,"HPO HP:0025373: Interictal refers to a period of time between epileptic seizures. Electroencephalographic (EEG) patterns are important in the differential diagnosis of epilepsy, and the EEG is almost always abnormal during a seizure. Some persons with seizures may show EEG abnormalities between seizures, while others do not. In some cases, multiple interictal EEGs must be recorded before an abnormality is observed. In most cases the electrographic pattern of seizure onset is completely different from the activity recorded during interictal discharge.",general,interictal eeg abnormality,HPO
24027,Interictal Epileptiform Activity,general,"HPO HP:0011182: Epileptiform activity refers to distinctive EEG waves or complexes distinguished from background activity found in in a proportion of human subjects with epilepsy, but which can also be found in subjects without seizures. Interictal epileptiform activity refers to such activity that occurs in the absence of a clinical or subclinical seizure.",general,interictal epileptiform activity,HPO
24028,Interictal Vestibular Dysfunction,general,HPO exact synonym for Abnormal Vestibular Function. HPO HP:0001751: An abnormality of the functioning of the vestibular apparatus.,general,interictal vestibular dysfunction,HPO
24029,Interlobular Arterial Intima/media Amyloidosis,general,"HPO exact synonym for Cortical Radial Artery Intimal/medial Amyloidosis. HPO HP:0033887: Amorphous extracellular substance in the glomerular, interstitial or vascular compartments of the interlobular arteries of the kidney. Congo-red positive with typically an apple green birerfingence on polarization microscopy, and 8-12",general,interlobular arterial intima media amyloidosis,HPO
24030,Interlobular Artery Medial Atrophy,general,"HPO exact synonym for Cortical Radial Artery Medial Atrophy. HPO HP:0033912: Atrophy (wasting, decreased thickness) of the middle layer of the cortical radial arteries (also known as the interlobular arteries) of the kidney.",general,interlobular artery medial atrophy,HPO
24031,Interlobular Artery Medial Hypertrophy,general,HPO exact synonym for Cortical Radial Artery Medial Hypertrophy. HPO HP:0033911: Increased thickness of the middle layer of the cortical radial arteries (also known as the interlobular arteries) of the kidney.,general,interlobular artery medial hypertrophy,HPO
24032,Interlobular Artery Medial/intimal Arteriitis,general,HPO exact synonym for Cortical Radial Artery Medial/intimal Arteriitis. HPO HP:0033913: Inflammation of a the intima or the entire wall of cortical radial arteries (also known as the interlobular arteries) of the kidney.,general,interlobular artery medial intimal arteriitis,HPO
24033,Interlobular Bile Duct Destruction,general,HPO HP:0025344: Damage to and obliteration of intrahepatic bile ducts (bile ducts that transport bile between the Canals of Hering and the interlobar bile ducts).,general,interlobular bile duct destruction,HPO
24034,Interlobular Intima/media Venosclerosis,general,HPO HP:0033964: Thickening of the intima with fibrosis and/or duplication of the elastic lamina in interlobular veins of the kidney.,general,interlobular intima media venosclerosis,HPO
24035,Interlobular Lines (pulmonary CT Finding),general,HPO exact synonym for Interlobular Septal Thickening. HPO HP:0030879: Presence of thickening of the interlobular septa of the lungs as seen on a CT scan.,general,interlobular lines pulmonary ct finding,HPO
24036,Interlobular Septal Thickening,general,HPO HP:0030879: Presence of thickening of the interlobular septa of the lungs as seen on a CT scan.,general,interlobular septal thickening,HPO
24037,Interlobular Vein Intima/media Amyloidosis,general,"HPO HP:0033966: Amorphous extracellular substance in the glomerular, interstitial or vascular compartments of the interlobular veins of the kidney. Congo-red positive with typically an apple green birerfingence on polarization microscopy, and 8-12 nm fibrils on electron microscopy",general,interlobular vein intima media amyloidosis,HPO
24038,Interlobular Vein Intima/media Coagulative Necrosis,general,HPO HP:0033971: A type of interlobular vein intima/media necrosis in which the dead (necrotic) tissue retains the outlines of the dead structures.,general,interlobular vein intima media coagulative necrosis,HPO
24039,Interlobular Vein Intima/media Granulomatous Venulitis,general,HPO HP:0033968: A type of interlobular vein intima/media venulitis that is characterized by circumscribed inflammatory lesions comprised primarily of macrophages present in inflamed veins.,general,interlobular vein intima media granulomatous venulitis,HPO
24040,Interlobular Vein Intima/media Liquefactive Necrosis,general,HPO HP:0033970: A type of interlobular vein intima/media necrosis in which the dead (necrotic) tissue breaks down such that cellular detail is no longer recognized.,general,interlobular vein intima media liquefactive necrosis,HPO
24041,Interlobular Vein Intima/media Multilamellation,general,"HPO HP:0033974: Myointimal hyperplasia of the inner and middle layer of the interlobular veins of the kidney, arranged in multiple concentric layers.",general,interlobular vein intima media multilamellation,HPO
24042,Interlobular Vein Intima/media Necrosis,general,HPO HP:0033969: Cell death (necrosis) in the inner or middle layer of the interlobular vein of the kidney.,general,interlobular vein intima media necrosis,HPO
24043,Interlobular Vein Intima/media Onion Skinning,general,"HPO exact synonym for Interlobular Vein Intima/media Multilamellation. HPO HP:0033974: Myointimal hyperplasia of the inner and middle layer of the interlobular veins of the kidney, arranged in multiple concentric layers.",general,interlobular vein intima media onion skinning,HPO
24044,Interlobular Vein Intima/media Venulitis,general,HPO HP:0033967: Inflammation of the interlobular veins of the kidney which may affect only the intima or may be transmural.,general,interlobular vein intima media venulitis,HPO
24045,Interlobular Vein Intimal Mucoid Edema,cardiovascular,HPO HP:0033965: Accumulation of edematous extracellular matrix in the intima of the interlobular vein of the kidney. This material resembles mucus and stains pale blue on hematoxylin and eosin staining.,cardiovascular,interlobular vein intimal mucoid edema,HPO
24046,Interlobular Vein Medial Atrophy,general,"HPO HP:0033972: Atrophy (wasting, decreased thickness) of the medial layer pf the interlobular veins of the kidney.",general,interlobular vein medial atrophy,HPO
24047,Interlobular Vein Medial Hypertrophy,general,HPO HP:0033973: Increased thickness of middle layer of the interlobular veins of the kidney.,general,interlobular vein medial hypertrophy,HPO
24048,Intermediate Atrioventricular Canal Defect,general,"HPO HP:0011576: A specific combination of heart defects with a primum atrial septal defect, cleft anterior mitral valve leaflet, and inlet ventricular defect. There is one valve annulus and two valve orifices.",general,intermediate atrioventricular canal defect,HPO
24049,Intermediate Atrioventricular Septal Defect,general,"HPO exact synonym for Intermediate Atrioventricular Canal Defect. HPO HP:0011576: A specific combination of heart defects with a primum atrial septal defect, cleft anterior mitral valve leaflet, and inlet ventricular defect. There is one valve annulus and two valve orifices.",general,intermediate atrioventricular septal defect,HPO
24050,Intermediate Uveitis,general,HPO HP:0012124: Inflammation of the uveal tract in which the primary site of inflammation is the vitreous.,general,intermediate uveitis,HPO
24051,Intermediate Young Adult Onset,general,HPO HP:0025709: Onset of disease at an age of greater than or equal to 19 to under 25 years.,general,intermediate young adult onset,HPO
24052,Intermenstrual Bleeding,reproductive,HPO exact synonym for Metrorrhagia. HPO HP:0100608: Bleeding at irregular intervals.,hematologic,intermenstrual bleeding,HPO
24053,Intermittent,general,"HPO exact synonym for Recurrent. HPO HP:0031796: Applies to a sign, symptom or manifestation that occurs multiple times separated by intervals in which the sign, symptom, or manifestation is not present.",general,intermittent,HPO
24054,Intermittent Abnormally Low Body Temperature,general,HPO exact synonym for Intermittent Hypothermia. HPO HP:0005964: Episodes of reduced body temperature.,general,intermittent abnormally low body temperature,HPO
24055,Intermittent Atrial Fibrillation,general,HPO exact synonym for Paroxysmal Atrial Fibrillation. HPO HP:0004757: Episodes of atrial fibrillation that typically last for several hours up to one day and terminate spontaneously.,general,intermittent atrial fibrillation,HPO
24056,Intermittent Cerebellar Ataxia,neurological,"HPO exact synonym for Episodic Ataxia. HPO HP:0002131: Periodic spells of incoordination and imbalance, that is, episodes of ataxia typically lasting from 10 minutes to several hours or days.",nervous,intermittent cerebellar ataxia,HPO
24057,Intermittent Claudication,cardiovascular,"HPO HP:0004417: Intermittent claudication is a symptom of peripheral arterial occlusive disease. After having walked over a distance which is individually characteristic, the patients experience pain or cramps in the calves, feet or thighs which typically subsides on standing still.",cardiovascular,intermittent claudication,HPO
24058,Intermittent Diarrhea,gastrointestinal,HPO HP:0002254: Repeated episodes of diarrhea separated by periods without diarrhea.,gastrointestinal,intermittent diarrhea,HPO
24059,Intermittent Diarrhoea,general,HPO exact synonym for Intermittent Diarrhea. HPO HP:0002254: Repeated episodes of diarrhea separated by periods without diarrhea.,general,intermittent diarrhoea,HPO
24060,Intermittent Episodes of Respiratory Insufficiency Due to Muscle Weakness,respiratory,HPO HP:0004889: Human Phenotype Ontology term HP:0004889: Intermittent Episodes of Respiratory Insufficiency Due to Muscle Weakness.,nervous,intermittent episodes of respiratory insufficiency due to muscle weakness,HPO
24061,Intermittent Fever,infectious,HPO exact synonym for Recurrent Fever. HPO HP:0001954: Periodic (episodic or recurrent) bouts of fever.,general,intermittent fever,HPO
24062,Intermittent Generalised Erythematous Papular Rash,dermatological,HPO exact synonym for Intermittent Generalized Erythematous Papular Rash. HPO HP:0007432: Human Phenotype Ontology term HP:0007432: Intermittent Generalized Erythematous Papular Rash.,integumentary,intermittent generalised erythematous papular rash,HPO
24063,Intermittent Generalized Erythematous Papular Rash,dermatological,HPO HP:0007432: Human Phenotype Ontology term HP:0007432: Intermittent Generalized Erythematous Papular Rash.,integumentary,intermittent generalized erythematous papular rash,HPO
24064,Intermittent High Blood Pressure,general,HPO exact synonym for Episodic Hypertension. HPO HP:0000875: Human Phenotype Ontology term HP:0000875: Episodic Hypertension.,general,intermittent high blood pressure,HPO
24065,Intermittent Hyperpnea At Rest,general,HPO HP:0005941: Human Phenotype Ontology term HP:0005941: Intermittent Hyperpnea At Rest.,general,intermittent hyperpnea at rest,HPO
24066,Intermittent Hyperventilation,respiratory,HPO HP:0004879: Episodic hyperventilation.,respiratory,intermittent hyperventilation,HPO
24067,Intermittent Hypothermia,environmental,HPO HP:0005964: Episodes of reduced body temperature.,general,intermittent hypothermia,HPO
24068,Intermittent Icterus,gastrointestinal,"HPO exact synonym for Intermittent Jaundice. HPO HP:0001046: Jaundice that is sometimes present, sometimes not.",gastrointestinal,intermittent icterus,HPO
24069,Intermittent Involuntary Muscle Spasm,musculoskeletal,HPO exact synonym for Tetany. HPO HP:0001281: A condition characterized by intermittent involuntary contraction of muscles (spasms) related to hypocalcemia or occasionally magnesium deficiency.,musculoskeletal,intermittent involuntary muscle spasm,HPO
24070,Intermittent Jaundice,gastrointestinal,"HPO HP:0001046: Jaundice that is sometimes present, sometimes not.",gastrointestinal,intermittent jaundice,HPO
24071,Intermittent Lack of Energy,general,HPO exact synonym for Paroxysmal Lethargy. HPO HP:0011973: Repeated episodes of sudden-onset and transient lethargy.,general,intermittent lack of energy,HPO
24072,Intermittent Lactic Acidemia,general,HPO HP:0004913: An intermittent (discontinuous) form of lactic acidemia.,general,intermittent lactic acidemia,HPO
24073,Intermittent Microsaccadic Pursuits,general,HPO HP:0007944: Human Phenotype Ontology term HP:0007944: Intermittent Microsaccadic Pursuits.,general,intermittent microsaccadic pursuits,HPO
24074,Intermittent Migraine Headaches,pain,HPO exact synonym for Migraine. HPO HP:0002076: Migraine is a chronic neurological disorder characterized by episodic attacks of headache and associated symptoms.,general,intermittent migraine headaches,HPO
24075,Intermittent Overbreathing,general,HPO exact synonym for Intermittent Hyperventilation. HPO HP:0004879: Episodic hyperventilation.,general,intermittent overbreathing,HPO
24076,Intermittent Painful Muscle Spasms,musculoskeletal,HPO HP:0011964: History of repeated intermittent involuntary muscle contractions that were painful.,musculoskeletal,intermittent painful muscle spasms,HPO
24077,Intermittent Thrombocytopenia,hematologic,"HPO HP:0004854: Reduced platelet count that occurs sporadically, i.e., it comes and goes.",hematologic,intermittent thrombocytopenia,HPO
24078,Intermittent Yellow Skin,general,"HPO exact synonym for Intermittent Jaundice. HPO HP:0001046: Jaundice that is sometimes present, sometimes not.",general,intermittent yellow skin,HPO
24079,Intermittent Yellowing of Skin,general,"HPO exact synonym for Intermittent Jaundice. HPO HP:0001046: Jaundice that is sometimes present, sometimes not.",general,intermittent yellowing of skin,HPO
24080,Internal Anal Sphincter Achalasia,general,HPO HP:6000018: A disorder of the internal anal sphincter (IAS) in which the IAS fails to relax that manifests clinically as intractable constipation.,general,internal anal sphincter achalasia,HPO
24081,Internal Bleeding,general,HPO exact synonym for Internal Hemorrhage. HPO HP:0011029: The presence of hemorrhage within the body.,hematologic,internal bleeding,HPO
24082,Internal Carotid Artery Calcification,general,HPO HP:0031307: An accumulation of calcium and phosphate in arteries with mineral deposits in the intimal or medial layer of the vessel wall in the internal carotid artery.,general,internal carotid artery calcification,HPO
24083,Internal Carotid Artery Dissection,general,HPO HP:0012159: A separation (dissection) of the layers of the internal carotid artery wall.,general,internal carotid artery dissection,HPO
24084,Internal Carotid Artery Hypoplasia,general,HPO HP:0005290: Human Phenotype Ontology term HP:0005290: Internal Carotid Artery Hypoplasia.,general,internal carotid artery hypoplasia,HPO
24085,Internal Haemorrhage,general,HPO exact synonym for Internal Hemorrhage. HPO HP:0011029: The presence of hemorrhage within the body.,general,internal haemorrhage,HPO
24086,Internal Hemorrhage,general,HPO HP:0011029: The presence of hemorrhage within the body.,general,internal hemorrhage,HPO
24087,Internal Notch of the Femoral Head,oral,HPO HP:0031027: A small V-shaped indentation on the internal aspect of the femoral head. This feature is well illustrated in Figure 5 of PMID:11694546.,oral,internal notch of the femoral head,HPO
24088,Internal Ophthalmoplegia,general,HPO HP:0007942: Paralysis of the iris and ciliary apparatus.,general,internal ophthalmoplegia,HPO
24089,Internal Tibial Rotation,general,HPO exact synonym for Internal Tibial Torsion. HPO HP:0034372: Human Phenotype Ontology term HP:0034372: Internal Tibial Torsion.,general,internal tibial rotation,HPO
24090,Internal Tibial Torsion,general,HPO HP:0034372: Human Phenotype Ontology term HP:0034372: Internal Tibial Torsion.,general,internal tibial torsion,HPO
24091,Internal-clock Disorders,general,HPO exact synonym for Sleep-wake Cycle Disturbance. HPO HP:0006979: Any abnormality of an individual's circadian rhythm that affects the timing of sleeping and being awake is referred to as a sleep-wake disorder.,general,internal clock disorders,HPO
24092,Internally Nucleated Skeletal Muscle Fibers,musculoskeletal,"HPO HP:0031237: An abnormally increased proportion of nuclei of sarcomeres with an internal localization. Individual muscle fibers are syncytia, formed by embryonic fusion of many myoblasts or later, myosatellite cells. Each muscle fiber contains many nuclei, peripherally positioned immediately adjacent to the sarcolemmal membrane. In healthy muscle only 3-5% of fibers contain nuclei that are located internally, within the cell, but many disease processes lead to internal nuclei.",musculoskeletal,internally nucleated skeletal muscle fibers,HPO
24093,Internally Nucleated Skeletal Muscle Fibres,musculoskeletal,"HPO exact synonym for Internally Nucleated Skeletal Muscle Fibers. HPO HP:0031237: An abnormally increased proportion of nuclei of sarcomeres with an internal localization. Individual muscle fibers are syncytia, formed by embryonic fusion of many myoblasts or later, myosatellite cells. Each muscle fiber contains man",musculoskeletal,internally nucleated skeletal muscle fibres,HPO
24094,Internally Rotated Hips,general,"HPO exact synonym for Increased Femoral Anteversion. HPO HP:0012427: An increased degree of femoral version, which is defined as the angular difference between axis of femoral neck and transcondylar axis of the knee. Thus, femoral anteversion is an inward twisting of the femur that causes the knees and",general,internally rotated hips,HPO
24095,Internally Rotated Shoulders,general,HPO HP:0006659: Human Phenotype Ontology term HP:0006659: Internally Rotated Shoulders.,general,internally rotated shoulders,HPO
24096,Internuclear Ophthalmoplegia,general,HPO HP:0030773: An abnormality of conjugate lateral gaze in which the affected eye shows impairment of adduction. The pathognomonic clinical sign of internuclear ophthalmoplegia is an impaired adduction while testing horizontal saccades on the side of the lesion in the ipsilateral medial longitudinal fascicule.,general,internuclear ophthalmoplegia,HPO
24097,Interosseous Membrane Calcification of Forearm,general,HPO exact synonym for Calcification of the Interosseus Membrane of the Forearm. HPO HP:0030267: Deposition of calcium salts in the fibrous sheet that connects the radius and the ulna.,general,interosseous membrane calcification of forearm,HPO
24098,Interosseous Muscular Atrophy,general,"HPO exact synonym for Interosseus Muscle Atrophy. HPO HP:0007181: Atrophy of the interosseus muscles (including the palmar interossei that lie on the anterior aspect of the metacarpals, the dorsal interosseus muscles of the hand, which lie between the intercarpals, the plantar interosseus muscles, w",general,interosseous muscular atrophy,HPO
