symptom_id,symptom_name,category,description,related_body_system,search_name,source
34928,Severe Infection,infectious,HPO HP:0032169: A type of infection that is regarded as a sign of a pathological susceptibility to infection because of unusual severity or intensity of the infection.,immune,severe infection,HPO
34929,Severe Influenza Infection,infectious,HPO HP:0034249: An unusually severe infection by an influenza virus.,immune,severe influenza infection,HPO
34930,Severe Intellectual Disability,general,"HPO HP:0010864: Severe intellectual disability (ID) is defined as a type of ID characterized by severely sub-average adaptive functioning and intellectual functioning, with an intelligence quotient (IQ) the range of 20-34.",general,severe intellectual disability,HPO
34931,Severe Intrauterine Growth Retardation,reproductive,"HPO HP:0008846: Intrauterine growth retardation that is 4 or more standard deviations below average, corrected for sex and gestational age.",reproductive,severe intrauterine growth retardation,HPO
34932,Severe Lactic Acidosis,general,HPO HP:0004900: A severe form of lactic acidemia.,general,severe lactic acidosis,HPO
34933,Severe Limb Shortening,musculoskeletal,HPO HP:0200083: Human Phenotype Ontology term HP:0200083: Severe Limb Shortening.,musculoskeletal,severe limb shortening,HPO
34934,Severe Long-sightedness,general,HPO exact synonym for High Hypermetropia. HPO HP:0008499: A severe form of hypermetropia with over +5.00 diopters.,general,severe long sightedness,HPO
34935,Severe Mental Retardation,general,"HPO exact synonym for Severe Intellectual Disability. HPO HP:0010864: Severe intellectual disability (ID) is defined as a type of ID characterized by severely sub-average adaptive functioning and intellectual functioning, with an intelligence quotient (IQ) the range of 20-34.",general,severe mental retardation,HPO
34936,Severe Muscular Hypotonia,general,HPO HP:0006829: A severe degree of muscular hypotonia characterized by markedly reduced muscle tone.,general,severe muscular hypotonia,HPO
34937,Severe Myopia,general,HPO exact synonym for High Myopia. HPO HP:0011003: A severe form of myopia with greater than -6.00 diopters.,general,severe myopia,HPO
34938,Severe Myopia (> -6.00 Diopters),general,HPO exact synonym for High Myopia. HPO HP:0011003: A severe form of myopia with greater than -6.00 diopters.,general,severe myopia 6 00 diopters,HPO
34939,Severe Near Sightedness,general,HPO exact synonym for High Myopia. HPO HP:0011003: A severe form of myopia with greater than -6.00 diopters.,general,severe near sightedness,HPO
34940,Severe Norovirus Infection,infectious,"HPO HP:0020099: An unusually severe course of infection with Human norovirus, previously known as Norwalk virus. Norovirus, an RNA virus of the family Caliciviridae, is a human enteric pathogen. Norovirus infection-associated illness may also be more prolonged and severe in immunocompromised individuals and may be associated with remarkably persistent viral excretion in some of these individuals.",immune,severe norovirus infection,HPO
34941,Severe Oligozoospermia,general,HPO HP:0034818: A type of oligozoospermia characterized by a total number of more than 2 but less than 10 million sperm in the ejaculate or a concentration of more than 1 but less than 5 million sperm per milliliter.,general,severe oligozoospermia,HPO
34942,Severe Parainfluenza Infection,infectious,HPO HP:0031695: An unusually severe infection by a parainfluenza virus.,immune,severe parainfluenza infection,HPO
34943,Severe Periodontal Disease,general,HPO exact synonym for Severe Periodontitis. HPO HP:0000166: A severe form of periodontitis.,general,severe periodontal disease,HPO
34944,Severe Periodontitis,general,HPO HP:0000166: A severe form of periodontitis.,general,severe periodontitis,HPO
34945,Severe Peripheral Visual Field Loss,general,HPO exact synonym for Severe Constriction of Peripheral Visual Field. HPO HP:0030526: Peripheral visual field constriction with 10-19 degrees central field preserved.,general,severe peripheral visual field loss,HPO
34946,Severe Photosensitivity,general,HPO HP:0007537: A severe degree of photosensitivity of the skin.,general,severe photosensitivity,HPO
34947,Severe Platyspondyly,general,HPO HP:0004565: Human Phenotype Ontology term HP:0004565: Severe Platyspondyly.,general,severe platyspondyly,HPO
34948,Severe Postnatal Failure to Thrive,pediatric,HPO exact synonym for Severe Failure to Thrive. HPO HP:0001525: Human Phenotype Ontology term HP:0001525: Severe Failure to Thrive.,general,severe postnatal failure to thrive,HPO
34949,Severe Postnatal Growth Deficiency,general,"HPO exact synonym for Severe Postnatal Growth Retardation. HPO HP:0008850: Severely slow or limited growth after birth, being four standard deviations or more below age- and sex-related norms.",general,severe postnatal growth deficiency,HPO
34950,Severe Postnatal Growth Failure,general,"HPO exact synonym for Severe Postnatal Growth Retardation. HPO HP:0008850: Severely slow or limited growth after birth, being four standard deviations or more below age- and sex-related norms.",general,severe postnatal growth failure,HPO
34951,Severe Postnatal Growth Retardation,general,"HPO HP:0008850: Severely slow or limited growth after birth, being four standard deviations or more below age- and sex-related norms.",general,severe postnatal growth retardation,HPO
34952,Severe Prenatal Growth Deficiency,general,"HPO exact synonym for Severe Intrauterine Growth Retardation. HPO HP:0008846: Intrauterine growth retardation that is 4 or more standard deviations below average, corrected for sex and gestational age.",general,severe prenatal growth deficiency,HPO
34953,Severe Pyorrhea,general,HPO exact synonym for Severe Periodontitis. HPO HP:0000166: A severe form of periodontitis.,general,severe pyorrhea,HPO
34954,Severe Receptive Language Delay,general,HPO HP:0011352: A severe delay in the acquisition of the ability to understand the speech of others.,general,severe receptive language delay,HPO
34955,Severe Recurrent Varicella,general,HPO HP:0005428: Human Phenotype Ontology term HP:0005428: Severe Recurrent Varicella.,general,severe recurrent varicella,HPO
34956,Severe Reduction in Visual Acuity,general,"HPO exact synonym for Severely Reduced Visual Acuity. HPO HP:0001141: Severe reduction of the ability to see. On the 6m visual acuity scale, severe reduction is defined as less than 6/60 but at least 3/60. On the 20ft visual acuity scale, severe reduction is defined as less than 20/200 but at least 20/4",general,severe reduction in visual acuity,HPO
34957,Severe SARS-CoV-2 Infection,infectious,"HPO HP:0033141: Unusually severe clinical course of SARS-CoV-2 infection, manifested clinically by features such as dyspnea and hypoxia with diffuse bilateral ground-glass opacities of the lungs on computed tomographic scan with progressive respiratory insufficiency necessitating oxygen supplementation or mechanical ventilation.",immune,severe sars cov 2 infection,HPO
34958,Severe Sensorineural Deafness,general,HPO exact synonym for Severe Sensorineural Hearing Impairment. HPO HP:0008625: A severe form of sensorineural hearing impairment.,general,severe sensorineural deafness,HPO
34959,Severe Sensorineural Hearing Impairment,sensory,HPO HP:0008625: A severe form of sensorineural hearing impairment.,special_senses,severe sensorineural hearing impairment,HPO
34960,Severe Sensorineural Hearing Loss,sensory,HPO exact synonym for Severe Sensorineural Hearing Impairment. HPO HP:0008625: A severe form of sensorineural hearing impairment.,special_senses,severe sensorineural hearing loss,HPO
34961,Severe Sepsis with Septic Shock,infectious,ICD-10-CM R65.21: Severe sepsis with septic shock,immune,severe sepsis with septic shock,ICD-10-CM
34962,Severe Sepsis without Septic Shock,infectious,ICD-10-CM R65.20: Severe sepsis without septic shock,immune,severe sepsis without septic shock,ICD-10-CM
34963,Severe Short Stature,general,"HPO HP:0003510: A severe degree of short stature, more than -4 SD from the mean corrected for age and sex.",general,severe short stature,HPO
34964,Severe Short-limb Dwarfism,musculoskeletal,HPO HP:0008890: Human Phenotype Ontology term HP:0008890: Severe Short-limb Dwarfism.,musculoskeletal,severe short limb dwarfism,HPO
34965,Severe Sun Sensitivity,general,HPO exact synonym for Severe Photosensitivity. HPO HP:0007537: A severe degree of photosensitivity of the skin.,general,severe sun sensitivity,HPO
34966,Severe T-cell Immunodeficiency,general,HPO HP:0005352: A primary immune deficiency that is characterized by defects or deficiencies of T-lymphocytes that causes specific susceptibility to intracellular micro-organisms.,general,severe t cell immunodeficiency,HPO
34967,Severe Temper Tantrums,general,"HPO HP:0025162: Temper tantrums, which occur with more severe symptomatology compared to a temper tantrum that occurs as a part of normal developmental process.",general,severe temper tantrums,HPO
34968,Severe Toxoplasmosis,general,"HPO HP:0020105: Toxoplasmosis is a widespread parasitic infection that is frequently asymptomatic in immunocompetent patients. However, this obligate intracellular protozoan parasite can evade the immune system and persist for the life of its host in cyst form, predominantly in the brain, retina, and muscles. Reactivation of latent cysts may occur when the immune system fails to maintain cytokine pressure, which mainly relies on gamma interferon (IFN-gamma). Toxoplasmosis is a life-threatening infection in immunocompromised patients (ICPs).",general,severe toxoplasmosis,HPO
34969,Severe Varicella Zoster Infection,infectious,"HPO HP:0032170: An unusually severe form of varicella zoster virus (VZV) infection. In the majority of the cases, especially in children, varicella is a very mild infection characterized by skin lesions, low grade fever and malaise. Severe infection is characterized by manifestations including VZV pneumonia, hepatitis, meningitis, and disseminated varicella.",immune,severe varicella zoster infection,HPO
34970,Severe Viral Infection,infectious,HPO HP:0031691: An unusually severe viral infection.,immune,severe viral infection,HPO
34971,Severe Vision Loss,sensory,"HPO exact synonym for Severely Reduced Visual Acuity. HPO HP:0001141: Severe reduction of the ability to see. On the 6m visual acuity scale, severe reduction is defined as less than 6/60 but at least 3/60. On the 20ft visual acuity scale, severe reduction is defined as less than 20/200 but at least 20/4",special_senses,severe vision loss,HPO
34972,Severe Visual Impairment,general,"HPO exact synonym for Severely Reduced Visual Acuity. HPO HP:0001141: Severe reduction of the ability to see. On the 6m visual acuity scale, severe reduction is defined as less than 6/60 but at least 3/60. On the 20ft visual acuity scale, severe reduction is defined as less than 20/200 but at least 20/4",general,severe visual impairment,HPO
34973,Severe Visual Loss,general,"HPO exact synonym for Severely Reduced Visual Acuity. HPO HP:0001141: Severe reduction of the ability to see. On the 6m visual acuity scale, severe reduction is defined as less than 6/60 but at least 3/60. On the 20ft visual acuity scale, severe reduction is defined as less than 20/200 but at least 20/4",general,severe visual loss,HPO
34974,Severe Weight Faltering,endocrine_metabolic,HPO exact synonym for Severe Failure to Thrive. HPO HP:0001525: Human Phenotype Ontology term HP:0001525: Severe Failure to Thrive.,endocrine,severe weight faltering,HPO
34975,Severely Close Sighted,general,HPO exact synonym for High Myopia. HPO HP:0011003: A severe form of myopia with greater than -6.00 diopters.,general,severely close sighted,HPO
34976,Severely Decreased Muscle Tone,musculoskeletal,HPO exact synonym for Severe Muscular Hypotonia. HPO HP:0006829: A severe degree of muscular hypotonia characterized by markedly reduced muscle tone.,musculoskeletal,severely decreased muscle tone,HPO
34977,Severely Decreased Neutrophil Count,general,"HPO HP:0025826: Severe decrease in circulating neutrophils, usually characterized as fewer than 500 neutrophils per microlitre.",general,severely decreased neutrophil count,HPO
34978,Severely High Blood Protein Levels,general,HPO exact synonym for Heavy Proteinuria. HPO HP:0012597: Severely increased levels of protein in the urine (1000-3000 mg per day in adults).,general,severely high blood protein levels,HPO
34979,Severely Impaired Vision,sensory,"HPO exact synonym for Severely Reduced Visual Acuity. HPO HP:0001141: Severe reduction of the ability to see. On the 6m visual acuity scale, severe reduction is defined as less than 6/60 but at least 3/60. On the 20ft visual acuity scale, severe reduction is defined as less than 20/200 but at least 20/4",special_senses,severely impaired vision,HPO
34980,Severely Increased Total Eosinophil Count,general,"HPO HP:0032061: Severe increase in circulating eosinophils, usually characterized as more than 1500 eosinophils per microlitre.",general,severely increased total eosinophil count,HPO
34981,Severely Near Sighted,general,HPO exact synonym for High Myopia. HPO HP:0011003: A severe form of myopia with greater than -6.00 diopters.,general,severely near sighted,HPO
34982,Severely Reduced Contrast Sensitivity,general,HPO HP:0032110: A severe reduction in the ability to perceive visual contrast characterized by 1.00 log unit or more contrast sensitivity loss.,general,severely reduced contrast sensitivity,HPO
34983,Severely Reduced Ejection Fraction,general,"HPO exact synonym for Severely Reduced Left Ventricular Ejection Fraction. HPO HP:0012666: A large reduction in the fraction of blood pumped from the left ventricle with each cardiac cycle. The normal range in adults is at over 50 percent, and a severe reduction is defined as less than 30 percent.",general,severely reduced ejection fraction,HPO
34984,Severely Reduced Left Ventricular Ejection Fraction,general,"HPO HP:0012666: A large reduction in the fraction of blood pumped from the left ventricle with each cardiac cycle. The normal range in adults is at over 50 percent, and a severe reduction is defined as less than 30 percent.",general,severely reduced left ventricular ejection fraction,HPO
34985,Severely Reduced Visual Acuity,general,"HPO HP:0001141: Severe reduction of the ability to see. On the 6m visual acuity scale, severe reduction is defined as less than 6/60 but at least 3/60. On the 20ft visual acuity scale, severe reduction is defined as less than 20/200 but at least 20/400. On the decimal visual acuity scale, severe reduction is defined as less than 0.1 but at least 0.05.",general,severely reduced visual acuity,HPO
34986,Severity,general,HPO HP:0012824: The intensity or degree of a manifestation.,general,severity,HPO
34987,Sex Addiction,general,"HPO exact synonym for Addictive Sex Behavior. HPO HP:5200335: Inability to control or manage sexual urges, fantasies, or behaviors that impair one's ability to function.",general,sex addiction,HPO
34988,Sex Reversal,general,HPO HP:0012245: Development of the reproductive system is inconsistent with the chromosomal sex.,general,sex reversal,HPO
34989,Sex-limited Expression,general,HPO HP:0001470: Sex limitation is used to refer to a monogenic trait linked to an autosomal locus in which the phenotypic effects of allelic differences are expressed only in one sex.,general,sex limited expression,HPO
34990,Sexsomnia,general,"HPO HP:5200294: Unintentional sexual behavior during sleep, such as masturbation, initiation of sex, or making sexual noises, is known as sexsomnia. Sexsomnia predominantly occurs during NREM sleep.",general,sexsomnia,HPO
34991,Sexual Behavior During Sleep,mental_health,"HPO exact synonym for Sexsomnia. HPO HP:5200294: Unintentional sexual behavior during sleep, such as masturbation, initiation of sex, or making sexual noises, is known as sexsomnia. Sexsomnia predominantly occurs during NREM sleep.",mental_behavioral,sexual behavior during sleep,HPO
34992,Sexual Behaviour During Sleep,mental_health,"HPO exact synonym for Sexsomnia. HPO HP:5200294: Unintentional sexual behavior during sleep, such as masturbation, initiation of sex, or making sexual noises, is known as sexsomnia. Sexsomnia predominantly occurs during NREM sleep.",mental_behavioral,sexual behaviour during sleep,HPO
34993,"Sexual Dysfunction, Unspecified",general,"ICD-10-CM R37: Sexual dysfunction, unspecified",general,sexual dysfunction unspecified,ICD-10-CM
34994,SGLT2i Exposure,general,"HPO exact synonym for Sodium Glucose Transport Inhibitor Exposure. HPO HP:6000949: History of having been treateed with a sodium glucose transport inhibitors such as dapagliflozin, empagliflozin, canagliflozin, sglt-i, SGLT2, bexagliflozin, ertugliflozin, sotagliflozin, jardiance, invokana, forxiga, brenzavvy, stegl",general,sglt2i exposure,HPO
34995,Shagreen Patch,general,"HPO HP:0009721: A plaque representing a connective-tissue nevus. Connective tissue naevi are uncommon skin lesions that occur when the deeper layers of the skin do not develop correctly or the components of these layers occur in the wrong proportion. Shagreen patches are oval-shaped and nevoid, skin-colored or occasionally pigmented, smooth or crinkled. The word shagreen refers to a type of roughened untanned leather.",general,shagreen patch,HPO
34996,Shakey Voice,general,"HPO exact synonym for Vocal Tremor. HPO HP:0012477: A wavering, unsteady voice that reflects involuntary and approximately sinusoidal oscillation of motor unit firings of laryngeal muscles. Vocal tremor results in low frequency modulations of voice frequency or amplitude and intermitte",general,shakey voice,HPO
34997,Shaking,neurological,Patient-friendly description of tremor.,nervous,shaking,Clinical_Curated
34998,Shallow Acetabula,general,HPO exact synonym for Shallow Acetabular Fossae. HPO HP:0003182: Human Phenotype Ontology term HP:0003182: Shallow Acetabular Fossae.,general,shallow acetabula,HPO
34999,Shallow Acetabulae,general,HPO exact synonym for Shallow Acetabular Fossae. HPO HP:0003182: Human Phenotype Ontology term HP:0003182: Shallow Acetabular Fossae.,general,shallow acetabulae,HPO
35000,Shallow Acetabular Fossa,general,HPO exact synonym for Shallow Acetabular Fossae. HPO HP:0003182: Human Phenotype Ontology term HP:0003182: Shallow Acetabular Fossae.,general,shallow acetabular fossa,HPO
35001,Shallow Acetabular Fossae,general,HPO HP:0003182: Human Phenotype Ontology term HP:0003182: Shallow Acetabular Fossae.,general,shallow acetabular fossae,HPO
35002,Shallow Acetabulum,general,HPO exact synonym for Shallow Acetabular Fossae. HPO HP:0003182: Human Phenotype Ontology term HP:0003182: Shallow Acetabular Fossae.,general,shallow acetabulum,HPO
35003,Shallow Anterior Chamber,general,"HPO HP:0000594: Reduced depth of the anterior chamber, i.e., the anteroposterior distance between the cornea and the iris is decreased.",general,shallow anterior chamber,HPO
35004,Shallow Breathing,general,HPO exact synonym for Hypopnea. HPO HP:0040213: Hypopnea is referring to breathing that is abnormally shallow.,general,shallow breathing,HPO
35005,Shallow Eye Sockets,sensory,HPO exact synonym for Shallow Orbits. HPO HP:0000586: Reduced depth of the orbits associated with prominent-appearing ocular globes.,special_senses,shallow eye sockets,HPO
35006,Shallow Nasolabial Fold,general,"HPO exact synonym for Underdeveloped Nasolabial Fold. HPO HP:0010801: Reduced bulkiness of the crease or fold of skin running from the lateral margin of the nose, where nasal base meets the skin of the face, to a point just lateral to the corner of the mouth (cheilion or commissure).",general,shallow nasolabial fold,HPO
35007,Shallow Orbital Ridges,general,HPO exact synonym for Underdeveloped Supraorbital Ridges. HPO HP:0009891: Flatness of the supraorbital portion of the frontal bones.,general,shallow orbital ridges,HPO
35008,Shallow Orbits,general,HPO HP:0000586: Reduced depth of the orbits associated with prominent-appearing ocular globes.,general,shallow orbits,HPO
35009,Shallow Palm Line,general,HPO exact synonym for Decreased Palmar Creases. HPO HP:0006184: Poorly defined or shallow palmar creases.,general,shallow palm line,HPO
35010,Shallow Palmar Creases,general,HPO exact synonym for Decreased Palmar Creases. HPO HP:0006184: Poorly defined or shallow palmar creases.,general,shallow palmar creases,HPO
35011,Shallow Philtrum,general,"HPO exact synonym for Smooth Philtrum. HPO HP:0000319: Flat skin surface, with no ridge formation in the central region of the upper lip between the nasal base and upper vermilion border.",general,shallow philtrum,HPO
35012,Shallow Supraorbital Ridge,general,HPO exact synonym for Underdeveloped Supraorbital Ridges. HPO HP:0009891: Flatness of the supraorbital portion of the frontal bones.,general,shallow supraorbital ridge,HPO
35013,Shared Psychosis,mental_health,HPO exact synonym for Folie À Deux. HPO HP:5200418: Delusional beliefs are transmitted from one individual to another.,mental_behavioral,shared psychosis,HPO
35014,Shark Teeth,general,"HPO HP:4000168: Eruption of permanent teeth behind deciduous (baby) teeth before they have fallen out, resulting in a double row of teeth. This phenomen is typically observed between the ages of 5 to 7 years.",general,shark teeth,HPO
35015,Shark Tooth,oral,"HPO exact synonym for Conical Tooth. HPO HP:0000698: An abnormal conical form of the teeth, that is, a tooth whose sides converge or taper together incisally.",oral,shark tooth,HPO
35016,Shark Tooth Incisor,oral,HPO exact synonym for Conical Incisor. HPO HP:0011065: An abnormal conical morphology of the incisor tooth.,oral,shark tooth incisor,HPO
35017,Sharp,general,"HPO HP:0025281: Applied to pain that is described as sharp, i.e., sudden and severe.",general,sharp,HPO
35018,Sharp Shin Sign,general,HPO exact synonym for Tibialis Anterior Muscle Atrophy. HPO HP:0011399: Wasting of the tibialis anterior muscle.,general,sharp shin sign,HPO
35019,Shawl Scrotum,general,HPO HP:0000049: Superior margin of the scrotum superior to the base of the penis.,general,shawl scrotum,HPO
35020,Shawl Sign,general,"HPO HP:0025535: Erythematous, poikilodermatous macules distributed in a shawl pattern over the shoulders, arms and upper back.",general,shawl sign,HPO
35021,Shell Teeth,general,"HPO exact synonym for Odontodysplasia. HPO HP:0000694: The diagnosis odontodysplasia requires clinical and radiological exams, in which unusually large pulp chambers and large pulp room chambers with thin enamel and dentin are visible. It may affect either a single tooth or several teeth.",general,shell teeth,HPO
35022,Shellfish Allergy,general,"HPO HP:0025848: Hypersensitivity in form of an adverse immune reaction against shellfish (an aquatic shelled mollusc such as an oyster or mussel, or a crustacean such as a crab or shrimp).",general,shellfish allergy,HPO
35023,Sherman's Disease,general,HPO exact synonym for Morbus Scheuermann. HPO HP:0010891: A developmental growth retardation of the vertebral end plates that may lead to secondary destruction of the vertebral end plates and protrusion of the nucleus pulposus into the vertebral body (so called Schmorl's nodes as seen on x-r,general,sherman s disease,HPO
35024,Shield Chest,general,HPO HP:0000914: A broad chest.,general,shield chest,HPO
35025,Shivering,general,HPO HP:0025144: Involuntary contraction or twitching of the muscles.,general,shivering,HPO
35026,Shock,general,"HPO HP:0031273: The state in which profound and widespread reduction of effective tissue perfusion leads first to reversible, and then if prolonged, to irreversible cellular injury.",general,shock,HPO
35027,"Shock, Unspecified",general,"ICD-10-CM R57.9: Shock, unspecified",general,shock unspecified,ICD-10-CM
35028,Shoe-shaped Sella Turcica,general,HPO HP:0005723: Human Phenotype Ontology term HP:0005723: Shoe-shaped Sella Turcica.,general,shoe shaped sella turcica,HPO
35029,Shopaholic,general,HPO exact synonym for Addictive Spending Behavior. HPO HP:5200333: An uncontrollable urge to shop and spend money can lead to distress or impairment.,general,shopaholic,HPO
35030,Shopping Addiction,general,HPO exact synonym for Addictive Spending Behavior. HPO HP:5200333: An uncontrollable urge to shop and spend money can lead to distress or impairment.,general,shopping addiction,HPO
35031,Short 1st Long Bone of Foot,musculoskeletal,HPO exact synonym for Short First Metatarsal. HPO HP:0010105: Short first metatarsal bone.,musculoskeletal,short 1st long bone of foot,HPO
35032,Short 1st Metacarpal,general,HPO HP:0010034: A developmental defect characterized by reduced length of the first metacarpal (long bone) of the hand.,general,short 1st metacarpal,HPO
35033,Short 2nd Finger,general,"HPO HP:0009536: Hypoplasia of the second finger, also known as the index finger.",general,short 2nd finger,HPO
35034,Short 2nd Long Bone of Foot,musculoskeletal,HPO exact synonym for Short Second Metatarsal. HPO HP:0011845: Short (hypoplastic) second metatarsal bone.,musculoskeletal,short 2nd long bone of foot,HPO
35035,Short 2nd Metacarpal,general,HPO HP:0010038: Short second metacarpal bone because of developmental hypoplasia.,general,short 2nd metacarpal,HPO
35036,Short 2nd Toe,general,HPO HP:0001885: Underdevelopment (hypoplasia) of the second toe.,general,short 2nd toe,HPO
35037,Short 2nd Toe Bone,musculoskeletal,HPO exact synonym for Short Phalanx of the 2nd Toe. HPO HP:0010431: Reduced length of one or more phalanx of second toe as a result of developmental hypoplasia.,musculoskeletal,short 2nd toe bone,HPO
35038,Short 3rd Finger,general,HPO HP:0009461: Hypoplastic/small 3rd (middle) finger.,general,short 3rd finger,HPO
