symptom_id,symptom_name,category,description,related_body_system,search_name,source
16478,Endoarterial Hypercellularity Within Arcuate Artery Consisting of Lymphocytes,general,HPO exact synonym for Arcuate Artery Endoarterial Lymphocyte Hypercellularity. HPO HP:0033930: A type of arcuate artery endoarterial leukocyte hypercellularity due to the presence of increased number of lymphocytes in the lumen of arcuate artery.,general,endoarterial hypercellularity within arcuate artery consisting of lymphocytes,HPO
16479,Endoarterial Hypercellularity Within Arcuate Artery Consisting of Neutrophils,general,HPO exact synonym for Arcuate Artery Endoarterial Neutrophil Hypercellularity. HPO HP:0033929: A type of arcuate artery endoarterial leukocyte hypercellularity due to the presence of increased numbers of neutrophils withinin the lumen of arcuate artery.,general,endoarterial hypercellularity within arcuate artery consisting of neutrophils,HPO
16480,Endoarterial Hypercellularity Within Arterioles,general,HPO exact synonym for Renal Arteriole Endoarterial Hypercellularity. HPO HP:0033921: Abnormal and excessive number of cells (hypercellularity) in the lining (endothelium) of the arterioles of the kidney.,general,endoarterial hypercellularity within arterioles,HPO
16481,Endoarterial Hypercellularity Within Arterioles Consisting of Foam Cells,general,"HPO exact synonym for Renal Arteriole Foam Cell Endoarterial Hypercellularity. HPO HP:0033923: A type of renal arteriole leukocytic endoarterial hypercellularity due to the presence of lipid-filled cells, often a macrophage, with a vacuolated appearance in arteriolar lumen.",general,endoarterial hypercellularity within arterioles consisting of foam cells,HPO
16482,Endoarterial Hypercellularity Within Arterioles Consisting of Lymphocytes,general,HPO exact synonym for Renal Arteriole Lymphocyte Endoarterial Hypercellularity. HPO HP:0033925: A type of renal arteriole leukocytic endoarterial hypercellularity due to the presence of increased number of lymphocytes in the arteriolar lumen.,general,endoarterial hypercellularity within arterioles consisting of lymphocytes,HPO
16483,Endoarterial Hypercellularity Within Arterioles Consisting of Neutrophils,general,HPO exact synonym for Renal Arteriole Neutrophil Endoarterial Hypercellularity. HPO HP:0033924: A type of renal arteriole leukocytic endoarterial hypercellularity due to the presence of increased numbers of neutrophils within the arteriolar lumen.,general,endoarterial hypercellularity within arterioles consisting of neutrophils,HPO
16484,Endoarterial Hypercellularity Within Interlobular Artery,general,HPO exact synonym for Cortical Radial Artery Hypercellularity. HPO HP:0033954: Proliferation of endothelial cells (increased number of cells) of the lining (endothelium) of the cortical radial arteries (also known as interlobular arteries) of the kidney.,general,endoarterial hypercellularity within interlobular artery,HPO
16485,Endoarterial Hypercellularity Within Interlobular Artery Consisting of Leukocytes,general,HPO exact synonym for Cortical Radial Artery Leukocyte Hypercellularity. HPO HP:0033955: A type of cortical radial artery endoarterial hypercellularity due to increased numbers of white blood cells (leukocytes).,general,endoarterial hypercellularity within interlobular artery consisting of leukocytes,HPO
16486,Endoarterial Hypercellularity Within Interlobular Artery Consisting of Lymphocytes,general,HPO exact synonym for Cortical Radial Artery Lymphocyte Hypercellularity. HPO HP:0033956: A type of cortical radial artery endoarterial leukocyte hypercellularity due to the presence of increased number of lymphocytes in the lumen of cortical radial arteries.,general,endoarterial hypercellularity within interlobular artery consisting of lymphocytes,HPO
16487,Endobrachyesophagus,general,HPO exact synonym for Barrett Esophagus. HPO HP:0100580: An abnormal change (metaplasia) in the cells of the inferior portion of the esophagus. The normal squamous epithelium lining of the esophagus is replaced by metaplastic columnar epithelium. Columnar epithelium refers to a cell type th,general,endobrachyesophagus,HPO
16488,Endobronchial Telangiectasia,general,HPO exact synonym for Bronchial Telangiectasia. HPO HP:0033370: Telangiectasias (small dilated blood vessels located near the surface of the skin or mucous membranes) located in the trachoebronchial system.,general,endobronchial telangiectasia,HPO
16489,Endocapillary Hypercellularity,general,"HPO exact synonym for Glomerular Endocapillary Hypercellularity. HPO HP:0025363: Hypercellularity due to increased number of cells within glomerular capillary lumina, causing narrowing of the lumina.",general,endocapillary hypercellularity,HPO
16490,Endocapillary Hypercellularity Within Interlobular Arterial Endothelium Consisting of Foam Cells,general,"HPO exact synonym for Cortical Radial Artery Foam Cell Hypercellularity. HPO HP:0033958: A type of cortical radial artery endoarterial leukocyte hypercellularity due to the presence of lipid-filled cells, often macrophages, with a vacuolated appearance in the lumen of cortical radial artery (also known as the interlobular",general,endocapillary hypercellularity within interlobular arterial endothelium consisting of foam cells,HPO
16491,Endocapillary Hypercellularity Within Interlobular Arterial Endothelium Consisting of Neutrophils,general,HPO exact synonym for Cortical Radial Artery Neutrophil Hypercellularity. HPO HP:0033957: A type of cortical radial artery endoarterial leukocyte hypercellularity due to the presence of increased numbers of neutrophils in the lumen of cortical radial arteries.,general,endocapillary hypercellularity within interlobular arterial endothelium consisting of neutrophils,HPO
16492,Endocardial Cushion Defect,general,HPO exact synonym for Atrioventricular Canal Defect. HPO HP:0006695: A defect of the atrioventricular septum of the heart.,general,endocardial cushion defect,HPO
16493,Endocardial Fibroelastosis,general,HPO HP:0001706: Diffuse thickening of the ventricular endocardium and by associated myocardial dysfunction,general,endocardial fibroelastosis,HPO
16494,Endocardial Fibrosis,general,HPO HP:0006685: The presence of excessive connective tissue in the endocardium.,general,endocardial fibrosis,HPO
16495,Endocarditis,general,"HPO HP:0100584: An inflammation of the endocardium, the inner layer of the heart, which usually involves the heart valves.",general,endocarditis,HPO
16496,Endocrine Neoplasia,general,HPO exact synonym for Neoplasm of the Endocrine System. HPO HP:0100568: A tumor (abnormal growth of tissue) of the endocrine system.,general,endocrine neoplasia,HPO
16497,Endocrine-type Tubular Atrophy,general,"HPO HP:0032609: A type of renal tubular atrophy characterized by endocrine-like appearance of tubules, which are small and have narrow lumina, clear cells, and relatively thin basement membranes.",general,endocrine type tubular atrophy,HPO
16498,Endocrinization Pattern of Tubular Atrophy,general,"HPO exact synonym for Endocrine-type Tubular Atrophy. HPO HP:0032609: A type of renal tubular atrophy characterized by endocrine-like appearance of tubules, which are small and have narrow lumina, clear cells, and relatively thin basement membranes.",general,endocrinization pattern of tubular atrophy,HPO
16499,Endogenous Lipoid Pneumonia,general,"HPO HP:0033365: A type of lipoid pneumonia in which the source of the lipids is the body itself. When an airway is obstructed, it is often the case that distal to the obstruction, lipid-laden macrophages and giant cells fill the lumen of the disconnected airspace.",general,endogenous lipoid pneumonia,HPO
16500,Endolymphatic Sac Tumor,general,"HPO HP:0030393: A low-grade papillary epithelial neoplasm (adenocarcinoma) with a slow growth pattern. The endolymphatic duct emerges from the posterior wall of the saccule (of the inner ear) and ends in a blind pouch, the endolymphatic sac. Endolymphatic sac tumors (ELSTs) are known under different names in the literature (Heffner tumor, aggressive papillary middle ear tumor, and low-grade adenocarcinoma of endolymphatic sac origin).",general,endolymphatic sac tumor,HPO
16501,Endolymphatic Sac Tumour,general,"HPO exact synonym for Endolymphatic Sac Tumor. HPO HP:0030393: A low-grade papillary epithelial neoplasm (adenocarcinoma) with a slow growth pattern. The endolymphatic duct emerges from the posterior wall of the saccule (of the inner ear) and ends in a blind pouch, the endolymphatic sac. Endolymp",general,endolymphatic sac tumour,HPO
16502,Endometrial Carcinoma,general,"HPO HP:0012114: A carcinoma of the endometrium, the mucous lining of the uterus.",general,endometrial carcinoma,HPO
16503,Endometrial Inflammation,general,HPO exact synonym for Endometritis. HPO HP:0025636: Inflammation of the inner lining of the uterus (endometrium).,general,endometrial inflammation,HPO
16504,Endometriosis,general,HPO HP:0030127: The growth of endometrial tissue outside the uterus.,general,endometriosis,HPO
16505,Endometritis,general,HPO HP:0025636: Inflammation of the inner lining of the uterus (endometrium).,general,endometritis,HPO
16506,Endomyocardial Fibrosis,general,HPO exact synonym for Endocardial Fibrosis. HPO HP:0006685: The presence of excessive connective tissue in the endocardium.,general,endomyocardial fibrosis,HPO
16507,Endomysial Fibrosis,general,"HPO exact synonym for Increased Endomysial Connective Tissue. HPO HP:0100297: An increased volume of the endomysium, which is a connective tissue sheath that surrounds each muscle fiber. Together, bundles of muscle fibers form a fasciculus, surrounded by another layer of connective tissue called the perimysium.",general,endomysial fibrosis,HPO
16508,Endopolyploidy On Chromosome Studies of Bone Marrow,musculoskeletal,HPO HP:0003352: An increase in the number of chromosome sets per cell in bone marrow cells.,musculoskeletal,endopolyploidy on chromosome studies of bone marrow,HPO
16509,Endosteal Scalloping,general,HPO HP:0034969: A series of indentations or erosions on a normally smooth margin of the inner layer of the cortex (i.e. the endosteum) of bones.,general,endosteal scalloping,HPO
16510,Endotheliosis Within Arcuate Arteries,general,HPO exact synonym for Arcuate Artery Endotheliosis. HPO HP:0033902: Enlargement of endothelial cells of the arcuate arteries of the kidney because of cytoplasmic swelling.,general,endotheliosis within arcuate arteries,HPO
16511,Endotheliosis Within Interlobular Arteries,general,HPO exact synonym for Cortical Radial Artery Endotheliosis. HPO HP:0033953: Enlargement of endothelial cells of the cortical radial arteries (also known as the interlobular arteries) of the kidney because of cytoplasmic swelling.,general,endotheliosis within interlobular arteries,HPO
16512,Endplate Irregularities,general,"HPO exact synonym for Irregular Vertebral Endplates. HPO HP:0003301: An irregular surface of the vertebral end plates, which are normally relatively smooth.",general,endplate irregularities,HPO
16513,Endplate Irregularity,general,"HPO exact synonym for Irregular Vertebral Endplates. HPO HP:0003301: An irregular surface of the vertebral end plates, which are normally relatively smooth.",general,endplate irregularity,HPO
16514,Endplate Sclerosis,general,HPO exact synonym for Sclerotic Vertebral Endplates. HPO HP:0004576: Sclerosis (increased density) affecting vertebral end plates.,general,endplate sclerosis,HPO
16515,Enhanced Neurotoxicity of Vincristine,general,HPO HP:0003009: Human Phenotype Ontology term HP:0003009: Enhanced Neurotoxicity of Vincristine.,general,enhanced neurotoxicity of vincristine,HPO
16516,Enhanced Ristocetin Cofactor Assay Activity,general,HPO HP:0030136: Abnormal response to ristocetin as manifested by increased aggregation of platelets upon addition of low-dose ristocetin to platelet-rich plasma.,general,enhanced ristocetin cofactor assay activity,HPO
16517,Enhancement of the C-reflex,general,"HPO HP:0001340: Increase in amplitude of a long-loop response upon somatosensory evoked potential testing, representing an electrically evoked myoclonic response.",general,enhancement of the c reflex,HPO
16518,Enlarged Adrenal Glands,urinary,HPO exact synonym for Adrenal Hyperplasia. HPO HP:0008221: Enlargement of the adrenal gland.,urinary,enlarged adrenal glands,HPO
16519,Enlarged Alveolar Ridge,general,HPO exact synonym for Alveolar Ridge Overgrowth. HPO HP:0009085: Increased width of the alveolar ridges.,general,enlarged alveolar ridge,HPO
16520,Enlarged Amygdala,general,HPO HP:0033669: A increase in the volume (size) of the amygdyla.,general,enlarged amygdala,HPO
16521,Enlarged and Thickened Heart Muscle,musculoskeletal,"HPO exact synonym for Hypertrophic Cardiomyopathy. HPO HP:0001639: Hypertrophic cardiomyopathy (HCM) is defined by the presence of increased ventricular wall thickness or mass in the absence of loading conditions (hypertension, valve disease) sufficient to cause the observed abnormality.",musculoskeletal,enlarged and thickened heart muscle,HPO
16522,Enlarged Antitragus,general,HPO exact synonym for Prominent Antitragus. HPO HP:0008593: Increased anterosuperior prominence of the area between the bottom of the incisura and the inner margin of the antihelix.,general,enlarged antitragus,HPO
16523,Enlarged Aorta,general,"HPO exact synonym for Aortic Aneurysm. HPO HP:0004942: Aortic dilatation refers to a dimension that is greater than the 95th percentile for the normal person age, sex and body size. In contrast, an aneurysm is defined as a localized dilation of the aorta that is more than 150 percent of p",general,enlarged aorta,HPO
16524,Enlarged Aortic Root,general,HPO exact synonym for Aortic Root Aneurysm. HPO HP:0002616: An abnormal localized widening (dilatation) of the aortic root.,general,enlarged aortic root,HPO
16525,Enlarged Basal Cistern,general,HPO exact synonym for Enlarged Fossa Interpeduncularis. HPO HP:0100951: Human Phenotype Ontology term HP:0100951: Enlarged Fossa Interpeduncularis.,general,enlarged basal cistern,HPO
16526,Enlarged Brainstem,general,HPO HP:0012755: Abnormal increase in size of the brainstem.,general,enlarged brainstem,HPO
16527,Enlarged Capital Femoral Epiphyses,oral,HPO exact synonym for Enlargement of the Proximal Femoral Epiphysis. HPO HP:0003371: An abnormal enlargement of the proximal epiphysis of the femur.,oral,enlarged capital femoral epiphyses,HPO
16528,Enlarged Cerebellum,general,HPO HP:0012081: An abnormally increased size of the cerebellum compared to other brain structures.,general,enlarged cerebellum,HPO
16529,Enlarged Cerebral Ventricles,general,HPO exact synonym for Ventriculomegaly. HPO HP:0002119: An increase in size of the ventricular system of the brain.,general,enlarged cerebral ventricles,HPO
16530,Enlarged Cisterna Magna,general,"HPO HP:0002280: Increase in size of the cisterna magna, one of three principal openings in the subarachnoid space between the arachnoid and pia mater, located between the cerebellum and the dorsal surface of the medulla oblongata.",general,enlarged cisterna magna,HPO
16531,Enlarged Clitoris,general,HPO exact synonym for Clitoral Hypertrophy. HPO HP:0008665: Hypertrophy of the clitoris.,general,enlarged clitoris,HPO
16532,Enlarged Cochlear Aqueduct,general,"HPO HP:0011388: Increased size of the cochlear duct, i.e., of a duct that communicates between the perilymphatic space and the subarachnoid space, and transmits a vein from the cochlea to join the internal jugular.",general,enlarged cochlear aqueduct,HPO
16533,Enlarged Colon Lacking Nerve Cells,general,"HPO exact synonym for Aganglionic Megacolon. HPO HP:0002251: An abnormality resulting from a lack of intestinal ganglion cells (i.e., an aganglionic section of bowel) that results in bowel obstruction with enlargement of the colon.",general,enlarged colon lacking nerve cells,HPO
16534,Enlarged Cornea,general,HPO exact synonym for Megalocornea. HPO HP:0000485: An enlargement of the cornea with normal clarity and function. Megalocornea is diagnosed with a horizontal corneal diameter of 12 mm or more at birth or 13 mm or more after two years of age.,general,enlarged cornea,HPO
16535,Enlarged Coronary Sinus,general,HPO exact synonym for Coronary Sinus Enlargement. HPO HP:0031298: Abnormal increase in size of the coronary sinus.,general,enlarged coronary sinus,HPO
16536,Enlarged Costochondral Junctions,general,"HPO exact synonym for Enlargement of the Costochondral Junction. HPO HP:0000920: Abnormally increased size of the costochondral junctions, which are located between the distal part of the ribs and the costal cartilages, which are bars of hyaline cartilage that connect the ribs to the sternum.",general,enlarged costochondral junctions,HPO
16537,Enlarged Distal Tibial Epiphysis,general,HPO HP:6000886: Size (volume) of the distal epiphysis of the tiba above the upper limit of normal.,general,enlarged distal tibial epiphysis,HPO
16538,Enlarged End Part of Finger Bones,musculoskeletal,HPO exact synonym for Enlarged Epiphyses of the Phalanges of the Hand. HPO HP:0010231: Abnormally large size of the epiphyses of the phalanges of the fingers with respect to age-dependent norms.,musculoskeletal,enlarged end part of finger bones,HPO
16539,Enlarged End Part of Innermost Long Bone of Index Finger,musculoskeletal,HPO exact synonym for Enlarged Epiphysis of the Proximal Phalanx of the 2nd Finger. HPO HP:0009527: Human Phenotype Ontology term HP:0009527: Enlarged Epiphysis of the Proximal Phalanx of the 2nd Finger.,musculoskeletal,enlarged end part of innermost long bone of index finger,HPO
16540,Enlarged End Part of Innermost Long Bone of the Middle Finger,musculoskeletal,HPO exact synonym for Enlarged Epiphysis of the Proximal Phalanx of the 3rd Finger. HPO HP:0009349: Abnormally large size of the epiphysis located at the proximal end of the proximal phalanx of the 3rd finger with respect to age-dependent norms.,musculoskeletal,enlarged end part of innermost long bone of the middle finger,HPO
16541,Enlarged End Part of Innermost Thighbone,musculoskeletal,HPO exact synonym for Enlargement of the Proximal Femoral Epiphysis. HPO HP:0003371: An abnormal enlargement of the proximal epiphysis of the femur.,musculoskeletal,enlarged end part of innermost thighbone,HPO
16542,Enlarged End Part of Long Bone of Hand,musculoskeletal,"HPO exact synonym for Enlarged Metacarpal Epiphyses. HPO HP:0006134: Abnormally large size of one or more growth plates (epiphyses) of the metacarpal bones (i.e., the tubular bones of the hand between the carpus and the phalanges).",musculoskeletal,enlarged end part of long bone of hand,HPO
16543,Enlarged End Part of Middle Finger Bone,musculoskeletal,HPO exact synonym for Enlarged Epiphyses of the 3rd Finger. HPO HP:0009413: Abnormally large size of the epiphyses of the 3rd finger with respect to age-dependent norms.,musculoskeletal,enlarged end part of middle finger bone,HPO
16544,Enlarged End Part of the 1st Long Bone of Foot,musculoskeletal,HPO exact synonym for Enlarged Epiphysis of the 1st Metatarsal. HPO HP:0010152: Human Phenotype Ontology term HP:0010152: Enlarged Epiphysis of the 1st Metatarsal.,musculoskeletal,enlarged end part of the 1st long bone of foot,HPO
16545,Enlarged End Part of the 1st Long Bone of Hand,musculoskeletal,HPO exact synonym for Enlarged Epiphysis of the 1st Metacarpal. HPO HP:0010018: Abnormally large size of the epiphyses of the 1st metacarpal with respect to age-dependent norms.,musculoskeletal,enlarged end part of the 1st long bone of hand,HPO
16546,Enlarged End Part of the 2nd Toe Bone,musculoskeletal,HPO exact synonym for Enlarged Epiphyses of the 2nd Toe. HPO HP:0100047: Human Phenotype Ontology term HP:0100047: Enlarged Epiphyses of the 2nd Toe.,musculoskeletal,enlarged end part of the 2nd toe bone,HPO
16547,Enlarged End Part of the 3rd Toe Bone,musculoskeletal,HPO exact synonym for Enlarged Epiphyses of the 3rd Toe. HPO HP:0100058: Human Phenotype Ontology term HP:0100058: Enlarged Epiphyses of the 3rd Toe.,musculoskeletal,enlarged end part of the 3rd toe bone,HPO
16548,Enlarged End Part of the 4th Toe Bone,musculoskeletal,HPO exact synonym for Enlarged Epiphyses of the 4th Toe. HPO HP:0100069: Human Phenotype Ontology term HP:0100069: Enlarged Epiphyses of the 4th Toe.,musculoskeletal,enlarged end part of the 4th toe bone,HPO
16549,Enlarged End Part of the Big Toe Bone,musculoskeletal,HPO exact synonym for Enlarged Epiphyses of the Hallux. HPO HP:0010116: Human Phenotype Ontology term HP:0010116: Enlarged Epiphyses of the Hallux.,musculoskeletal,enlarged end part of the big toe bone,HPO
16550,Enlarged End Part of the Index Finger,general,HPO exact synonym for Enlarged Epiphyses of the 2nd Finger. HPO HP:0009491: Abnormally large size of the epiphyses of the 2nd finger with respect to age-dependent norms.,general,enlarged end part of the index finger,HPO
16551,Enlarged End Part of the Innermost Bone of Little Finger,musculoskeletal,HPO exact synonym for Enlarged Epiphysis of the Proximal Phalanx of the 5th Finger. HPO HP:0009158: Abnormally large size of the epiphysis located at the proximal end of the proximal phalanx of the 5th finger with respect to age-dependent norms.,musculoskeletal,enlarged end part of the innermost bone of little finger,HPO
16552,Enlarged End Part of the Innermost Bone of Pinkie Finger,musculoskeletal,HPO exact synonym for Enlarged Epiphysis of the Proximal Phalanx of the 5th Finger. HPO HP:0009158: Abnormally large size of the epiphysis located at the proximal end of the proximal phalanx of the 5th finger with respect to age-dependent norms.,musculoskeletal,enlarged end part of the innermost bone of pinkie finger,HPO
16553,Enlarged End Part of the Innermost Bone of Pinky Finger,musculoskeletal,HPO exact synonym for Enlarged Epiphysis of the Proximal Phalanx of the 5th Finger. HPO HP:0009158: Abnormally large size of the epiphysis located at the proximal end of the proximal phalanx of the 5th finger with respect to age-dependent norms.,musculoskeletal,enlarged end part of the innermost bone of pinky finger,HPO
16554,Enlarged End Part of the Innermost Bone of the 2nd Toe,musculoskeletal,HPO exact synonym for Enlarged Epiphysis of the Proximal Phalanx of the 2nd Toe. HPO HP:0100125: Human Phenotype Ontology term HP:0100125: Enlarged Epiphysis of the Proximal Phalanx of the 2nd Toe.,musculoskeletal,enlarged end part of the innermost bone of the 2nd toe,HPO
16555,Enlarged End Part of the Innermost Bone of the 3rd Toe,musculoskeletal,HPO exact synonym for Enlarged Epiphysis of the Proximal Phalanx of the 3rd Toe. HPO HP:0100160: Human Phenotype Ontology term HP:0100160: Enlarged Epiphysis of the Proximal Phalanx of the 3rd Toe.,musculoskeletal,enlarged end part of the innermost bone of the 3rd toe,HPO
16556,Enlarged End Part of the Innermost Bone of the 4th Toe,musculoskeletal,HPO exact synonym for Enlarged Epiphysis of the Proximal Phalanx of the 4th Toe. HPO HP:0100194: Human Phenotype Ontology term HP:0100194: Enlarged Epiphysis of the Proximal Phalanx of the 4th Toe.,musculoskeletal,enlarged end part of the innermost bone of the 4th toe,HPO
16557,Enlarged End Part of the Innermost Bone of the Big Toe,musculoskeletal,HPO exact synonym for Enlarged Epiphysis of the Proximal Phalanx of the Hallux. HPO HP:0010130: Human Phenotype Ontology term HP:0010130: Enlarged Epiphysis of the Proximal Phalanx of the Hallux.,musculoskeletal,enlarged end part of the innermost bone of the big toe,HPO
16558,Enlarged End Part of the Innermost Bone of the Little Toe,musculoskeletal,HPO exact synonym for Enlarged Epiphysis of the Proximal Phalanx of the 5th Toe. HPO HP:0100227: Human Phenotype Ontology term HP:0100227: Enlarged Epiphysis of the Proximal Phalanx of the 5th Toe.,musculoskeletal,enlarged end part of the innermost bone of the little toe,HPO
16559,Enlarged End Part of the Innermost Bone of the Pinkie Toe,musculoskeletal,HPO exact synonym for Enlarged Epiphysis of the Proximal Phalanx of the 5th Toe. HPO HP:0100227: Human Phenotype Ontology term HP:0100227: Enlarged Epiphysis of the Proximal Phalanx of the 5th Toe.,musculoskeletal,enlarged end part of the innermost bone of the pinkie toe,HPO
16560,Enlarged End Part of the Innermost Bone of the Pinky Toe,musculoskeletal,HPO exact synonym for Enlarged Epiphysis of the Proximal Phalanx of the 5th Toe. HPO HP:0100227: Human Phenotype Ontology term HP:0100227: Enlarged Epiphysis of the Proximal Phalanx of the 5th Toe.,musculoskeletal,enlarged end part of the innermost bone of the pinky toe,HPO
16561,Enlarged End Part of the Innermost Bone of the Ring Finger,musculoskeletal,HPO exact synonym for Enlarged Epiphysis of the Proximal Phalanx of the 4th Finger. HPO HP:0009264: Abnormally large size of the epiphysis located at the proximal end of the proximal phalanx of the 4th finger with respect to age-dependent norms.,musculoskeletal,enlarged end part of the innermost bone of the ring finger,HPO
16562,Enlarged End Part of the Innermost Hand Bones,musculoskeletal,HPO exact synonym for Enlarged Epiphyses of the Proximal Phalanges of the Hand. HPO HP:0010271: Human Phenotype Ontology term HP:0010271: Enlarged Epiphyses of the Proximal Phalanges of the Hand.,musculoskeletal,enlarged end part of the innermost hand bones,HPO
16563,Enlarged End Part of the Little Finger Bones,musculoskeletal,HPO exact synonym for Enlarged Epiphyses of the 5th Finger. HPO HP:0009385: Abnormally large size of the epiphyses of the 5th finger with respect to age-dependent norms.,musculoskeletal,enlarged end part of the little finger bones,HPO
16564,Enlarged End Part of the Little Toe Bone,musculoskeletal,HPO exact synonym for Enlarged Epiphyses of the 5th Toe. HPO HP:0100080: Human Phenotype Ontology term HP:0100080: Enlarged Epiphyses of the 5th Toe.,musculoskeletal,enlarged end part of the little toe bone,HPO
