symptom_id,symptom_name,category,description,related_body_system,search_name,source
24478,Irregular Epiphysis of the Distal Phalanx of the Hallux,general,HPO HP:0010143: Human Phenotype Ontology term HP:0010143: Irregular Epiphysis of the Distal Phalanx of the Hallux.,general,irregular epiphysis of the distal phalanx of the hallux,HPO
24479,Irregular Epiphysis of the Distal Phalanx of the Thumb,general,HPO HP:0009680: Uneven radiographic opacity of the epiphysis of the distal phalanx of the thumb.,general,irregular epiphysis of the distal phalanx of the thumb,HPO
24480,Irregular Epiphysis of the Middle Phalanx of the 2nd Finger,general,HPO HP:0009518: Human Phenotype Ontology term HP:0009518: Irregular Epiphysis of the Middle Phalanx of the 2nd Finger.,general,irregular epiphysis of the middle phalanx of the 2nd finger,HPO
24481,Irregular Epiphysis of the Middle Phalanx of the 2nd Toe,general,HPO HP:0100116: Human Phenotype Ontology term HP:0100116: Irregular Epiphysis of the Middle Phalanx of the 2nd Toe.,general,irregular epiphysis of the middle phalanx of the 2nd toe,HPO
24482,Irregular Epiphysis of the Middle Phalanx of the 3rd Finger,general,HPO HP:0009326: Irregular radiographic opacity of the epiphysis of the middle phalanx of the 3rd finger.,general,irregular epiphysis of the middle phalanx of the 3rd finger,HPO
24483,Irregular Epiphysis of the Middle Phalanx of the 3rd Toe,general,HPO HP:0100151: Human Phenotype Ontology term HP:0100151: Irregular Epiphysis of the Middle Phalanx of the 3rd Toe.,general,irregular epiphysis of the middle phalanx of the 3rd toe,HPO
24484,Irregular Epiphysis of the Middle Phalanx of the 4th Finger,general,HPO HP:0009219: Irregular radiographic opacity of the epiphysis of the middle phalanx of the 4th finger.,general,irregular epiphysis of the middle phalanx of the 4th finger,HPO
24485,Irregular Epiphysis of the Middle Phalanx of the 4th Toe,general,HPO HP:0100185: Human Phenotype Ontology term HP:0100185: Irregular Epiphysis of the Middle Phalanx of the 4th Toe.,general,irregular epiphysis of the middle phalanx of the 4th toe,HPO
24486,Irregular Epiphysis of the Middle Phalanx of the 5th Finger,general,HPO HP:0009208: Irregular radiographic opacity of the epiphysis of the middle phalanx of the 5th finger.,general,irregular epiphysis of the middle phalanx of the 5th finger,HPO
24487,Irregular Epiphysis of the Middle Phalanx of the 5th Toe,general,HPO HP:0100218: Human Phenotype Ontology term HP:0100218: Irregular Epiphysis of the Middle Phalanx of the 5th Toe.,general,irregular epiphysis of the middle phalanx of the 5th toe,HPO
24488,Irregular Epiphysis of the Proximal Phalanx of the 2nd Finger,general,HPO HP:0009529: Human Phenotype Ontology term HP:0009529: Irregular Epiphysis of the Proximal Phalanx of the 2nd Finger.,general,irregular epiphysis of the proximal phalanx of the 2nd finger,HPO
24489,Irregular Epiphysis of the Proximal Phalanx of the 2nd Toe,general,HPO HP:0100127: Human Phenotype Ontology term HP:0100127: Irregular Epiphysis of the Proximal Phalanx of the 2nd Toe.,general,irregular epiphysis of the proximal phalanx of the 2nd toe,HPO
24490,Irregular Epiphysis of the Proximal Phalanx of the 3rd Finger,general,HPO HP:0009351: Irregular radiographic opacity of the epiphysis of the proximal phalanx of the 3rd finger.,general,irregular epiphysis of the proximal phalanx of the 3rd finger,HPO
24491,Irregular Epiphysis of the Proximal Phalanx of the 3rd Toe,general,HPO HP:0100162: Human Phenotype Ontology term HP:0100162: Irregular Epiphysis of the Proximal Phalanx of the 3rd Toe.,general,irregular epiphysis of the proximal phalanx of the 3rd toe,HPO
24492,Irregular Epiphysis of the Proximal Phalanx of the 4th Finger,general,HPO HP:0009266: Irregular radiographic opacity of the epiphysis of the proximal phalanx of the 4th finger.,general,irregular epiphysis of the proximal phalanx of the 4th finger,HPO
24493,Irregular Epiphysis of the Proximal Phalanx of the 4th Toe,general,HPO HP:0100196: Human Phenotype Ontology term HP:0100196: Irregular Epiphysis of the Proximal Phalanx of the 4th Toe.,general,irregular epiphysis of the proximal phalanx of the 4th toe,HPO
24494,Irregular Epiphysis of the Proximal Phalanx of the 5th Finger,general,HPO HP:0009199: Irregular radiographic opacity of the epiphysis of the proximal phalanx of the 5th finger.,general,irregular epiphysis of the proximal phalanx of the 5th finger,HPO
24495,Irregular Epiphysis of the Proximal Phalanx of the 5th Toe,general,HPO HP:0100229: Human Phenotype Ontology term HP:0100229: Irregular Epiphysis of the Proximal Phalanx of the 5th Toe.,general,irregular epiphysis of the proximal phalanx of the 5th toe,HPO
24496,Irregular Epiphysis of the Proximal Phalanx of the Hallux,general,HPO HP:0010132: Human Phenotype Ontology term HP:0010132: Irregular Epiphysis of the Proximal Phalanx of the Hallux.,general,irregular epiphysis of the proximal phalanx of the hallux,HPO
24497,Irregular Epiphysis of the Proximal Phalanx of the Thumb,general,"HPO HP:0009669: Irregular radiographic opacity of the epiphysis of the proximal phalanx of the thumb. In contrast to the proximal phalanges of the digits 2-5, the proximal phalanx of the thumb is embryologically equivalent to the middle phalanges of the other digits, whereas the first metacarpal is embryologically of phalangeal origin and as such equivalent to the proximal phalanges of the other digits.",general,irregular epiphysis of the proximal phalanx of the thumb,HPO
24498,Irregular Femoral Epiphysis,oral,HPO HP:0006361: Human Phenotype Ontology term HP:0006361: Irregular Femoral Epiphysis.,oral,irregular femoral epiphysis,HPO
24499,Irregular Finger Bones,musculoskeletal,HPO exact synonym for Irregular Phalanges. HPO HP:0006205: Alteration of the normally smooth radiographic contour of phalanges producing an irregular appearance.,musculoskeletal,irregular finger bones,HPO
24500,Irregular Heart Beat,general,HPO exact synonym for Arrhythmia. HPO HP:0011675: Any cardiac rhythm other than the normal sinus rhythm. Such a rhythm may be either of sinus or ectopic origin and either regular or irregular. An arrhythmia may be due to a disturbance in impulse formation or conduction or both.,general,irregular heart beat,HPO
24501,Irregular Heartbeat,general,HPO exact synonym for Arrhythmia. HPO HP:0011675: Any cardiac rhythm other than the normal sinus rhythm. Such a rhythm may be either of sinus or ectopic origin and either regular or irregular. An arrhythmia may be due to a disturbance in impulse formation or conduction or both.,general,irregular heartbeat,HPO
24502,Irregular Humeral Epiphyses,general,HPO HP:0003896: Human Phenotype Ontology term HP:0003896: Irregular Humeral Epiphyses.,general,irregular humeral epiphyses,HPO
24503,Irregular Humeral Metaphyses,general,HPO exact synonym for Humeral Metaphyseal Irregularity. HPO HP:0003913: Human Phenotype Ontology term HP:0003913: Humeral Metaphyseal Irregularity.,general,irregular humeral metaphyses,HPO
24504,Irregular Hyperpigmentation,general,HPO HP:0007400: Human Phenotype Ontology term HP:0007400: Irregular Hyperpigmentation.,general,irregular hyperpigmentation,HPO
24505,Irregular Hyperpigmentation of Back,musculoskeletal,HPO HP:0007521: Human Phenotype Ontology term HP:0007521: Irregular Hyperpigmentation of Back.,musculoskeletal,irregular hyperpigmentation of back,HPO
24506,Irregular Iliac Crest,general,"HPO HP:0003796: Irregularity of the iliac crest, which is the superior border of the wing of the ilium.",general,irregular iliac crest,HPO
24507,Irregular Innermost Shankbone End Part,musculoskeletal,HPO exact synonym for Irregular Proximal Tibial Epiphyses. HPO HP:0006456: Anomaly of the contour of the proximal epiphysis of the tibia such that its normally smooth appearance is irregular.,musculoskeletal,irregular innermost shankbone end part,HPO
24508,Irregular Innermost Shinbone End Part,musculoskeletal,HPO exact synonym for Irregular Proximal Tibial Epiphyses. HPO HP:0006456: Anomaly of the contour of the proximal epiphysis of the tibia such that its normally smooth appearance is irregular.,musculoskeletal,irregular innermost shinbone end part,HPO
24509,Irregular Lacy Iliac Crest,general,HPO exact synonym for Iliac Crest Serration. HPO HP:0008786: Irregularities of the iliac crest that produce the appearance of a lace border around it.,general,irregular lacy iliac crest,HPO
24510,Irregular Long Bones of Hand,musculoskeletal,HPO exact synonym for Irregular Metacarpals. HPO HP:0006160: Irregular morphology of one or more metacarpal bones.,musculoskeletal,irregular long bones of hand,HPO
24511,Irregular Lymph-node Lymphocyte Nuclei,general,HPO HP:0020279: Lymph node lymphocyte nuclei that are more irregular than the typical round to slightly oval shapes of the majority of lymph node lymphocytes.,general,irregular lymph node lymphocyte nuclei,HPO
24512,Irregular Menses,general,HPO exact synonym for Irregular Menstruation. HPO HP:0000858: Abnormally high variation in the amount of time between periods.,general,irregular menses,HPO
24513,Irregular Menstrual Periods,reproductive,Menstrual cycle variation; clinical term: menstrual irregularity.,reproductive,irregular menstrual periods,Clinical_Curated
24514,Irregular Menstruation,general,HPO HP:0000858: Abnormally high variation in the amount of time between periods.,general,irregular menstruation,HPO
24515,Irregular Metacarpals,general,HPO HP:0006160: Irregular morphology of one or more metacarpal bones.,general,irregular metacarpals,HPO
24516,Irregular Metaphyses,general,HPO exact synonym for Metaphyseal Irregularity. HPO HP:0003025: Irregularity of the normally smooth surface of the metaphyses.,general,irregular metaphyses,HPO
24517,Irregular Metaphyses of Elbow,general,HPO exact synonym for Distal Humeral Metaphyseal Irregularity. HPO HP:0003951: Irregularity of the normally smooth surface of the metaphysis at the distal end of the humerus (at the elbow).,general,irregular metaphyses of elbow,HPO
24518,Irregular Metaphyses of the Upper Limbs,musculoskeletal,HPO exact synonym for Upper-limb Metaphyseal Irregularity. HPO HP:0003850: Human Phenotype Ontology term HP:0003850: Upper-limb Metaphyseal Irregularity.,musculoskeletal,irregular metaphyses of the upper limbs,HPO
24519,Irregular Myelin Foldings,general,HPO exact synonym for Myelin Outfoldings. HPO HP:0004336: The presence of excessive redundant myelin in the peripheral nerve sheath.,general,irregular myelin foldings,HPO
24520,Irregular Myelin Loops,general,HPO HP:0007208: Presence of irregular redundant loops of focally folded myelin in a peripheral nerve.,general,irregular myelin loops,HPO
24521,Irregular Olecranon,general,HPO HP:0004034: Human Phenotype Ontology term HP:0004034: Irregular Olecranon.,general,irregular olecranon,HPO
24522,Irregular Ossification At Anterior Rib Ends,general,HPO HP:0006598: Human Phenotype Ontology term HP:0006598: Irregular Ossification At Anterior Rib Ends.,general,irregular ossification at anterior rib ends,HPO
24523,Irregular Ossification of Hand Bones,musculoskeletal,HPO HP:0004280: Human Phenotype Ontology term HP:0004280: Irregular Ossification of Hand Bones.,musculoskeletal,irregular ossification of hand bones,HPO
24524,Irregular Ossification of Humeral Metaphyses,general,HPO HP:0003914: Human Phenotype Ontology term HP:0003914: Irregular Ossification of Humeral Metaphyses.,general,irregular ossification of humeral metaphyses,HPO
24525,Irregular Ossification of the Humeral Epiphyses,general,HPO HP:0003897: Human Phenotype Ontology term HP:0003897: Irregular Ossification of the Humeral Epiphyses.,general,irregular ossification of the humeral epiphyses,HPO
24526,Irregular Ossification of the Radial Metaphysis,general,HPO HP:0004020: Human Phenotype Ontology term HP:0004020: Irregular Ossification of the Radial Metaphysis.,general,irregular ossification of the radial metaphysis,HPO
24527,Irregular Outermost Thighbone End Part,musculoskeletal,HPO exact synonym for Irregular Distal Femoral Epiphysis. HPO HP:0006407: Anomaly of the contour of the Distal epiphysis of femur such that its normally smooth appearance is irregular.,musculoskeletal,irregular outermost thighbone end part,HPO
24528,Irregular P-P Interval,general,HPO HP:6001087: Abnormally increased variability in the timing between consecutive P-waves on an electrocardiogram.,general,irregular p p interval,HPO
24529,Irregular Patellae,general,HPO HP:0006369: An alteration of the normally relatively smooth margins of the kneecap in radiographic images leading to an irregular contour.,general,irregular patellae,HPO
24530,Irregular Patellar Contour,general,HPO exact synonym for Irregular Patellae. HPO HP:0006369: An alteration of the normally relatively smooth margins of the kneecap in radiographic images leading to an irregular contour.,general,irregular patellar contour,HPO
24531,Irregular Patellar Margins,general,HPO exact synonym for Irregular Patellae. HPO HP:0006369: An alteration of the normally relatively smooth margins of the kneecap in radiographic images leading to an irregular contour.,general,irregular patellar margins,HPO
24532,Irregular Periods,general,HPO exact synonym for Irregular Menstruation. HPO HP:0000858: Abnormally high variation in the amount of time between periods.,general,irregular periods,HPO
24533,Irregular Phalanges,general,HPO HP:0006205: Alteration of the normally smooth radiographic contour of phalanges producing an irregular appearance.,general,irregular phalanges,HPO
24534,Irregular Proximal Femoral Epiphyses,oral,HPO exact synonym for Irregular Capital Femoral Epiphysis. HPO HP:0005041: Irregular surface of the normally relatively smooth capital femoral epiphysis.,oral,irregular proximal femoral epiphyses,HPO
24535,Irregular Proximal Femoral Metaphyses,oral,HPO exact synonym for Proximal Femoral Metaphyseal Irregularity. HPO HP:0003411: Irregularity of the normally smooth surface of the proximal metaphysis of the femur.,oral,irregular proximal femoral metaphyses,HPO
24536,Irregular Proximal Humeral Metaphyses,general,HPO exact synonym for Proximal Humeral Metaphyseal Irregularity. HPO HP:0005043: Irregularity of the normally smooth surface of the metaphysis at the proximal end of the humerus (at the shoulder).,general,irregular proximal humeral metaphyses,HPO
24537,Irregular Proximal Tibial Epiphyses,general,HPO HP:0006456: Anomaly of the contour of the proximal epiphysis of the tibia such that its normally smooth appearance is irregular.,general,irregular proximal tibial epiphyses,HPO
24538,Irregular Pupil,general,HPO exact synonym for Abnormal Pupil Shape. HPO HP:0025309: A deviation from the normal circular shape of the pupil,general,irregular pupil,HPO
24539,Irregular Radial Epiphyses,general,HPO HP:0004004: Human Phenotype Ontology term HP:0004004: Irregular Radial Epiphyses.,general,irregular radial epiphyses,HPO
24540,Irregular Radial Metaphysis,general,HPO exact synonym for Radial Metaphyseal Irregularity. HPO HP:0004019: Irregularity of the normally smooth surface of the metaphysis of the radius.,general,irregular radial metaphysis,HPO
24541,Irregular Respiration,general,HPO HP:0012195: Uneven rhythm of breathing.,general,irregular respiration,HPO
24542,Irregular Respiratory Rhythm,respiratory,HPO exact synonym for Irregular Respiration. HPO HP:0012195: Uneven rhythm of breathing.,respiratory,irregular respiratory rhythm,HPO
24543,Irregular RR Interval,general,HPO HP:6001086: Abnormal increased variability in the timing between consecutive R-waves on an electrocardiogram.,general,irregular rr interval,HPO
24544,Irregular Sclerosis of Hand Bones,musculoskeletal,HPO HP:0004281: Human Phenotype Ontology term HP:0004281: Irregular Sclerosis of Hand Bones.,musculoskeletal,irregular sclerosis of hand bones,HPO
24545,Irregular Sclerotic Endplates,general,HPO HP:0008476: Human Phenotype Ontology term HP:0008476: Irregular Sclerotic Endplates.,general,irregular sclerotic endplates,HPO
24546,Irregular Septal Thickening On Pulmonary HRCT,general,HPO HP:0025174: Thickening of the interlobular septa of the lungs as seen on a high-resolution computed tomography scan with an irregular appearance of the interlobular septa. THis feature is often associated with distortion of lung architecture.,general,irregular septal thickening on pulmonary hrct,HPO
24547,Irregular Tarsal Bones,musculoskeletal,HPO HP:0004688: Human Phenotype Ontology term HP:0004688: Irregular Tarsal Bones.,musculoskeletal,irregular tarsal bones,HPO
24548,Irregular Tarsal Centers,general,"HPO exact synonym for Irregular Tarsal Ossification. HPO HP:0008134: Defective ossification in an irregular pattern of the seven bones of the foot comprising the calcaneus, talus, cuboid, navicular, and the cuneiform bones.",general,irregular tarsal centers,HPO
24549,Irregular Tarsal Centres,general,"HPO exact synonym for Irregular Tarsal Ossification. HPO HP:0008134: Defective ossification in an irregular pattern of the seven bones of the foot comprising the calcaneus, talus, cuboid, navicular, and the cuneiform bones.",general,irregular tarsal centres,HPO
24550,Irregular Tarsal Ossification,general,"HPO HP:0008134: Defective ossification in an irregular pattern of the seven bones of the foot comprising the calcaneus, talus, cuboid, navicular, and the cuneiform bones.",general,irregular tarsal ossification,HPO
24551,Irregular Teeth,general,HPO exact synonym for Irregular Dentition. HPO HP:0040079: Human Phenotype Ontology term HP:0040079: Irregular Dentition.,general,irregular teeth,HPO
24552,Irregular Thighbone End Part,musculoskeletal,HPO exact synonym for Irregular Femoral Epiphysis. HPO HP:0006361: Human Phenotype Ontology term HP:0006361: Irregular Femoral Epiphysis.,musculoskeletal,irregular thighbone end part,HPO
24553,Irregular Thumb Epiphysis,general,HPO HP:0009691: Uneven radiographic opacity of the one or more epiphyses of the thumb.,general,irregular thumb epiphysis,HPO
24554,Irregular Ulnar Metaphysis,general,HPO exact synonym for Ulnar Metaphyseal Irregularity. HPO HP:0004042: Irregularity of the normally smooth surface of the metaphysis of the ulna.,general,irregular ulnar metaphysis,HPO
24555,Irregular Vertebral Endplates,general,"HPO HP:0003301: An irregular surface of the vertebral end plates, which are normally relatively smooth.",general,irregular vertebral endplates,HPO
24556,Irregular Vertebral Plates,general,"HPO exact synonym for Irregular Vertebral Endplates. HPO HP:0003301: An irregular surface of the vertebral end plates, which are normally relatively smooth.",general,irregular vertebral plates,HPO
24557,Irregular Visual Pursuit Movements,general,HPO exact synonym for Abnormality of Ocular Smooth Pursuit. HPO HP:0000617: An abnormality of eye movement characterized by impaired smooth-pursuit eye movements.,general,irregular visual pursuit movements,HPO
24558,Irregular Wide Portion of a Long Bone,musculoskeletal,HPO exact synonym for Metaphyseal Irregularity. HPO HP:0003025: Irregularity of the normally smooth surface of the metaphyses.,musculoskeletal,irregular wide portion of a long bone,HPO
24559,Irregular Wide Portion of Elbow Bone,musculoskeletal,HPO exact synonym for Distal Humeral Metaphyseal Irregularity. HPO HP:0003951: Irregularity of the normally smooth surface of the metaphysis at the distal end of the humerus (at the elbow).,musculoskeletal,irregular wide portion of elbow bone,HPO
24560,Irregular Wide Portion of Long Bone in Upper Arm,musculoskeletal,HPO exact synonym for Humeral Metaphyseal Irregularity. HPO HP:0003913: Human Phenotype Ontology term HP:0003913: Humeral Metaphyseal Irregularity.,musculoskeletal,irregular wide portion of long bone in upper arm,HPO
24561,Irregular Wide Portion of Upper Limb Bones,musculoskeletal,HPO exact synonym for Upper-limb Metaphyseal Irregularity. HPO HP:0003850: Human Phenotype Ontology term HP:0003850: Upper-limb Metaphyseal Irregularity.,musculoskeletal,irregular wide portion of upper limb bones,HPO
24562,"Irregular, Dense End Plate",general,HPO exact synonym for Irregular Sclerotic Endplates. HPO HP:0008476: Human Phenotype Ontology term HP:0008476: Irregular Sclerotic Endplates.,general,irregular dense end plate,HPO
24563,"Irregular, Rachitic-like Metaphyses",general,"HPO HP:0005042: Human Phenotype Ontology term HP:0005042: Irregular, Rachitic-like Metaphyses.",general,irregular rachitic like metaphyses,HPO
24564,Irregularity of the Retinal Pigment Epithelium Layer On OCT,general,"HPO HP:0020033: Lack of uniformity in the morphology of the retinal pigment epithelium (RPE) layer observed on optical coherence tomography (OCT) imaging. The RPE lies between the neurosensory retina (photoreceptors) and Bruch membrane/choroid, and normally appears as a thin, hyperreflective (bright) band on OCT imaging. This term comprises irregularities which may manifest as thickening, thinning, undulations, or loss of normal reflectivity, potentially affecting retinal structure or function.",general,irregularity of the retinal pigment epithelium layer on oct,HPO
24565,Irregularity of Vertebral Bodies,general,HPO HP:0004582: Human Phenotype Ontology term HP:0004582: Irregularity of Vertebral Bodies.,general,irregularity of vertebral bodies,HPO
24566,Irregularity of Wide Portion of Calf Bone,musculoskeletal,HPO exact synonym for Fibular Metaphyseal Irregularity. HPO HP:0030293: Irregularity of the normally smooth surface of a metaphysis of a fibula.,musculoskeletal,irregularity of wide portion of calf bone,HPO
24567,Irregularly Shaped Keratohyaline Granules,general,HPO HP:0034944: Abnormal shape of keratohyaline granules in dermal keratinocytes.,general,irregularly shaped keratohyaline granules,HPO
24568,Irregularly Shaped Lymph Node Germinal Centers,hematologic,HPO HP:0020248: A deviation from the typically fairly round or oval form of a lymph node germinal center.,general,irregularly shaped lymph node germinal centers,HPO
24569,Irregularly Shaped Sperm Tail,general,HPO HP:0033393: Irregular or changing caliber (diameter) along the tail of the sperm.,general,irregularly shaped sperm tail,HPO
24570,Irregularly Spaced Teeth,general,"HPO HP:0006316: Irregular distribution of the teeth along the dental arch, i.e., and irregular spatial pattern of teeth.",general,irregularly spaced teeth,HPO
24571,Irreversible Airflow Obstruction,general,HPO HP:0033541: Airflow obstruction without significant response to a bronchodilator defined as an increase in FEV1 and/or FVC by 12 percent or more and by at least 200 mL.,general,irreversible airflow obstruction,HPO
24572,Irreversible Pulmonary Obstruction,general,HPO exact synonym for Irreversible Airflow Obstruction. HPO HP:0033541: Airflow obstruction without significant response to a bronchodilator defined as an increase in FEV1 and/or FVC by 12 percent or more and by at least 200 mL.,general,irreversible pulmonary obstruction,HPO
24573,Irritability,mental_health,Easily annoyed or angered; clinical term: irritability.,mental_behavioral,irritability,Clinical_Curated
24574,Irritability and Anger,mental_health,ICD-10-CM R45.4: Irritability and anger,mental_behavioral,irritability and anger,ICD-10-CM
24575,Irritable,general,"HPO exact synonym for Irritability. HPO HP:0000737: An emotional state characterized by negative feelings of heightened frustration, annoyance, or feeling upset, often triggered by internal factors (e.g., fatigue, hunger, unfulfilled desires) or external factors (e.g., social or enviro",general,irritable,HPO
24576,Irritable Mood,mental_health,"HPO exact synonym for Irritability. HPO HP:0000737: An emotional state characterized by negative feelings of heightened frustration, annoyance, or feeling upset, often triggered by internal factors (e.g., fatigue, hunger, unfulfilled desires) or external factors (e.g., social or enviro",mental_behavioral,irritable mood,HPO
24577,Ischaemic Bone Necrosis,musculoskeletal,HPO exact synonym for Avascular Necrosis. HPO HP:0010885: A disease where there is cellular death (necrosis) of bone components due to interruption of the blood supply.,musculoskeletal,ischaemic bone necrosis,HPO
24578,Ischaemic Stroke,neurological,HPO exact synonym for Ischemic Stroke. HPO HP:0002140: Acute ischemic stroke (AIS) is defined by the sudden loss of blood flow to an area of the brain with the resulting loss of neurologic function. It is caused by thrombosis or embolism that occludes a cerebral vessel supplying a specifi,nervous,ischaemic stroke,HPO
24579,Ischemic Bone Necrosis,musculoskeletal,HPO exact synonym for Avascular Necrosis. HPO HP:0010885: A disease where there is cellular death (necrosis) of bone components due to interruption of the blood supply.,musculoskeletal,ischemic bone necrosis,HPO
24580,Ischemic Stroke,neurological,"HPO HP:0002140: Acute ischemic stroke (AIS) is defined by the sudden loss of blood flow to an area of the brain with the resulting loss of neurologic function. It is caused by thrombosis or embolism that occludes a cerebral vessel supplying a specific area of the brain. During a vessel occlusion, there is a core area where damage to the brain is irreversible and an area of penumbra where the brain has lost function owing to decreased blood flow but is not irreversibly injured.",nervous,ischemic stroke,HPO
24581,Iselin Disease,general,HPO exact synonym for Fifth Metatarsal Apophysitis. HPO HP:6001344: Iselin's disease is a traction apophysitis of base of fifth metatarsal. The apophysis is within the peroneus brevis tendon insertion site and appears radiographically at about age 10 in female and age 12 in male and usually fuses by a,general,iselin disease,HPO
