symptom_id,symptom_name,category,description,related_body_system,search_name,source
32515,Pulmonary Blood Flow Redistribution,general,"HPO HP:0033674: Pulmonary blood flow redistribution refers to any departure from the normal distribution of blood flow in the lungs that is caused by an increase in pulmonary vascular resistance elsewhere in the pulmonary vascular bed. Pulmonary blood flow redistribution is indicated by a decrease in the size and/or number of visible pulmonary vessels in one or more lung regions, with a corresponding increase in number and/or size of pulmonary vessels in other parts of the lung.",general,pulmonary blood flow redistribution,HPO
32516,Pulmonary Bulla,general,"HPO HP:0032446: Pulmonary bullae are rounded focal regions of emphysema with a thin wall which measure more than 1 cm in diameter. They are often subpleural in location and are typically larger in the apices. In some cases, bullae can be very large and result in compression of adjacent lung tissue. A giant bulla is arbitrarily defined as one that occupies at least one third of the volume of a hemithorax. When large, bullae can simulate pneumothorax. The most common cause is paraseptal emphysema but bullae may also be seen in association with centrilobular emphysema.",general,pulmonary bulla,HPO
32517,Pulmonary Bullae,general,"HPO exact synonym for Pulmonary Bulla. HPO HP:0032446: Pulmonary bullae are rounded focal regions of emphysema with a thin wall which measure more than 1 cm in diameter. They are often subpleural in location and are typically larger in the apices. In some cases, bullae can be very large a",general,pulmonary bullae,HPO
32518,Pulmonary Capillary Angioectasia,general,HPO HP:0033427: Focal accumulation of dilated pulmonary capillaries.,general,pulmonary capillary angioectasia,HPO
32519,Pulmonary Capillary Hemangiomatosis,general,HPO HP:0005954: Human Phenotype Ontology term HP:0005954: Pulmonary Capillary Hemangiomatosis.,general,pulmonary capillary hemangiomatosis,HPO
32520,Pulmonary Carcinoid Tumor,general,"HPO HP:0030445: A malignant neuroendocrine tumor of the lung. According to histopathologic criteria (WHO 2004), carcinoids are divided into four groups i.e. typical and atypical carcinoids, large cell neuroendocrine carcinoma and small cell lung carcinoma.",general,pulmonary carcinoid tumor,HPO
32521,Pulmonary Carcinoid Tumour,general,"HPO exact synonym for Pulmonary Carcinoid Tumor. HPO HP:0030445: A malignant neuroendocrine tumor of the lung. According to histopathologic criteria (WHO 2004), carcinoids are divided into four groups i.e. typical and atypical carcinoids, large cell neuroendocrine carcinoma and small cell lung carc",general,pulmonary carcinoid tumour,HPO
32522,Pulmonary Cavern,general,"HPO exact synonym for Pulmonary Cavity. HPO HP:0033655: A gas-filled space, seen as lucency or low-attenuation area, within a nodule, mass or area of parenchymal consolidations. It has a clearly defined wall over 4 mm thick.",general,pulmonary cavern,HPO
32523,Pulmonary Cavitation,general,"HPO exact synonym for Pulmonary Cavity. HPO HP:0033655: A gas-filled space, seen as lucency or low-attenuation area, within a nodule, mass or area of parenchymal consolidations. It has a clearly defined wall over 4 mm thick.",general,pulmonary cavitation,HPO
32524,Pulmonary Cavity,general,"HPO HP:0033655: A gas-filled space, seen as lucency or low-attenuation area, within a nodule, mass or area of parenchymal consolidations. It has a clearly defined wall over 4 mm thick.",general,pulmonary cavity,HPO
32525,Pulmonary Chondroma,general,HPO HP:0031474: A benign cartilaginous tumors of the lung.,general,pulmonary chondroma,HPO
32526,Pulmonary Cylindroma,general,"HPO HP:0034637: A cylindroma located in the lung. Cylindromas are well-circumscribed, smooth, pale pink nodular tumors, often with arborizing vessels visible. The tumors are slow growing and vary in size from a few millimeters to over 5 mm.",general,pulmonary cylindroma,HPO
32527,Pulmonary Cyst,general,"HPO HP:0032445: A round circumscribed space within a lung that is surrounded by an epithelial or fibrous wall of variable thickness. A cyst usually has a thin and regular wall (less than 2 mm) and contains air, although some may contain fluid.",general,pulmonary cyst,HPO
32528,Pulmonary Edema,cardiovascular,HPO HP:0100598: Fluid accumulation in the lungs.,cardiovascular,pulmonary edema,HPO
32529,Pulmonary Embolism,general,"HPO HP:0002204: An embolus (that is, an abnormal particle circulating in the blood) located in the pulmonary artery and thereby blocking blood circulation to the lung. Usually the embolus is a blood clot that has developed in an extremity (for instance, a deep venous thrombosis), detached, and traveled through the circulation before becoming trapped in the pulmonary artery.",general,pulmonary embolism,HPO
32530,Pulmonary Emphysema,general,HPO exact synonym for Emphysema. HPO HP:0002097: Human Phenotype Ontology term HP:0002097: Emphysema.,general,pulmonary emphysema,HPO
32531,Pulmonary Eosinophilic Infiltrate,general,"HPO exact synonym for Eosinophilic Pneumonia. HPO HP:0032071: The presence of eosinophils in lung tissue, generally as detected by tissue biopsy, with or without blood eosinophilia.",general,pulmonary eosinophilic infiltrate,HPO
32532,Pulmonary Eosinophilic Infiltration,general,"HPO exact synonym for Eosinophilic Pneumonia. HPO HP:0032071: The presence of eosinophils in lung tissue, generally as detected by tissue biopsy, with or without blood eosinophilia.",general,pulmonary eosinophilic infiltration,HPO
32533,Pulmonary Fat Embolism,general,"HPO HP:0032008: The release of fat globules into the venous circulation, thereby blocking blood circulation to the lung.",general,pulmonary fat embolism,HPO
32534,Pulmonary Fibrosis,general,HPO HP:0002206: Replacement of normal lung tissues by fibroblasts and collagen.,general,pulmonary fibrosis,HPO
32535,Pulmonary Granulomatosis,general,HPO HP:0030250: The presence of multiple granulomata (small nodular inflammatory lesions containing grouped mononuclear phagocytes) in the lung.,general,pulmonary granulomatosis,HPO
32536,Pulmonary Haemorrhage,general,"HPO exact synonym for Pulmonary Hemorrhage. HPO HP:0040223: Pulmonary hemorrhage is a bleeding within the lungs. Older children and adults may spit blood or bloody sputum. Neonates, infants and young children usually do not spit up blood. Anemia, pulmonary infiltrates, increasingling bloody re",general,pulmonary haemorrhage,HPO
32537,Pulmonary Hamartoma,general,"HPO HP:0034710: A benign malformation of the lung that includes an abnormal mixture of tissue components such as cartilage, epithelium, fat, or muscle which are common to the lung but without preservation of the organ architecture.",general,pulmonary hamartoma,HPO
32538,Pulmonary Hemangiomas,general,HPO exact synonym for Pulmonary Capillary Hemangiomatosis. HPO HP:0005954: Human Phenotype Ontology term HP:0005954: Pulmonary Capillary Hemangiomatosis.,general,pulmonary hemangiomas,HPO
32539,Pulmonary Hemorrhage,general,"HPO HP:0040223: Pulmonary hemorrhage is a bleeding within the lungs. Older children and adults may spit blood or bloody sputum. Neonates, infants and young children usually do not spit up blood. Anemia, pulmonary infiltrates, increasingling bloody return on BAL and the presence of hemosiderin-laden macrophages in broncho-alveolar lavage (BAL) fluid or lung biopsy can diagnose lung bleeding. Alveolar macrophages contain phagocytosed red blood cells and stain positive for hemosiderin, a product of hemoglobin degradation, after about 48-72 hours following pulmonary hemorraghe. Previous or...",general,pulmonary hemorrhage,HPO
32540,Pulmonary Histoplasmosis,general,"HPO HP:0032258: Infection of the lungs with Histoplasma capsulatum. Symptoms may include fever, headache, weakness, chest pain and dry cough. When imaging is done, chest radiographs may show patchy pneumonia involving one or more lobes with adenopathy of the mediastinum or hilum.",general,pulmonary histoplasmosis,HPO
32541,Pulmonary Hyperplasia,general,"HPO HP:6001258: Pulmonary Hyperplasia is an absolute increase in the number of alveoli, which are mildly enlarged. Pulmonary hyperplasia has been also referred to as polyalveolar lobe and type 3 cystic adenomatoid malformation.",general,pulmonary hyperplasia,HPO
32542,Pulmonary Hypertensive Crisis,general,HPO HP:0033352: Pulmonary hypertensive crisis involves sudden and potentially lethal increases in PAP and PVR that cause acute rise in right atrial and right ventricular end-diastolic pressure accompanied by low cardiac output.,general,pulmonary hypertensive crisis,HPO
32543,Pulmonary Hypoplasia,general,HPO HP:0002089: Human Phenotype Ontology term HP:0002089: Pulmonary Hypoplasia.,general,pulmonary hypoplasia,HPO
32544,Pulmonary Imaging Sign,general,"HPO HP:0033775: An abnormal pulmonary imaging finding defined by eponym or reference to signs, symbols, or naturalistic images.",general,pulmonary imaging sign,HPO
32545,Pulmonary Incompetence,general,HPO exact synonym for Pulmonic Regurgitation. HPO HP:0010444: The retrograde (backwards) flow of blood through the pulmonary valve into the right ventricle during diastole.,general,pulmonary incompetence,HPO
32546,Pulmonary Infection,infectious,HPO exact synonym for Recurrent Pneumonia. HPO HP:0006532: An increased susceptibility to pneumonia as manifested by a history of recurrent episodes of pneumonia.,immune,pulmonary infection,HPO
32547,Pulmonary Infections,infectious,HPO exact synonym for Recurrent Pneumonia. HPO HP:0006532: An increased susceptibility to pneumonia as manifested by a history of recurrent episodes of pneumonia.,immune,pulmonary infections,HPO
32548,"Pulmonary Infections, Recurrent",infectious,HPO exact synonym for Recurrent Pneumonia. HPO HP:0006532: An increased susceptibility to pneumonia as manifested by a history of recurrent episodes of pneumonia.,immune,pulmonary infections recurrent,HPO
32549,Pulmonary Infiltrates,general,HPO HP:0002113: Human Phenotype Ontology term HP:0002113: Pulmonary Infiltrates.,general,pulmonary infiltrates,HPO
32550,Pulmonary Interstitial High-resolution Computed Tomography Abnormality,general,HPO HP:0025389: High-resolution computed tomography (HRCT) can distinguish findings that characterize characterize interstitial lung diseases in a way not possible with other modalities.,general,pulmonary interstitial high resolution computed tomography abnormality,HPO
32551,Pulmonary Interstitial Lymphocyte Infiltration,general,HPO HP:0033582: Abnormal accumulation of lymphocytes in the interstitium of the lung.,general,pulmonary interstitial lymphocyte infiltration,HPO
32552,Pulmonary Interstitial Thickening,general,HPO HP:0033711: Pathological thickening of the pulmonary interstitium visualized radiographically and divided into interlobular and intralobular septal thickening.,general,pulmonary interstitial thickening,HPO
32553,Pulmonary Interstitiatial HRCT Abnormality,general,HPO exact synonym for Pulmonary Interstitial High-resolution Computed Tomography Abnormality. HPO HP:0025389: High-resolution computed tomography (HRCT) can distinguish findings that characterize characterize interstitial lung diseases in a way not possible with other modalities.,general,pulmonary interstitiatial hrct abnormality,HPO
32554,Pulmonary Langerhans Cell Histiocytosis,general,HPO HP:0034769: Accumulation of monoclonal CD1a-positive Langerhans cells in the bronchioles and alveolar interstitium that can cause damage to the lungs.,general,pulmonary langerhans cell histiocytosis,HPO
32555,Pulmonary Lymphangiectasia,general,"HPO HP:0006521: Abnormal dilatation of the pulmonary lymphatic vessels. Lymphatic fluid in the lung is derived from normal leakage of fluid out of the blood capillaries in the lung. In pulmonary lymphangiectasia, the pulmonary lymphatics are not properly connected and become dilated with fluid.",general,pulmonary lymphangiectasia,HPO
32556,Pulmonary Lymphangiectasis,general,"HPO exact synonym for Pulmonary Lymphangiectasia. HPO HP:0006521: Abnormal dilatation of the pulmonary lymphatic vessels. Lymphatic fluid in the lung is derived from normal leakage of fluid out of the blood capillaries in the lung. In pulmonary lymphangiectasia, the pulmonary lymphatics are not prop",general,pulmonary lymphangiectasis,HPO
32557,Pulmonary Lymphangiomyomatosis,general,"HPO HP:0012798: Infiltration of smooth muscle-like cells in lymph vessels as well as the lung (pleura, alveolar septa, bronchi, pulmonary vessels and lymphatics as well as lymph nodes, especially in posterior mediastinum and retroperitoneum). Focal emphysema can develop because of airway narrowing, and the thoracic duct may be obliterated. Pulmonary lymphangiomyomatosis may lead to multiple small cysts with a hamartomatous proliferation of smooth muscle in their walls.",general,pulmonary lymphangiomyomatosis,HPO
32558,Pulmonary Lymphoma,general,HPO HP:0011953: Lung parenchymal involvement with lymphoma.,general,pulmonary lymphoma,HPO
32559,Pulmonary Mass,general,"HPO HP:0033821: A mass in the lung seen on chest imaging is defined as an opacity greater than 3 cm in diameter (without regard to contour, border, or density characteristics).",general,pulmonary mass,HPO
32560,Pulmonary Mycetoma,general,"HPO HP:0033651: A mycetoma is a discrete mass of intertwined hyphae, usually of an Aspergillus species, matted together by mucus, fibrin, and cellular debris colonizing a cavity, usually from prior fibrocavitary disease (eg, tuberculosis or sarcoidosis). A mycetoma may move to a dependent location when the patient changes position and may show an air crescent sign. CT scans may show a spongelike pattern and foci of calcification in the mycetoma.",general,pulmonary mycetoma,HPO
32561,Pulmonary Myomatosis,general,"HPO exact synonym for Pulmonary Lymphangiomyomatosis. HPO HP:0012798: Infiltration of smooth muscle-like cells in lymph vessels as well as the lung (pleura, alveolar septa, bronchi, pulmonary vessels and lymphatics as well as lymph nodes, especially in posterior mediastinum and retroperitoneum). Focal e",general,pulmonary myomatosis,HPO
32562,Pulmonary Necrosis,general,HPO HP:0033243: Cellular death affecting one or more parts of the lung. Necrosis is caused by diverse external and internal factors which result in the unregulated digestion of cell components.,general,pulmonary necrosis,HPO
32563,Pulmonary Nodule,general,"HPO HP:0033608: Focal rounded or ovoid opacity, not more than 3 cm in diameter. Pulmonary nodules are typically observed by chest radiography or computer tomography imaging.",general,pulmonary nodule,HPO
32564,Pulmonary Obstruction,general,HPO exact synonym for Airway Obstruction. HPO HP:0006536: Obstruction of conducting airways of the lung.,general,pulmonary obstruction,HPO
32565,Pulmonary Oligemia,general,"HPO HP:0033671: Oligemia is a reduction in pulmonary blood volume. Most frequently, this reduction is regional, but occasionally it is generalized. Regional oligemia is usually associated with reduced blood flow in the oligemic area. Oligemia appears as a regional or widespread decrease in the size and number of identifiable pulmonary vessels, which is indicative of less than normal blood flow.",general,pulmonary oligemia,HPO
32566,Pulmonary Opacity,general,HPO HP:0031457: Opacity refers to any area that preferentially attenuates the x-ray beam and therefore appears more opaque than the surrounding area. It is a nonspecific term that does not indicate the size or pathologic nature of the abnormality.,general,pulmonary opacity,HPO
32567,Pulmonary Paraglioma,general,"HPO HP:0100636: A rare paranglioma of the lung, tumors that arise from extra-adrenal chromaffin cells.",general,pulmonary paraglioma,HPO
32568,Pulmonary Parenchymal Band,general,"HPO HP:0033650: A parenchymal band is a linear opacity, usually 1-3 mm thick and up to 5 cm long that usually extends to the visceral pleura (which is often thickened and may be retracted at the site of contact). It reflects pleuroparenchymal fibrosis and is usually associated with distortion of the lung architecture. Parenchymal bands are most frequently encountered in individuals who have been exposed to asbestos.",general,pulmonary parenchymal band,HPO
32569,Pulmonary Perfusion Defect,general,"HPO HP:6000412: Lack of blood perfusion in a specific area of the lung. Pulmonary ventilation (V) and Perfusion (Q) scan, also known as lung V/Q scan, is a nuclear test that uses the perfusion scan to delineate the blood flow distribution and the ventilation scan to measure airflow distribution in the lungs.",general,pulmonary perfusion defect,HPO
32570,Pulmonary Pneumatocele,general,"HPO HP:0025419: A pneumatocele is a thin walled, gas-filled space in the lung. It is most frequently caused by acute pneumonia, trauma, or aspiration of hydrocarbon fluid and is usually transient. The mechanism is believed to be a combination of parenchymal necrosis and check-valve airway obstruction. A pneumatocele appears as an approximately round, thin-walled airspace in the lung.",general,pulmonary pneumatocele,HPO
32571,Pulmonary Pneumatocoele,general,"HPO exact synonym for Pulmonary Pneumatocele. HPO HP:0025419: A pneumatocele is a thin walled, gas-filled space in the lung. It is most frequently caused by acute pneumonia, trauma, or aspiration of hydrocarbon fluid and is usually transient. The mechanism is believed to be a combination of pare",general,pulmonary pneumatocoele,HPO
32572,Pulmonary Pseudocavity,general,"HPO HP:0033648: A pseudocavity appears as an oval or round area of low attenuation in lung nodules, masses, or areas of consolidation that represent spared parenchyma, normal or ectatic bronchi, or focal emphysema rather than cavitation. These pseudocavities usually measure less than 1 cm in diameter. They have been described in patients with adenocarcinoma, bronchioloalveolar carcinoma, and benign conditions such as infectious pneumonia.",general,pulmonary pseudocavity,HPO
32573,Pulmonary Scarring,general,HPO exact synonym for Pulmonary Fibrosis. HPO HP:0002206: Replacement of normal lung tissues by fibroblasts and collagen.,general,pulmonary scarring,HPO
32574,Pulmonary Sequestration,general,HPO HP:0100632: The presence of a piece lung tissue which is not attached to the pulmonary blood supply and does not communicate with the other lung tissue (not connected to the standard bronchial airways and not performing a function in respiration).,general,pulmonary sequestration,HPO
32575,Pulmonary Situs Ambiguus,general,"HPO HP:0011617: An abnormality of the pulmonary situs, i.e., of the sidedness of the morphological right and left lungs, in which the morphology of both left and right lungs is the same.",general,pulmonary situs ambiguus,HPO
32576,Pulmonary Situs Ambiguus with Bilateral Morphologic Left Lungs,general,"HPO HP:0011619: An abnormality of the pulmonary situs, i.e., of the sidedness of the morphological right and left lungs, in which both lungs have the morphology of a left lung.",general,pulmonary situs ambiguus with bilateral morphologic left lungs,HPO
32577,Pulmonary Situs Ambiguus with Bilateral Morphologic Right Lungs,general,"HPO HP:0011618: An abnormality of the pulmonary situs, i.e., of the sidedness of the morphological right and left lungs, in which both lungs have the morphology of a right lung.",general,pulmonary situs ambiguus with bilateral morphologic right lungs,HPO
32578,Pulmonary Situs Inversus,general,HPO HP:0011616: Mirror image arrangement of the mainstem bronchi with the right pulmonary artery posterior to the right upper lobe bronchus and the left pulmonary artery anterior to the left upper lobe bronchus.,general,pulmonary situs inversus,HPO
32579,Pulmonary Stenosis,general,"HPO exact synonym for Pulmonic Stenosis. HPO HP:0001642: A narrowing of the right ventricular outflow tract that can occur at the pulmonary valve (valvular stenosis), below the pulmonary valve (infundibular stenosis), or above the pulmonary valve (supravalvar stenosis).",general,pulmonary stenosis,HPO
32580,Pulmonary TB,general,"HPO exact synonym for Pulmonary Tuberculosis. HPO HP:0032262: A lung infection by Mycobacterium tuberculosis a slightly curved non-motile, aerobic, non-capsulated and non-spore forming strains of mycobacteria.",general,pulmonary tb,HPO
32581,Pulmonary Thromboembolism,general,"HPO HP:0034192: Pulmonary embolism is caused by emboli, which have originated from venous thrombi, traveling to and occluding the arteries of the lung.",general,pulmonary thromboembolism,HPO
32582,Pulmonary Tuberculosis,general,"HPO HP:0032262: A lung infection by Mycobacterium tuberculosis a slightly curved non-motile, aerobic, non-capsulated and non-spore forming strains of mycobacteria.",general,pulmonary tuberculosis,HPO
32583,Pulmonary Valve Atresia,general,HPO HP:0010882: A congenital disorder of the pulmonary valve in which the orifice of the valve fails to develop.,general,pulmonary valve atresia,HPO
32584,Pulmonary Valve Defects,general,HPO HP:0005148: Any defect in the valve connecting the heart and the pulmonary artery.,general,pulmonary valve defects,HPO
32585,Pulmonary Valve Dysplasia,general,HPO exact synonym for Dysplastic Pulmonary Valve. HPO HP:0005164: A congenital malformation of the pulmonary valve characterized by leaflet deformation.,general,pulmonary valve dysplasia,HPO
32586,Pulmonary Valve Insufficiency,general,HPO exact synonym for Pulmonic Regurgitation. HPO HP:0010444: The retrograde (backwards) flow of blood through the pulmonary valve into the right ventricle during diastole.,general,pulmonary valve insufficiency,HPO
32587,Pulmonary Valve Regurgitation,general,HPO exact synonym for Pulmonic Regurgitation. HPO HP:0010444: The retrograde (backwards) flow of blood through the pulmonary valve into the right ventricle during diastole.,general,pulmonary valve regurgitation,HPO
32588,Pulmonary Valve Stenosis,general,"HPO exact synonym for Pulmonic Stenosis. HPO HP:0001642: A narrowing of the right ventricular outflow tract that can occur at the pulmonary valve (valvular stenosis), below the pulmonary valve (infundibular stenosis), or above the pulmonary valve (supravalvar stenosis).",general,pulmonary valve stenosis,HPO
32589,Pulmonary Vasculitis,general,"HPO HP:0034705: Cellular inflammation, vessel destruction, and tissue necrosis of the blood vessels of the lung.",general,pulmonary vasculitis,HPO
32590,Pulmonary Vein Dilatation,general,"HPO exact synonym for Pulmonary Vein Varix. HPO HP:0034389: Pulmonary vein varix (PVV), refers to a localized dilatation of a pulmonary vein. PVV is a rare condition and can be congenital or acquired. PVV typically occur at the confluence of the veins adjacent to the left atrium. PVVs are some",general,pulmonary vein dilatation,HPO
32591,Pulmonary Vein Varix,general,"HPO HP:0034389: Pulmonary vein varix (PVV), refers to a localized dilatation of a pulmonary vein. PVV is a rare condition and can be congenital or acquired. PVV typically occur at the confluence of the veins adjacent to the left atrium. PVVs are sometimes classified into three morphological types: saccular, tortuous and confluent.",general,pulmonary vein varix,HPO
32592,Pulmonary Venolobar Syndrome,general,HPO exact synonym for Scimitar Anomaly. HPO HP:0011626: Right pulmonary venous return to the inferior vena cava.,general,pulmonary venolobar syndrome,HPO
32593,Pulmonary Venous Hypertension,cardiovascular,"HPO HP:0030950: An abnormal increase in pressure in the pulmonary veins, usually as a result of left atrial hypertension.",cardiovascular,pulmonary venous hypertension,HPO
32594,Pulmonary Venous Occlusion,general,HPO HP:0006518: Substantial narrowing or blockage of small pulmonary veins as a result of disorganized smooth muscle hypertrophy and collagen matrix deposition.,general,pulmonary venous occlusion,HPO
32595,Pulmonary Venous Stenosis,general,HPO exact synonym for Pulmonary Venous Occlusion. HPO HP:0006518: Substantial narrowing or blockage of small pulmonary veins as a result of disorganized smooth muscle hypertrophy and collagen matrix deposition.,general,pulmonary venous stenosis,HPO
32596,Pulmonary Xanthoma,general,HPO exact synonym for Pulmonary Xanthomatosis. HPO HP:0034626: Lipid deposits localized within the lung. Xanthomas are benign but are often an important visible sign of systemic conditions such as familial hypercholesterolemia.,general,pulmonary xanthoma,HPO
32597,Pulmonary Xanthomatosis,general,HPO HP:0034626: Lipid deposits localized within the lung. Xanthomas are benign but are often an important visible sign of systemic conditions such as familial hypercholesterolemia.,general,pulmonary xanthomatosis,HPO
32598,Pulmonic Infiltration,general,HPO exact synonym for Pulmonary Infiltrates. HPO HP:0002113: Human Phenotype Ontology term HP:0002113: Pulmonary Infiltrates.,general,pulmonic infiltration,HPO
32599,Pulmonic Regurgitation,general,HPO HP:0010444: The retrograde (backwards) flow of blood through the pulmonary valve into the right ventricle during diastole.,general,pulmonic regurgitation,HPO
32600,Pulmonic Stenosis,general,"HPO HP:0001642: A narrowing of the right ventricular outflow tract that can occur at the pulmonary valve (valvular stenosis), below the pulmonary valve (infundibular stenosis), or above the pulmonary valve (supravalvar stenosis).",general,pulmonic stenosis,HPO
32601,Pulmonic Valve Myxoma,general,HPO HP:0006691: A benign tumor of connective tissue containing mucous or gelatinous material (myxoma) localized in the pumonic valve.,general,pulmonic valve myxoma,HPO
32602,Pulmonic Valve Stenosis,general,"HPO exact synonym for Pulmonic Stenosis. HPO HP:0001642: A narrowing of the right ventricular outflow tract that can occur at the pulmonary valve (valvular stenosis), below the pulmonary valve (infundibular stenosis), or above the pulmonary valve (supravalvar stenosis).",general,pulmonic valve stenosis,HPO
