symptom_id,symptom_name,category,description,related_body_system,search_name,source
16979,Erythroid Dysplasia,general,"HPO HP:0031688: Dysplasia in the erythroid lineage, which presents with a variety of morphological changes in the bone marrow, including nuclear budding or irregular nuclear contour in erythroblasts.",general,erythroid dysplasia,HPO
16980,Erythroid Hyperplasia,general,"HPO HP:0012132: Increased count of erythroid precursor cells, that is, erythroid lineage cells in the bone marrow.",general,erythroid hyperplasia,HPO
16981,Erythroid Hypoplasia,general,"HPO HP:0012133: Decreased count of erythroid precursor cells, that is, erythroid lineage cells in the bone marrow.",general,erythroid hypoplasia,HPO
16982,Erythromelalgia,general,"HPO HP:0032147: Recurrent episodes of redness, burning pain, and warmth of the extremities following exposure to heat or exercise with symptoms predominantly involving the feet.",general,erythromelalgia,HPO
16983,Erythropoietin Low in Blood,general,HPO exact synonym for Reduced Circulating Erythropoietin Concentration. HPO HP:0034443: Decreased concentration of erythropoietin in the blood circulation. Erythropoietin is a glycoprotein hormone produced by the peritubular cells of the kidney that stimulates red blood cell production.,general,erythropoietin low in blood,HPO
16984,Eschar,general,"HPO HP:6000793: A type of wound characterized by dry, black, hard necrotic tissue.",general,eschar,HPO
16985,Esodeviation,general,HPO HP:0020045: A manifest or latent ocular deviation in which one or both eyes tends to deviate nasally.,general,esodeviation,HPO
16986,Esophageal Atresia,general,HPO HP:0002032: A developmental defect resulting in complete obliteration of the lumen of the esophagus such that the esophagus ends in a blind pouch rather than connecting to the stomach.,general,esophageal atresia,HPO
16987,Esophageal Candidiasis,general,"HPO exact synonym for Candida Esophagitis. HPO HP:0033351: Candida infections of the esophagus are considered opportunistic infections and are seen most commonly in immunosuppressed patients, the most common symptoms being dysphagia, odynophagia, and retrosternal pain.",general,esophageal candidiasis,HPO
16988,Esophageal Carcinoma,general,HPO HP:0011459: The presence of a carcinoma of the esophagus.,general,esophageal carcinoma,HPO
16989,Esophageal Dilation,general,HPO HP:6000589: Widening (relatively uniform increase in diameter) of a segment of the esophagus.,general,esophageal dilation,HPO
16990,Esophageal Diverticulum,general,HPO HP:0100628: The presence of a diverticulum of the esophagus.,general,esophageal diverticulum,HPO
16991,Esophageal Duplication,general,HPO HP:0100681: A developmental disorder in which there is a duplication of a portion of the muscle and submucosa of the esophagus without epithelial duplication.,general,esophageal duplication,HPO
16992,Esophageal Exudate,general,"HPO HP:0031985: An exudate is a mass of fluid and cells that has seeped out of blood vessels or an organ, usually related to inflammation. In the esophagus, exudates usually present as whitish plagues on the surface of the esophageal mucosa.",general,esophageal exudate,HPO
16993,Esophageal Fibrosis,general,"HPO HP:6000065: Fibrosis located in the subepithelial portion of the esophagus. Fibrosisis is defined by the overgrowth, hardening, and/or scarring of various tissues and is attributed to excess deposition of extracellular matrix components including collagen.",general,esophageal fibrosis,HPO
16994,Esophageal Food Impaction,general,HPO HP:0031984: A piece of food that has gotten stuck in the esophagus and prevents further swallowing.,general,esophageal food impaction,HPO
16995,Esophageal Furrows,general,HPO HP:0031858: Longitudinal grooves in the surface of the esophagus arranged in a longitudinal fashion (from top to bottom of the esophagus).,general,esophageal furrows,HPO
16996,Esophageal Hemangioma,general,"HPO HP:0410270: A hemangioma, a benign tumor of the vascular endothelial cells, that is located in the esophagus.",general,esophageal hemangioma,HPO
16997,Esophageal Leukoplakia,general,HPO HP:0012859: A white patch or plaque occurring on the surface of the esophageal mucous membranes that cannot be rubbed off and cannot be characterized clinically as any other disease.,general,esophageal leukoplakia,HPO
16998,Esophageal Mass,general,HPO HP:6000247: A swelling or enlargement localized to the esophagus. The word mass is usually used at an early stage of the diagnostic workup before the precise nature of the swelling has been determined.,general,esophageal mass,HPO
16999,Esophageal Myenteric Plexus Degeneration,general,HPO HP:0034520: Deterioration of the cells of the myenteric plexus (also known as the Auerbach plexus) located between the layers of the muscular propria of the esophagus.,general,esophageal myenteric plexus degeneration,HPO
17000,Esophageal Neoplasm,general,HPO HP:0100751: A tumor (abnormal growth of tissue) of the esophagus.,general,esophageal neoplasm,HPO
17001,Esophageal Obstruction,general,HPO HP:0005240: Human Phenotype Ontology term HP:0005240: Esophageal Obstruction.,general,esophageal obstruction,HPO
17002,Esophageal Pouch,general,HPO exact synonym for Esophageal Diverticulum. HPO HP:0100628: The presence of a diverticulum of the esophagus.,general,esophageal pouch,HPO
17003,Esophageal Spasms,musculoskeletal,"HPO HP:0025271: Involuntary contractions of the esophagus that are irregular, uncoordinated, and painful.",musculoskeletal,esophageal spasms,HPO
17004,Esophageal Squamous Papilloma,general,"HPO HP:0031463: A rare benign epithelial tumor that is usually asymptomatic but can present with pyrosis and epigastric discomfort with or without dysphagia. Histopathologically, esophageal squamous papilloma has fingerlike projections lined with acanthotic stratified squamous epithelium with conservation of normal cellular with or without cellular atypia.",general,esophageal squamous papilloma,HPO
17005,Esophageal Stenosis,general,HPO HP:0010450: An abnormal narrowing of the lumen of the esophagus.,general,esophageal stenosis,HPO
17006,Esophageal Stricture,general,HPO HP:0002043: A pathological narrowing of the esophagus that is caused by the development of a ring of scar tissue that constricts the esophageal lumen.,general,esophageal stricture,HPO
17007,Esophageal Tumor,general,HPO exact synonym for Esophageal Neoplasm. HPO HP:0100751: A tumor (abnormal growth of tissue) of the esophagus.,general,esophageal tumor,HPO
17008,Esophageal Tumour,general,HPO exact synonym for Esophageal Neoplasm. HPO HP:0100751: A tumor (abnormal growth of tissue) of the esophagus.,general,esophageal tumour,HPO
17009,Esophageal Ulceration,dermatological,"HPO HP:0004791: Defect in the epithelium of the esophagus, essentially an open sore in the lining of the esophagus.",integumentary,esophageal ulceration,HPO
17010,Esophageal Varix,general,HPO HP:0002040: Extreme dilation of the submucusoal veins in the lower portion of the esophagus.,general,esophageal varix,HPO
17011,Esophageal Web,general,"HPO HP:0100594: Thin (2-3mm) membranes of normal esophageal tissue consisting of mucosa and submucosa that can be congenital or acquired. Congenital webs commonly appear in the middle and inferior third of the esophagus, and they are more likely to be circumferential with a central or eccentric orifice. Acquired webs are much more common than congenital webs and typically appear in the cervical area (postcricoid). Clinical symptoms of this condition are selective (solid more than liquids) dysphagia, thoracic pain, nasopharyngeal reflux, aspiration, perforation and food impaction (the last...",general,esophageal web,HPO
17012,Esophagitis,general,HPO HP:0100633: Inflammation of the esophagus.,general,esophagitis,HPO
17013,Esophagus Ulcer,dermatological,"HPO exact synonym for Esophageal Ulceration. HPO HP:0004791: Defect in the epithelium of the esophagus, essentially an open sore in the lining of the esophagus.",integumentary,esophagus ulcer,HPO
17014,Esophoria,general,"HPO HP:0025312: A form of strabismus with both eyes turned inward to a relatively mild degree, usually defined as less than 10 prism diopters.",general,esophoria,HPO
17015,Esotropia,general,"HPO HP:0000565: A form of strabismus with one or both eyes turned inward ('crossed') to a relatively severe degree, usually defined as 10 diopters or more.",general,esotropia,HPO
17016,Essential Tremor,neurological,HPO exact synonym for Kinetic Tremor. HPO HP:0030186: Tremor that occurs during any voluntary movement. It may include visually or non-visually guided movements. Tremor during target directed movement is called intention tremor.,nervous,essential tremor,HPO
17017,Ethanol Ingestion Triggered Symptoms,general,HPO exact synonym for Triggered By Ethanol Ingestion. HPO HP:0025211: Applies to a sign or symptom that is provoked or brought about by drinking or otherwise ingesting ethanol.,general,ethanol ingestion triggered symptoms,HPO
17018,Ethanol Reduces Manifestations,general,HPO exact synonym for Ameliorated By Ethanol Ingestion. HPO HP:0032503: Applies to a sign or symptom that is improved or made more bearable by drinking alcohol (ethanol).,general,ethanol reduces manifestations,HPO
17019,Ethmocephaly,general,"HPO HP:0030779: Ethmocephaly is the rarest form of holoprosencephaly, which occurs due to an incomplete cleavage of the forebrain. Clinically, the disease presents with a proboscis, hypotelorism, microphthalmos and malformed ears.",general,ethmocephaly,HPO
17020,Ethylmalonic Aciduria,general,"HPO HP:0003219: The concentration of ethylmalonic acid in the urine, normalized for urine concentration, is above the upper limit of normal.",general,ethylmalonic aciduria,HPO
17021,Eunuchoid Habitus,general,"HPO HP:0003782: A body habitus that is tall, slim and underweight, with long legs and long arms (i.e., arm span exceeds height by 5 cm or more).",general,eunuchoid habitus,HPO
17022,EUPD,general,"HPO exact synonym for Borderline Personality Disorder. HPO HP:0012076: A personality disorder characterized by impulsive behavior and unpredictable, capricious mood. Affected individuals show a tendency to have outbursts of emotion and an inability to control these behavioral explosions. They generally e",general,eupd,HPO
17023,Euphoria,general,"HPO HP:0031844: Elevation of emotional tone or mood that significantly deviates from normative affective functioning. This state is characterized by an overwhelming and all-encompassing sense of joyous well-being; it is associated with unfounded grandiosity, or grossly inflated self-esteem, rapid speech, impulsivity, and an impaired capacity for self-regulation, irrespective of context.",general,euphoria,HPO
17024,Euphoric Mood,mental_health,HPO exact synonym for Euphoria. HPO HP:0031844: Elevation of emotional tone or mood that significantly deviates from normative affective functioning. This state is characterized by an overwhelming and all-encompassing sense of joyous well-being; it is associated with unfounded gran,mental_behavioral,euphoric mood,HPO
17025,Euryblepharon,general,"HPO HP:0012905: Euryblepharon is a congenital eyelid anomaly characterized by horizontal enlargement of the palpebral fissure. The eyelid is shortened vertically compared with the horizontal dimension, with associated lateral canthal malpositioning and lateral ectropion abnormally wide lid opening.",general,euryblepharon,HPO
17026,Euthyroid Goiter,endocrine_metabolic,HPO HP:0009798: A goiter that is not associated with functional thyroid abnormalities.,endocrine,euthyroid goiter,HPO
17027,Euthyroid Goitre,endocrine_metabolic,HPO exact synonym for Euthyroid Goiter. HPO HP:0009798: A goiter that is not associated with functional thyroid abnormalities.,endocrine,euthyroid goitre,HPO
17028,Euthyroid Hyperthyroxinemia,endocrine_metabolic,HPO HP:0008247: Increased levels of thyroxine without evidence of clinical thyroid disease.,endocrine,euthyroid hyperthyroxinemia,HPO
17029,Euthyroid Multinodular Goiter,endocrine_metabolic,HPO HP:0000866: Human Phenotype Ontology term HP:0000866: Euthyroid Multinodular Goiter.,endocrine,euthyroid multinodular goiter,HPO
17030,Euthyroid Multinodular Goitre,endocrine_metabolic,HPO exact synonym for Euthyroid Multinodular Goiter. HPO HP:0000866: Human Phenotype Ontology term HP:0000866: Euthyroid Multinodular Goiter.,endocrine,euthyroid multinodular goitre,HPO
17031,Event That Disrupts Sleep,mental_health,"HPO exact synonym for Parasomnia. HPO HP:0025234: A clinically observable or self-reported abnormal behavior, experience, or physiological event that occurs in association with sleep, specific sleep stages, or sleep-wake transitions.",mental_behavioral,event that disrupts sleep,HPO
17032,Eversion of Lateral Third of Lower Eyelids,sensory,HPO HP:0007655: Human Phenotype Ontology term HP:0007655: Eversion of Lateral Third of Lower Eyelids.,special_senses,eversion of lateral third of lower eyelids,HPO
17033,Everted Antitragus,general,HPO HP:0011248: Positioning of the antitragus at an angle perpendicular to the plane of the ear (oriented away from the plane of the ear).,general,everted antitragus,HPO
17034,Everted Lips,general,"HPO exact synonym for Eclabion. HPO HP:0012472: A turning outward of the lip or lips, that is, eversion of the lips.",general,everted lips,HPO
17035,Everted Lower Lip,general,"HPO exact synonym for Everted Lower Lip Vermilion. HPO HP:0000232: An abnormal configuration of the lower lip such that it is turned outward i.e., everted, with the Inner aspect of the lower lip vermilion (normally opposing the teeth) being visible in a frontal view.",general,everted lower lip,HPO
17036,Everted Lower Lip Vermilion,general,"HPO HP:0000232: An abnormal configuration of the lower lip such that it is turned outward i.e., everted, with the Inner aspect of the lower lip vermilion (normally opposing the teeth) being visible in a frontal view.",general,everted lower lip vermilion,HPO
17037,Everted Prominent Lower Lip,general,"HPO exact synonym for Everted Lower Lip Vermilion. HPO HP:0000232: An abnormal configuration of the lower lip such that it is turned outward i.e., everted, with the Inner aspect of the lower lip vermilion (normally opposing the teeth) being visible in a frontal view.",general,everted prominent lower lip,HPO
17038,Everted Prominent Upper Lip,general,"HPO exact synonym for Everted Upper Lip Vermilion. HPO HP:0010803: Inner aspect of the upper lip vermilion (normally apposing the teeth) visible in a frontal view, i.e., the presence of an everted upper lip.",general,everted prominent upper lip,HPO
17039,Everted Upper Lip,general,"HPO exact synonym for Everted Upper Lip Vermilion. HPO HP:0010803: Inner aspect of the upper lip vermilion (normally apposing the teeth) visible in a frontal view, i.e., the presence of an everted upper lip.",general,everted upper lip,HPO
17040,Everted Upper Lip Vermilion,general,"HPO HP:0010803: Inner aspect of the upper lip vermilion (normally apposing the teeth) visible in a frontal view, i.e., the presence of an everted upper lip.",general,everted upper lip vermilion,HPO
17041,Ewing Sarcoma,neurological,"HPO HP:0012254: A malignant tumor of the bone which always arises in the medullary tissue, occurring more often in cylindrical bones.",nervous,ewing sarcoma,HPO
17042,Ewing's Sarcoma,neurological,"HPO exact synonym for Ewing Sarcoma. HPO HP:0012254: A malignant tumor of the bone which always arises in the medullary tissue, occurring more often in cylindrical bones.",nervous,ewing s sarcoma,HPO
17043,Exacerbated By,general,HPO exact synonym for Aggravated By. HPO HP:0025285: An aggravating factor is defined as an external factor that leads to a sign or symptom that is already present getting worse or becoming more severe.,general,exacerbated by,HPO
17044,Exacerbated By Acetylcholinesterase Inhibitor Exposure,general,HPO HP:0032525: Applied to a sign or symptom that is worsened by treatment with an acetylcholinesterase inhibitor such as tensilon (edrophonium) or pyridostigmine (Mestinon).,general,exacerbated by acetylcholinesterase inhibitor exposure,HPO
17045,Exacerbated By Amiodarone Exposure,general,HPO HP:0034962: Applied to a sign or symptom that is worsened by treatment with amiodarone.,general,exacerbated by amiodarone exposure,HPO
17046,Exacerbated By Aspirin Exposure,general,HPO HP:0032365: Applied to a sign or symptom that is worsened by ingestion of aspirin.,general,exacerbated by aspirin exposure,HPO
17047,Exacerbated By Barbiturate Exposure,general,HPO HP:0032502: Applied to a sign or symptom that is worsened by taking barbituates.,general,exacerbated by barbiturate exposure,HPO
17048,Exacerbated By Colchicine,general,HPO HP:6001324: Applied to a sign or symptom that is worsened by treatment with colchizine.,general,exacerbated by colchicine,HPO
17049,Exacerbated By Contraceptive Medication Exposure,general,HPO HP:0032501: Applied to a sign or symptom that is worsened by taking contraceptive medication.,general,exacerbated by contraceptive medication exposure,HPO
17050,Exacerbated By Excessive Sweating,general,HPO HP:6001077: Applied to a sign or symptom that is made worse by excessive sweating.,general,exacerbated by excessive sweating,HPO
17051,Exacerbated By Exposure to Sunlight,general,HPO HP:6001075: Applied to a sign or symptom that is worsened by exposure to sunlight.,general,exacerbated by exposure to sunlight,HPO
17052,Exacerbated By Flexion,general,HPO HP:0034802: Applied to a sign or symptom that is aggravated by (or made more painful by) bending of a limb or joint.,general,exacerbated by flexion,HPO
17053,Exacerbated By Head Trauma,general,"HPO HP:0025315: Applies to a sign or symptom that is worsened, aggravated, or exacerbated by head trauma.",general,exacerbated by head trauma,HPO
17054,Exacerbated By Heat,general,HPO HP:6001076: Applied to a sign or symptom that is made worse by exposure to heat (high ambient temperatures).,general,exacerbated by heat,HPO
17055,Exacerbated By Lithium Exposure,general,HPO HP:0034956: Applied to a sign or symptom that is worsened by treatment with lithium.,general,exacerbated by lithium exposure,HPO
17056,Exacerbated By Methylxanthine Ingestion,general,"HPO HP:0032534: Applied to a sign or symptom that is worsened by ingestion of food containing a methylxanthine compound (for instance, coffee, caffeine, chocolate).",general,exacerbated by methylxanthine ingestion,HPO
17057,Exacerbated By Opiate Medication,general,HPO HP:6000634: Applied to a sign orr symptom that is worsed by administration of opiate medications.,general,exacerbated by opiate medication,HPO
17058,Exacerbated By Phenytoin Exposure,general,HPO HP:4000132: Applied to a sign or symptom that is worsened by administration of phenytoin.,general,exacerbated by phenytoin exposure,HPO
17059,Exacerbated By Pregnancy,general,HPO HP:0032542: Applied to a sign or symptom that is worsened by being pregnant.,reproductive,exacerbated by pregnancy,HPO
17060,Exacerbated By Pronation,general,HPO HP:6000790: Applied to a sign or symptom that is aggravated by (or made more painful by) pronation. Pronation of the hand involves the rotation of the forearm and wrist so that the palm of the hand faces downwards or towards the back (posteriorly).,general,exacerbated by pronation,HPO
17061,Exacerbated By Pulmonary Vasodilator Exposure,general,"HPO HP:6001413: Applied to a sign or symptom that is worsened by treatment with a pulmonary vasodilator medication such as prostacyclin analogs, endothelin receptor antagonists, and phosphodiesterase-5 (PDE5) inhibitors.",general,exacerbated by pulmonary vasodilator exposure,HPO
17062,Exacerbated By Pulmonary Vasodilators,general,"HPO exact synonym for Exacerbated By Pulmonary Vasodilator Exposure. HPO HP:6001413: Applied to a sign or symptom that is worsened by treatment with a pulmonary vasodilator medication such as prostacyclin analogs, endothelin receptor antagonists, and phosphodiesterase-5 (PDE5) inhibitors.",general,exacerbated by pulmonary vasodilators,HPO
17063,Exacerbated By Smoking,general,HPO exact synonym for Exacerbated By Tobacco Use. HPO HP:0032500: Applied to a sign or symptom that is worsened by smoking tobacco products.,general,exacerbated by smoking,HPO
17064,Exacerbated By Sodium Channel Blocking Agent Exposure,general,"HPO HP:4000127: Applied to a sign or symptom that is worsened by administration of sodium channel blocking agents such as phenytoin, carbamazepine, oxcarbazepine, lamotrigine, topiramate, and zonisamide.",general,exacerbated by sodium channel blocking agent exposure,HPO
17065,Exacerbated By Tobacco Use,general,HPO HP:0032500: Applied to a sign or symptom that is worsened by smoking tobacco products.,general,exacerbated by tobacco use,HPO
17066,Exacerbation of Eyelid Lesion By Crying,dermatological,HPO HP:6000058: Applies to an eyelid lesion such as hemangiomas or varices that swells upon crying.,integumentary,exacerbation of eyelid lesion by crying,HPO
17067,Exaggerated Acoustic Startle Response,general,"HPO exact synonym for Exaggerated Startle Response. HPO HP:0002267: An exaggerated startle reaction in response to a sudden unexpected visual or acoustic stimulus, or a quick movement near the face.",general,exaggerated acoustic startle response,HPO
17068,Exaggerated Cupid's Bow,general,HPO HP:0002263: More pronounced paramedian peaks and median notch of the Cupid's bow.,general,exaggerated cupid s bow,HPO
17069,Exaggerated Facial Expression,general,HPO HP:5200014: A tendency to make facial expressions that are exaggerated and a failure to make subtle facial expressions in a social context when a subtle expression is more appropriate.,general,exaggerated facial expression,HPO
17070,Exaggerated Lumbar Lordosis,general,HPO exact synonym for Lumbar Hyperlordosis. HPO HP:0002938: An abnormal accentuation of the inward curvature of the spine in the lumbar region.,general,exaggerated lumbar lordosis,HPO
17071,Exaggerated Median Lingual Furrow,general,HPO exact synonym for Exaggerated Median Tongue Furrow. HPO HP:0002711: Increased depth of the median tongue furrow.,general,exaggerated median lingual furrow,HPO
17072,Exaggerated Median Tongue Furrow,general,HPO HP:0002711: Increased depth of the median tongue furrow.,general,exaggerated median tongue furrow,HPO
17073,Exaggerated Pessimism,general,"HPO exact synonym for Hopelessness. HPO HP:5200271: Persistent and excessive feelings of despair with an overwhelming lack of hope. While hopelessness is primarily a personal experience, the sense of hopelessness becomes pervasive and affects most aspects of the personal experience in",general,exaggerated pessimism,HPO
17074,Exaggerated Rugosity of the Labia Majora,general,HPO HP:0030913: Marked rugae formation of the skin of the labia majora.,general,exaggerated rugosity of the labia majora,HPO
17075,Exaggerated Startle Response,general,"HPO HP:0002267: An exaggerated startle reaction in response to a sudden unexpected visual or acoustic stimulus, or a quick movement near the face.",general,exaggerated startle response,HPO
17076,Exaggerated Thoracic Kyphosis,general,"HPO exact synonym for Thoracic Kyphosis. HPO HP:0002942: Over curvature of the thoracic region, leading to a round back or if sever to a hump.",general,exaggerated thoracic kyphosis,HPO
17077,Exanthem,general,HPO HP:4000054: A widespread rash.,general,exanthem,HPO
17078,Excess Astrocytes in Brain,general,HPO exact synonym for Gliosis. HPO HP:0002171: Gliosis is the focal proliferation of glial cells in the central nervous system.,general,excess astrocytes in brain,HPO
17079,Excess Fluid in Lungs,general,HPO exact synonym for Pulmonary Edema. HPO HP:0100598: Fluid accumulation in the lungs.,general,excess fluid in lungs,HPO
17080,Excess Neck Skin,musculoskeletal,"HPO exact synonym for Redundant Neck Skin. HPO HP:0005989: Excess skin around the neck, often lying in horizontal folds.",musculoskeletal,excess neck skin,HPO
17081,Excess Nuchal Skin,general,"HPO exact synonym for Thickened Nuchal Skin Fold. HPO HP:0000474: A thickening of the skin thickness in the posterior aspect of the fetal neck. A nuchal fold (NF) measurement is obtained in a transverse section of the fetal head at the level of the cavum septum pellucidum and thalami, angled posteri",general,excess nuchal skin,HPO
17082,Excess Periorbital Skin Wrinkling,general,HPO exact synonym for Periorbital Wrinkles. HPO HP:0000607: Human Phenotype Ontology term HP:0000607: Periorbital Wrinkles.,general,excess periorbital skin wrinkling,HPO
17083,Excess Residual Spermatozoal Cytoplasm,general,"HPO HP:0034795: Excess residual cytoplasm is associated with abnormal spermatozoa produced from a defective spermiation process. This abnormal excess cytoplasm should not be confused with more physiological cytoplasmic residues that can be observed in direct microscopy of the ejaculate but not in dried, fixed and stained morphology smears.",general,excess residual spermatozoal cytoplasm,HPO
17084,Excess Skin in Infancy,general,HPO exact synonym for Redundant Skin in Infancy. HPO HP:0007595: Human Phenotype Ontology term HP:0007595: Redundant Skin in Infancy.,general,excess skin in infancy,HPO
17085,Excess Skin Over the Neck,musculoskeletal,"HPO exact synonym for Redundant Neck Skin. HPO HP:0005989: Excess skin around the neck, often lying in horizontal folds.",musculoskeletal,excess skin over the neck,HPO
17086,Excessive Alcohol Consumption,general,"HPO exact synonym for Problematic Alcohol Consumption. HPO HP:5200329: Impaired ability to stop or control alcohol use despite adverse social, occupational, or health consequences.",general,excessive alcohol consumption,HPO
17087,Excessive Belching,gastrointestinal,HPO exact synonym for Excessive Eructation. HPO HP:6000064: Abnormally frequent belching (expelling gas noisily from the stomach through the mouth).,gastrointestinal,excessive belching,HPO
