symptom_id,symptom_name,category,description,related_body_system,search_name,source
35500,Siderophages in Bronchoalveolar Fluid,general,"HPO exact synonym for Hemosiderin-laden Macrophages in Bronchoalveolar Fluid. HPO HP:0032979: Hemosiderin-laden macrophages (HLM) in bronchoalveolar lavage (BAL) fluid were originally known as adiagnostic biomarker of alveolar hemorrhage, but have also been observed in idiopathic pulmonary fibrosis (IPF) with histopathological",general,siderophages in bronchoalveolar fluid,HPO
35501,Sigmoid Kidney,urinary,"HPO HP:0034231: A type of cross fused renal ectopia where the normal side kidney is present superiorly and the direction of pelvic is medial, the kidney which crosses positioned inferiorly with direction of pelvic toward the lateral side. As kidneys fuse after complete rotation on the vertical axis, both renal pelves lie in correct orientation.",urinary,sigmoid kidney,HPO
35502,Signet Ring Sign,general,"HPO HP:0032175: This finding is composed of a ring-shaped opacity representing a dilated bronchus in cross section and a smaller adjacent opacity representing its pulmonary artery, with the combination resembling a signet (or pearl) ring. It is the basic sign of bronchiectasis in pulmonary computed tomography imaging.",general,signet ring sign,HPO
35503,Signs and Symptoms Begin Before 15 Years of Age,general,HPO exact synonym for Juvenile Onset. HPO HP:0003621: Onset of signs or symptoms of disease between the age of 5 and 15 years.,general,signs and symptoms begin before 15 years of age,HPO
35504,Signs and Symptoms Worsen Slowly with Time,general,HPO exact synonym for Slowly Progressive. HPO HP:0003677: Applies to a disease manifestation that only slowly increases in scope or severity over the course of time.,general,signs and symptoms worsen slowly with time,HPO
35505,Silent Atrium,general,"HPO exact synonym for Atrial Standstill. HPO HP:0025478: Atrial standstill or silent atrium is a rare condition presenting with the absence of electrical and mechanical activity in the atria. It presents with the absence of P waves, bradycardia, and wide QRS complex in the electrocardiogram",general,silent atrium,HPO
35506,Silent Hypoxemia,general,HPO HP:0034038: Abnormally low blood oxygen level without the presence of dyspnea.,general,silent hypoxemia,HPO
35507,Silent Pituitary Adenoma,general,HPO exact synonym for Pituitary Null Cell Adenoma. HPO HP:0011761: A type of pituitary adenoma that is of unknown cellular origin and that lacks immunocytochemical or fine structural markers. Null cell adenomas are not associated with hormone excess.,general,silent pituitary adenoma,HPO
35508,Silhouette Sign,general,"HPO HP:0033647: The silhouette sign is the absence of depiction of an anatomic soft-tissue border. It is caused by consolidation and/or atelectasis of the adjacent lung, by a large mass, or by contiguous pleural fluid. The silhouette sign results from the juxtaposition of structures of similar radiographic attenuation. The sign actually refers to the absence of a silhouette.",general,silhouette sign,HPO
35509,Silica Dust Exposure,general,HPO HP:6000192: History of exposure to respirable crystalline silica (SiO2).,general,silica dust exposure,HPO
35510,Silver Dollar Vertebra,general,"HPO exact synonym for Vertebra Plana. HPO HP:6001053: he term given when a vertebral body has lost almost its entire height anteriorly and posteriorly, representing a very advanced compression fracture.",general,silver dollar vertebra,HPO
35511,Silver-gray Hair,general,HPO HP:0002218: Hypopigmented hair that appears silver-gray.,general,silver gray hair,HPO
35512,Silver-gray Hair Color,general,HPO exact synonym for Silver-gray Hair. HPO HP:0002218: Hypopigmented hair that appears silver-gray.,general,silver gray hair color,HPO
35513,Silver-gray Hair Colour,general,HPO exact synonym for Silver-gray Hair. HPO HP:0002218: Hypopigmented hair that appears silver-gray.,general,silver gray hair colour,HPO
35514,Silvery-gray Hair,general,HPO exact synonym for Silver-gray Hair. HPO HP:0002218: Hypopigmented hair that appears silver-gray.,general,silvery gray hair,HPO
35515,Simian Crease,general,HPO exact synonym for Single Transverse Palmar Crease. HPO HP:0000954: The distal and proximal transverse palmar creases are merged into a single transverse palmar crease.,general,simian crease,HPO
35516,Simian Creases,general,HPO exact synonym for Single Transverse Palmar Crease. HPO HP:0000954: The distal and proximal transverse palmar creases are merged into a single transverse palmar crease.,general,simian creases,HPO
35517,Simian Line,general,HPO exact synonym for Single Transverse Palmar Crease. HPO HP:0000954: The distal and proximal transverse palmar creases are merged into a single transverse palmar crease.,general,simian line,HPO
35518,Simple Absence Status Epilepticus,general,HPO exact synonym for Typical Absence Status Epilepticus. HPO HP:0032863: Typical absence status epilepticus is a type of generalized non-convulsive status epilepticus without coma that is semiologically a prolonged typical absence seizure.,general,simple absence status epilepticus,HPO
35519,Simple Ear,general,HPO HP:0020206: The pinna has fewer folds and grooves than usual.,general,simple ear,HPO
35520,Simple Febrile Convulsion,general,"HPO exact synonym for Simple Febrile Seizure. HPO HP:0011171: A short generalized seizure, of a duration of <15 min, not recurring within 24 h, occurring during a febrile episode not caused by an acute disease of the nervous system intracranial infection or severe metabolic disturbance.",general,simple febrile convulsion,HPO
35521,Simple Febrile Convulsions,general,ICD-10-CM R56.00: Simple febrile convulsions,general,simple febrile convulsions,ICD-10-CM
35522,Simple Febrile Seizure,pediatric,"HPO HP:0011171: A short generalized seizure, of a duration of <15 min, not recurring within 24 h, occurring during a febrile episode not caused by an acute disease of the nervous system intracranial infection or severe metabolic disturbance.",nervous,simple febrile seizure,HPO
35523,Simple Febrile Seizures,pediatric,"HPO exact synonym for Simple Febrile Seizure. HPO HP:0011171: A short generalized seizure, of a duration of <15 min, not recurring within 24 h, occurring during a febrile episode not caused by an acute disease of the nervous system intracranial infection or severe metabolic disturbance.",general,simple febrile seizures,HPO
35524,Simple Fever Fit,infectious,"HPO exact synonym for Simple Febrile Seizure. HPO HP:0011171: A short generalized seizure, of a duration of <15 min, not recurring within 24 h, occurring during a febrile episode not caused by an acute disease of the nervous system intracranial infection or severe metabolic disturbance.",general,simple fever fit,HPO
35525,Simple Kidney Cyst,urinary,HPO exact synonym for Simple Renal Cyst. HPO HP:0012581: An isolated cyst of the kidney.,urinary,simple kidney cyst,HPO
35526,Simple Partial Seizure,neurological,"HPO exact synonym for Focal Aware Seizure. HPO HP:0002349: A type of focal-onset seizure in which awareness is preserved. Awareness during a seizure is defined as the patient being fully aware of themself and their environment throughout the seizure, even if immobile.",nervous,simple partial seizure,HPO
35527,Simple Partial Seizures,neurological,"HPO exact synonym for Focal Aware Seizure. HPO HP:0002349: A type of focal-onset seizure in which awareness is preserved. Awareness during a seizure is defined as the patient being fully aware of themself and their environment throughout the seizure, even if immobile.",nervous,simple partial seizures,HPO
35528,Simple Philtrum,general,"HPO exact synonym for Smooth Philtrum. HPO HP:0000319: Flat skin surface, with no ridge formation in the central region of the upper lip between the nasal base and upper vermilion border.",general,simple philtrum,HPO
35529,Simple Renal Cyst,urinary,HPO HP:0012581: An isolated cyst of the kidney.,urinary,simple renal cyst,HPO
35530,"Simple, Cup-shaped Ears",general,HPO exact synonym for Cupped Ear. HPO HP:0000378: Laterally protruding ear that lacks antihelical folding (including absence of inferior and superior crura).,general,simple cup shaped ears,HPO
35531,Simplified Gyral Pattern,general,HPO HP:0009879: An abnormality of the cerebral cortex with fewer gyri but with normal cortical thickness. This pattern is usually often associated with congenital microcephaly.,general,simplified gyral pattern,HPO
35532,Simulated Distance Exotropia,general,HPO HP:0031720: Exotropia (intermittent or constant) worse for distance fixation in which the near angle of deviation increases (or near exophoria becomes exotropia) with: (1) prolonged disruption of fusion and/or (2) elimination of accommodation.,general,simulated distance exotropia,HPO
35533,Simultanapraxia,general,"HPO HP:0040201: A subset of motor impersistence, defined as the inability to perform more than two of the simple voluntary acts simultaneously, such as closing the eyes and protruding the tongue.",general,simultanapraxia,HPO
35534,Sincipital Encephalocele,general,HPO exact synonym for Anterior Encephalocele. HPO HP:0007035: A type of congenital malformation in which brain tissue protrudes through a defect in the anterior (front) part of the skull.,general,sincipital encephalocele,HPO
35535,Sing Song Intonation,general,HPO exact synonym for Singsong Intonation. HPO HP:0031436: A speech pattern characterized by abnormal fluctuations in the pitch of the voice.,general,sing song intonation,HPO
35536,Single Atrioventricular Valve Regurgitation,general,HPO HP:0034377: Regurgitation of the single atrioventricular valve regurgitation (AVVR) in the context of a congenital heart defect with a single ventricle. Roughly three quarters of patients following Fontan procedure display AVVR.,general,single atrioventricular valve regurgitation,HPO
35537,Single Atrium,general,HPO exact synonym for Common Atrium. HPO HP:0011565: Complete absence of the interatrial septum with common atrioventricular valve and two atrioventricular connections.,general,single atrium,HPO
35538,Single Brain Ventricle,general,HPO exact synonym for Holoprosencephaly. HPO HP:0001360: Holoprosencephaly is a structural anomaly of the brain in which the developing forebrain fails to divide into two separate hemispheres and ventricles.,general,single brain ventricle,HPO
35539,Single Central Eye,sensory,HPO exact synonym for Cyclopia. HPO HP:0009914: Cyclopia is a congenital abnormality in which there is only one eye. That eye is centrally placed in the area normally occupied by the root of the nose.,special_senses,single central eye,HPO
35540,Single Central Incisor,general,HPO exact synonym for Solitary Median Maxillary Central Incisor. HPO HP:0006315: A single maxillary central incisor positioned in the midline with morphological symmetry of the crown and bordered by lateral incisors.,general,single central incisor,HPO
35541,Single Central Upper Incisor,general,HPO exact synonym for Solitary Median Maxillary Central Incisor. HPO HP:0006315: A single maxillary central incisor positioned in the midline with morphological symmetry of the crown and bordered by lateral incisors.,general,single central upper incisor,HPO
35542,Single Coronary Artery Origin,general,HPO HP:0011640: The presence of a single coronary artery ostium from which both coronary arteries arise.,general,single coronary artery origin,HPO
35543,Single Cortical Cyst,general,HPO exact synonym for Simple Renal Cyst. HPO HP:0012581: An isolated cyst of the kidney.,general,single cortical cyst,HPO
35544,Single Damaged Nerve,general,HPO exact synonym for Mononeuropathy. HPO HP:0009831: A focal lesion of a single peripheral nerve. Damage to a sensory nerve is accompanied by sensory impairment of all modalities in the affected anatomic distribution.,general,single damaged nerve,HPO
35545,Single Fiber EMG Abnormality,general,"HPO HP:0030006: Abnormality in single fiber EMG recording, a technique that allows identification of action potentials (APs) from individual muscle fibers.",general,single fiber emg abnormality,HPO
35546,Single Fibre EMG Abnormality,general,"HPO exact synonym for Single Fiber EMG Abnormality. HPO HP:0030006: Abnormality in single fiber EMG recording, a technique that allows identification of action potentials (APs) from individual muscle fibers.",general,single fibre emg abnormality,HPO
35547,Single Flexion Crease,general,HPO exact synonym for Single Transverse Palmar Crease. HPO HP:0000954: The distal and proximal transverse palmar creases are merged into a single transverse palmar crease.,general,single flexion crease,HPO
35548,Single Interphalangeal Crease of Fifth Finger,general,"HPO HP:0006216: Presence of only one (instead of two, as normal) interphalangeal crease of the fifth finger.",general,single interphalangeal crease of fifth finger,HPO
35549,Single Isolated CHRPE,general,HPO exact synonym for Solitary Congenital Hypertrophy of Retinal Pigment Epithelium. HPO HP:0011528: Sharply demarcated hyperpigmentation of the retinal pigment epithelium (RPE) that is congenital and of no functional significance.,general,single isolated chrpe,HPO
35550,Single Isolated Congenital Hypertrophy of Retinal Pigment Epithelium,reproductive,HPO exact synonym for Solitary Congenital Hypertrophy of Retinal Pigment Epithelium. HPO HP:0011528: Sharply demarcated hyperpigmentation of the retinal pigment epithelium (RPE) that is congenital and of no functional significance.,reproductive,single isolated congenital hypertrophy of retinal pigment epithelium,HPO
35551,Single Kidney,urinary,HPO exact synonym for Unilateral Renal Agenesis. HPO HP:0000122: A unilateral form of agenesis of the kidney.,urinary,single kidney,HPO
35552,Single Lesion,dermatological,"HPO HP:6000914: Applies to an abnormality whose distribution and appearance are solitary and localized to a part of the skin, a tissue or an organ that differs from the surrounding healthy tissue.",integumentary,single lesion,HPO
35553,Single Lineage Myelodysplasia,general,"HPO HP:0012150: Abnormality/dysplasia of a single myeloid cell (erythroid, granulocytic, or megakaryocytic).",general,single lineage myelodysplasia,HPO
35554,Single Maxillary Central Incisor,general,HPO exact synonym for Solitary Median Maxillary Central Incisor. HPO HP:0006315: A single maxillary central incisor positioned in the midline with morphological symmetry of the crown and bordered by lateral incisors.,general,single maxillary central incisor,HPO
35555,Single Median Incisor,general,HPO exact synonym for Solitary Median Maxillary Central Incisor. HPO HP:0006315: A single maxillary central incisor positioned in the midline with morphological symmetry of the crown and bordered by lateral incisors.,general,single median incisor,HPO
35556,Single Median Maxillary Incisor,general,HPO exact synonym for Solitary Median Maxillary Central Incisor. HPO HP:0006315: A single maxillary central incisor positioned in the midline with morphological symmetry of the crown and bordered by lateral incisors.,general,single median maxillary incisor,HPO
35557,Single Midline Maxillary Incisor,general,HPO exact synonym for Solitary Median Maxillary Central Incisor. HPO HP:0006315: A single maxillary central incisor positioned in the midline with morphological symmetry of the crown and bordered by lateral incisors.,general,single midline maxillary incisor,HPO
35558,Single Midline Upper Front Tooth,oral,HPO exact synonym for Solitary Median Maxillary Central Incisor. HPO HP:0006315: A single maxillary central incisor positioned in the midline with morphological symmetry of the crown and bordered by lateral incisors.,oral,single midline upper front tooth,HPO
35559,Single Nare,general,HPO exact synonym for Single Naris. HPO HP:0009932: The presence of only a single nostril.,general,single nare,HPO
35560,Single Naris,general,HPO HP:0009932: The presence of only a single nostril.,general,single naris,HPO
35561,Single Nostril,general,HPO exact synonym for Single Naris. HPO HP:0009932: The presence of only a single nostril.,general,single nostril,HPO
35562,Single Palmar Crease,general,HPO exact synonym for Single Transverse Palmar Crease. HPO HP:0000954: The distal and proximal transverse palmar creases are merged into a single transverse palmar crease.,general,single palmar crease,HPO
35563,Single Palmar Creases,general,HPO exact synonym for Single Transverse Palmar Crease. HPO HP:0000954: The distal and proximal transverse palmar creases are merged into a single transverse palmar crease.,general,single palmar creases,HPO
35564,Single Raphe Bicuspid Aortic Valve,general,"HPO HP:0031118: A type of bicuspid aortic valvue (BAV) characterized by the presence of a single raphe that extends from the commissure to the free edge of the two underdeveloped, conjoint cusps, resulting in two leaflets of unequal size.",general,single raphe bicuspid aortic valve,HPO
35565,Single Second Heart Sound,general,"HPO HP:6000225: The second sound can remain single throughout the respiratory cycle due to either absence of one component or to synchronous occurrence of the two components. Since the pulmonary vascular impedance increases with age, many normal patients over age 50 have a single S2 or at most a narrow physiologic split on inspiration because P2 occurs early. A single second sound, however, is usually due to inability to auscultate a relatively soft pulmonic component. Such inability is rare in healthy infants, children, and young adults and is uncommon even in older persons under good...",general,single second heart sound,HPO
35566,Single Transverse Palmar Crease,general,HPO HP:0000954: The distal and proximal transverse palmar creases are merged into a single transverse palmar crease.,general,single transverse palmar crease,HPO
35567,Single Transverse Palmar Creases,general,HPO exact synonym for Single Transverse Palmar Crease. HPO HP:0000954: The distal and proximal transverse palmar creases are merged into a single transverse palmar crease.,general,single transverse palmar creases,HPO
35568,Single Trichilemmoma,general,"HPO HP:0012845: Presence of a unitary trichilemmoma, a benign tumor originating from the outer root sheath of the hair follicle.",general,single trichilemmoma,HPO
35569,Single Umbilical Artery,general,HPO HP:0001195: Single umbilical artery (SUA) is the absence of one of the two umbilical arteries surrounding the fetal bladder and in the fetal umbilical cord.,general,single umbilical artery,HPO
35570,Single Ventricle,general,"HPO HP:0001750: The presence of only one working lower chamber in the heart, usually with a virtual absence of the ventricular septum and usually present in conjunction with double inlet left or right ventricle.",general,single ventricle,HPO
35571,Single Ventricle of Indeterminate Morphology,general,HPO HP:0011680: Human Phenotype Ontology term HP:0011680: Single Ventricle of Indeterminate Morphology.,general,single ventricle of indeterminate morphology,HPO
35572,Single-finger Involvement,general,HPO HP:6001121: Applies to an abnormality whose distribution and appearance are limited to or predominantly affect a single finger.,general,single finger involvement,HPO
35573,Single-lobed Right Lung,general,"HPO HP:0033998: A developmental defect of pulmonary lobation characterized by the presence of only one lobe of the right lung, which normally has three lobes.",general,single lobed right lung,HPO
35574,Singsong Intonation,general,HPO HP:0031436: A speech pattern characterized by abnormal fluctuations in the pitch of the voice.,general,singsong intonation,HPO
35575,Sinoatrial Block,general,HPO HP:0012723: Disturbance in the atrial activation that is caused by transient failure of impulse conduction from the sinoatrial node to the cardiac atria.,general,sinoatrial block,HPO
35576,Sinoatrial Node Disease,general,"HPO exact synonym for Sick Sinus Syndrome. HPO HP:0011704: An abnormality involving the generation of the action potential by the sinus node and is characterized by an atrial rate inappropriate for physiological requirements. Manifestations include severe sinus bradycardia, sinus pauses or ar",general,sinoatrial node disease,HPO
35577,Sinus Bradycardia,cardiovascular,HPO HP:0001688: Bradycardia related to a mean resting sinus rate of less than 50 beats per minute.,cardiovascular,sinus bradycardia,HPO
35578,Sinus Inflammation,general,"HPO exact synonym for Sinusitis. HPO HP:0000246: Inflammation of the paranasal sinuses owing to a viral, bacterial, or fungal infection, allergy, or an autoimmune reaction.",general,sinus inflammation,HPO
35579,Sinus Tach,general,HPO exact synonym for Sinus Tachycardia. HPO HP:0011703: Heart rate of greater than 100 beats per minute.,general,sinus tach,HPO
35580,Sinus Tachy,general,HPO exact synonym for Sinus Tachycardia. HPO HP:0011703: Heart rate of greater than 100 beats per minute.,general,sinus tachy,HPO
35581,Sinus Tachycardia,cardiovascular,HPO HP:0011703: Heart rate of greater than 100 beats per minute.,cardiovascular,sinus tachycardia,HPO
35582,Sinus Venosus Atrial Septal Defect,general,"HPO HP:0011567: An interatrial communication caused by a deficiency of the common wall between the superior vena cava (SVC) and the right-sided pulmonary veins. SVASD is commonly associated with anomalous pulmonary venous connection (APVC) of some or all of the pulmonary veins, which produces additional left-to-right shunting.",general,sinus venosus atrial septal defect,HPO
35583,Sinusitis,general,"HPO HP:0000246: Inflammation of the paranasal sinuses owing to a viral, bacterial, or fungal infection, allergy, or an autoimmune reaction.",general,sinusitis,HPO
35584,"Sinusitis, Recurrent",general,HPO exact synonym for Recurrent Sinusitis. HPO HP:0011108: A recurrent form of sinusitis.,general,sinusitis recurrent,HPO
35585,Sirenomelia,general,HPO HP:0010497: A developmental defect in which the legs are fused together.,general,sirenomelia,HPO
35586,SIRS of Non-infectious Origin W Acute Organ Dysfunction,general,ICD-10-CM R65.11: Systemic inflammatory response syndrome (SIRS) of non-infectious origin with acute organ dysfunction,general,sirs of non infectious origin w acute organ dysfunction,ICD-10-CM
35587,SIRS of Non-infectious Origin W/o Acute Organ Dysfunction,general,ICD-10-CM R65.10: Systemic inflammatory response syndrome (SIRS) of non-infectious origin without acute organ dysfunction,general,sirs of non infectious origin w o acute organ dysfunction,ICD-10-CM
35588,Situational Syncope,neurological,"HPO exact synonym for Vasovagal Syncope. HPO HP:0012668: A vasovagal episode or vasovagal syncope is the most common form of reflex syncope. Reflex syncope is a general term used to describe types of syncope resulting from a failure in autoregulation of blood pressure, and ultimately, in ce",cardiovascular,situational syncope,HPO
35589,Situs Inversus Totalis,general,HPO HP:0001696: A left-right reversal (or mirror reflection) of the anatomical location of the major thoracic and abdominal organs.,general,situs inversus totalis,HPO
35590,Situs Inversus Visceralis,general,HPO exact synonym for Abdominal Situs Inversus. HPO HP:0003363: A left-right reversal (or mirror reflection) of the anatomical location of the viscera of the abdomen.,general,situs inversus visceralis,HPO
35591,Situs Inversus Viscerum,general,HPO exact synonym for Abdominal Situs Inversus. HPO HP:0003363: A left-right reversal (or mirror reflection) of the anatomical location of the viscera of the abdomen.,general,situs inversus viscerum,HPO
35592,Situs Inversus with Levocardia,general,HPO HP:0031592: Situs inversus of thoracic and abdominal viscera with the heart remaining normally situated on the left; usually associated with congenital cardiac abnormalities such as transposition of the great vessels and/or spleen defects including asplenia or polysplenia.,general,situs inversus with levocardia,HPO
35593,Situs Oppositus,general,HPO exact synonym for Situs Inversus Totalis. HPO HP:0001696: A left-right reversal (or mirror reflection) of the anatomical location of the major thoracic and abdominal organs.,general,situs oppositus,HPO
35594,Situs Transversus,general,HPO exact synonym for Situs Inversus Totalis. HPO HP:0001696: A left-right reversal (or mirror reflection) of the anatomical location of the major thoracic and abdominal organs.,general,situs transversus,HPO
35595,Six Lumbar Vertebrae,general,HPO HP:0008416: Human Phenotype Ontology term HP:0008416: Six Lumbar Vertebrae.,general,six lumbar vertebrae,HPO
35596,Sixth Cranial Nerve Hypoplasia,general,HPO HP:6000596: Underdevelopment of the six cranial nerve (abducens nerve).,general,sixth cranial nerve hypoplasia,HPO
35597,Sixth Nerve Palsy,general,"HPO exact synonym for Abducens Palsy. HPO HP:0006897: Malfunction of the abducens nerve as manifested by impairment of the ability of the affected eye to be moved outward. Patients who develop abducens nerve palsy often present with binocular horizontal diplopia, which is a double vision",general,sixth nerve palsy,HPO
35598,Skeletal Abnormalities,general,HPO exact synonym for Abnormality of the Skeletal System. HPO HP:0000924: An abnormality of the skeletal system.,general,skeletal abnormalities,HPO
35599,Skeletal Anomalies,general,HPO exact synonym for Abnormality of the Skeletal System. HPO HP:0000924: An abnormality of the skeletal system.,general,skeletal anomalies,HPO
35600,Skeletal Dysplasia,general,HPO HP:0002652: A general term describing features characterized by abnormal development of bones and connective tissues.,general,skeletal dysplasia,HPO
