symptom_id,symptom_name,category,description,related_body_system,search_name,source
13034,Decreased Hemoglobin Concentration,general,HPO HP:0020062: An abnormal reduction below normal hemoglobin concentration in the circulation.,general,decreased hemoglobin concentration,HPO
13035,Decreased Hepatic Echogenicity,general,"HPO HP:0031143: Reduced echogenicity of liver tissue on sonography, manifested as an increased amount of black on the screen of the sonography device.",general,decreased hepatic echogenicity,HPO
13036,Decreased Hepatic Phosphorylase Kinase Activity,general,"HPO exact synonym for Reduced Hepatic Phosphorylase Kinase Activity. HPO HP:6000333: Activity of phosphorylase kinase in liver tissue below the lower limit of normal. Phosphorylase kinase (PhK) has a major regulatory role in the breakdown of glycogen. The enzyme PhK comprises four copies each of four subunits, encoded",general,decreased hepatic phosphorylase kinase activity,HPO
13037,Decreased Hepcidin Level,general,HPO exact synonym for Decreased Circulating Hepcidin Concentration. HPO HP:0031876: Concentration of hepcidin in the blood circulation below the lower limit of normal.,general,decreased hepcidin level,HPO
13038,Decreased High-mannose N-glycan Level,general,HPO HP:0410358: An abnormal decrease in the concentration of high-mannose N-glycans on glycoproteins.,general,decreased high mannose n glycan level,HPO
13039,Decreased High-mannose N-glycans On Glycoprotein Concentration,general,HPO exact synonym for Decreased High-mannose N-glycan Level. HPO HP:0410358: An abnormal decrease in the concentration of high-mannose N-glycans on glycoproteins.,general,decreased high mannose n glycans on glycoprotein concentration,HPO
13040,Decreased Hip Abduction,general,HPO HP:0003184: Reduced ability to move the femur outward to the side.,general,decreased hip abduction,HPO
13041,Decreased HLA DR+ CD4+ T Cell Proportion,general,"HPO exact synonym for Decreased Proportion of HLA DR+ CD4+ T Cells. HPO HP:0025841: Abnormal reduction of the activated HLA-DR+ CD4+ T cell subpopulation, measured as percentage of total CD4+ T cells in the blood, compared to a reference range for a given sex and age-group.",general,decreased hla dr cd4 t cell proportion,HPO
13042,Decreased HLA DR+ CD8+ T Cell Proportion,general,"HPO HP:0025844: Abnormal decrease of the activated HLA-DR+ CD8+ T cell subpopulation, measured as percentage of total CD8+ T cells in the blood, compared to a reference range for a given sex and age-group.",general,decreased hla dr cd8 t cell proportion,HPO
13043,Decreased Horizontal Dimension of Face,general,"HPO exact synonym for Narrow Face. HPO HP:0000275: Bizygomatic (upper face) and bigonial (lower face) width are both more than 2 standard deviations below the mean (objective); or, an apparent reduction in the width of the upper and lower face (subjective).",general,decreased horizontal dimension of face,HPO
13044,Decreased Horizontal Dimension of Philtrum,general,"HPO exact synonym for Narrow Philtrum. HPO HP:0011829: Distance between the philtral ridges, measured just above the vermilion border, more than 2 standard deviations below the mean. Alternatively, an apparently decreased distance between the ridges of the philtrum.",general,decreased horizontal dimension of philtrum,HPO
13045,Decreased Hydroxyproline in the Blood,general,HPO exact synonym for Decreased Circulating Hydroxyproline Concentration. HPO HP:0500140: A decreased amount of hydroxyproline in the blood.,general,decreased hydroxyproline in the blood,HPO
13046,Decreased Iduronate Sulfatase Level,general,HPO HP:0034203: An decreased level of iduronate-2-sulfatase activity in the blood circulation.,general,decreased iduronate sulfatase level,HPO
13047,Decreased IgA,general,HPO exact synonym for Decreased Circulating IgA Concentration. HPO HP:0002720: Decreased levels of immunoglobulin A (IgA).,general,decreased iga,HPO
13048,Decreased IgD,general,HPO exact synonym for Decreased Circulating IgD Concentration. HPO HP:0410245: An abnormally decreased level of immunoglobulin D (IgD) in blood.,general,decreased igd,HPO
13049,Decreased IgD in Blood,general,HPO exact synonym for Decreased Circulating IgD Concentration. HPO HP:0410245: An abnormally decreased level of immunoglobulin D (IgD) in blood.,general,decreased igd in blood,HPO
13050,Decreased IgE,general,HPO exact synonym for Decreased Circulating IgE Concentration. HPO HP:0005479: An abnormally decreased level of immunoglobulin E (IgE) in blood.,general,decreased ige,HPO
13051,Decreased IgG Level,general,HPO exact synonym for Decreased Circulating IgG Concentration. HPO HP:0004315: An abnormally decreased level of immunoglobulin G (IgG) in blood.,general,decreased igg level,HPO
13052,Decreased IgG Level in Blood,general,HPO exact synonym for Decreased Circulating IgG Concentration. HPO HP:0004315: An abnormally decreased level of immunoglobulin G (IgG) in blood.,general,decreased igg level in blood,HPO
13053,Decreased IgG Subclass Level in Blood,general,HPO exact synonym for Decreased Circulating IgG Subclass Concentration. HPO HP:0032135: A reduction below the normal concentration of a subclass of immunoglobulin G (IgG) in the blood.,general,decreased igg subclass level in blood,HPO
13054,Decreased IgG1 Level in Blood,general,HPO exact synonym for Decreased Circulating IgG1 Concentration. HPO HP:0032136: A reduction in immunoglobulin levels of the IgG1 subclass in the blood circulation.,general,decreased igg1 level in blood,HPO
13055,Decreased IgG2 Level in Blood,general,HPO exact synonym for Decreased Circulating IgG2 Concentration. HPO HP:0008348: A reduction in immunoglobulin levels of the IgG2 subclass in the blood circulation.,general,decreased igg2 level in blood,HPO
13056,Decreased IgG3 Level in Blood,general,HPO exact synonym for Decreased Circulating IgG3 Concentration. HPO HP:0032137: A reduction in immunoglobulin levels of the IgG3 subclass in the blood circulation.,general,decreased igg3 level in blood,HPO
13057,Decreased IgG4 Level in Blood,general,HPO exact synonym for Decreased Circulating IgG4 Concentration. HPO HP:0032138: A reduction in immunoglobulin levels of the IgG4 subclass in the blood circulation.,general,decreased igg4 level in blood,HPO
13058,Decreased IgM,general,HPO exact synonym for Decreased Circulating Total IgM. HPO HP:0002850: An abnormally decreased level of immunoglobulin M (IgM) in blood.,general,decreased igm,HPO
13059,Decreased IgM Level,general,HPO exact synonym for Decreased Circulating Total IgM. HPO HP:0002850: An abnormally decreased level of immunoglobulin M (IgM) in blood.,general,decreased igm level,HPO
13060,Decreased Immature B Cell Proportion,general,"HPO HP:0030378: A reduction in normal proportion of immature B cells (CD19+/ CD21low)in circulation relative to total number of B cells. Immature B cells (IgM+) are still in final stages of development within the bone marrow. Naive B cells are those which have left the bone marrow, before they bind to the antigen for which they're specific (IgM+/IgD+).",general,decreased immature b cell proportion,HPO
13061,Decreased Immature Platelet Fraction,general,HPO exact synonym for Reduced Circulating Reticulated Platelet Count. HPO HP:6001239: The number of reticulated platelets per volume of blood in the peripheral circulation is below the lower limit of normal.,general,decreased immature platelet fraction,HPO
13062,Decreased Immune Function,general,"HPO exact synonym for Immunodeficiency. HPO HP:0002721: Failure of the immune system to protect the body adequately from infection, due to the absence or insufficiency of some component process or substance.",general,decreased immune function,HPO
13063,Decreased Immunoglobulin a,general,HPO exact synonym for Decreased Circulating IgA Concentration. HPO HP:0002720: Decreased levels of immunoglobulin A (IgA).,general,decreased immunoglobulin a,HPO
13064,Decreased Immunoglobulin G,general,HPO exact synonym for Decreased Circulating IgG Concentration. HPO HP:0004315: An abnormally decreased level of immunoglobulin G (IgG) in blood.,general,decreased immunoglobulin g,HPO
13065,Decreased Immunoglobulin Level,general,HPO exact synonym for Decreased Circulating Immunoglobulin Concentration. HPO HP:0004313: An abnormally decreased level of immunoglobulin in blood.,general,decreased immunoglobulin level,HPO
13066,Decreased Immunoglobulin Level in Body Fluid,general,"HPO HP:0041078: An reduction from normal levels of immunoglobulins in body fluids, such as mucous.",general,decreased immunoglobulin level in body fluid,HPO
13067,Decreased Incisura Length,general,HPO HP:0031230: The length of the incisura from the upper to lower border is less than that observed in the average population.,general,decreased incisura length,HPO
13068,Decreased Inflammatory Response,general,HPO HP:0012648: An abnormal reduction in the inflammatory response to injury or infection.,general,decreased inflammatory response,HPO
13069,Decreased INR,general,"HPO exact synonym for Decreased Prothrombin Time. HPO HP:0032198: Abnormally short time to coagulation in the prothrombin time test, which is a measure of the extrinsic pathway of coagulation. The results of the prothrombin time test are often expressed in terms of the International normalized ratio",general,decreased inr,HPO
13070,Decreased International Normalised Ratio,general,"HPO exact synonym for Decreased Prothrombin Time. HPO HP:0032198: Abnormally short time to coagulation in the prothrombin time test, which is a measure of the extrinsic pathway of coagulation. The results of the prothrombin time test are often expressed in terms of the International normalized ratio",general,decreased international normalised ratio,HPO
13071,Decreased International Normalized Ratio,general,"HPO exact synonym for Decreased Prothrombin Time. HPO HP:0032198: Abnormally short time to coagulation in the prothrombin time test, which is a measure of the extrinsic pathway of coagulation. The results of the prothrombin time test are often expressed in terms of the International normalized ratio",general,decreased international normalized ratio,HPO
13072,Decreased Interpersonal Communication,general,HPO exact synonym for Diminishment of Interpersonal Communication. HPO HP:5200316: A reduction in the tendency of a person to share information or emotions compared to that person's previous norms.,general,decreased interpersonal communication,HPO
13073,Decreased Interpupillary Distance,general,"HPO exact synonym for Hypotelorism. HPO HP:0000601: Interpupillary distance less than 2 SD below the mean (alternatively, the appearance of an decreased interpupillary distance or closely spaced eyes).",general,decreased interpupillary distance,HPO
13074,Decreased Intestinal Transit Time,general,HPO HP:0030897: A reduction in the length of time required for food to pass through the intestines.,general,decreased intestinal transit time,HPO
13075,Decreased Intracranial Pressure,general,HPO HP:0012641: A reduction of the pressure inside the cranium (skull) and thereby in the brain tissue and cerebrospinal fluid.,general,decreased intracranial pressure,HPO
13076,Decreased Joint Mobility,musculoskeletal,HPO exact synonym for Limitation of Joint Mobility. HPO HP:0001376: A reduction in the freedom of movement of one or more joints.,musculoskeletal,decreased joint mobility,HPO
13077,Decreased KCO,general,HPO HP:0033374: Decreased diffusion capacity of the lung for carbon monoxide (CO) rate constant (efficiency index).,general,decreased kco,HPO
13078,Decreased Knee Jerk Reflex,general,HPO exact synonym for Decreased Patellar Reflex. HPO HP:0011808: Decreased intensity of the patellar reflex (also known as the knee jerk reflex).,general,decreased knee jerk reflex,HPO
13079,Decreased Lacrimation,general,"HPO HP:0000633: Abnormally decreased lacrimation, that is, reduced tear production.",general,decreased lacrimation,HPO
13080,Decreased LDL Cholesterol Concentration,general,HPO HP:0003563: An decreased concentration of low-density lipoprotein cholesterol in the blood.,general,decreased ldl cholesterol concentration,HPO
13081,Decreased LDLc Concentration,general,HPO exact synonym for Decreased LDL Cholesterol Concentration. HPO HP:0003563: An decreased concentration of low-density lipoprotein cholesterol in the blood.,general,decreased ldlc concentration,HPO
13082,Decreased Lecithin Cholesterol Acyl Transferase Level,general,HPO HP:0025433: Reduced level of the enzyme lecithin cholesterol acyl transferase.,general,decreased lecithin cholesterol acyl transferase level,HPO
13083,Decreased Left Ventricular End-diastolic Volume,general,HPO HP:0033756: Abnormally low volume of blood in the left ventricle at the end of diastole (just before systole).,general,decreased left ventricular end diastolic volume,HPO
13084,Decreased Length of Bridge of Nose,general,"HPO exact synonym for Short Nasal Bridge. HPO HP:0003194: Decreased superior-inferior length of the nasal bridge, which is the saddle-shaped area that includes the nasal root and the lateral aspects of the nose.",general,decreased length of bridge of nose,HPO
13085,Decreased Length of Columella,general,HPO exact synonym for Short Columella. HPO HP:0002000: Reduced distance from the anterior border of the naris to the subnasale.,general,decreased length of columella,HPO
13086,Decreased Length of Condylar Process of Mandible,general,HPO exact synonym for Short Mandibular Condyles. HPO HP:0005790: Human Phenotype Ontology term HP:0005790: Short Mandibular Condyles.,general,decreased length of condylar process of mandible,HPO
13087,Decreased Length of Dental Roots,general,"HPO exact synonym for Short Dental Root. HPO HP:0006336: Tooth root length more than 2 SD below mean, or subjectively apparently decreased tooth root length.",general,decreased length of dental roots,HPO
13088,Decreased Length of Eyelashes,sensory,HPO exact synonym for Short Eyelashes. HPO HP:0010764: Decreased length of the eyelashes (subjective).,special_senses,decreased length of eyelashes,HPO
13089,Decreased Length of Face,general,HPO exact synonym for Short Face. HPO HP:0011219: Facial height (length) is more than two standard deviations below the mean (objective); or an apparent decrease in the height (length) of the face (subjective).,general,decreased length of face,HPO
13090,Decreased Length of Hard Palate,general,HPO exact synonym for Short Hard Palate. HPO HP:0010290: Distance between the labial point of the incisive papilla to the midline junction of the hard and soft palate more than 2 SD below the mean (objective) or apparently decreased length of the hard palate (subjective).,general,decreased length of hard palate,HPO
13091,Decreased Length of Lower Eyelashes,sensory,HPO exact synonym for Short Lower Eyelashes. HPO HP:0040055: Human Phenotype Ontology term HP:0040055: Short Lower Eyelashes.,special_senses,decreased length of lower eyelashes,HPO
13092,Decreased Length of Nasal Bridge,general,"HPO exact synonym for Short Nasal Bridge. HPO HP:0003194: Decreased superior-inferior length of the nasal bridge, which is the saddle-shaped area that includes the nasal root and the lateral aspects of the nose.",general,decreased length of nasal bridge,HPO
13093,Decreased Length of Nasal Septum,general,HPO exact synonym for Short Nasal Septum. HPO HP:0000420: Reduced superior to inferior length of the nasal septum.,general,decreased length of nasal septum,HPO
13094,Decreased Length of Neck,musculoskeletal,HPO exact synonym for Short Neck. HPO HP:0000470: Diminished length of the neck.,musculoskeletal,decreased length of neck,HPO
13095,Decreased Length of Nose,general,"HPO exact synonym for Short Nose. HPO HP:0003196: Distance from nasion to subnasale more than two standard deviations below the mean, or alternatively, an apparently decreased length from the nasal root to the nasal tip.",general,decreased length of nose,HPO
13096,Decreased Length of Philtrum,general,"HPO exact synonym for Short Philtrum. HPO HP:0000322: Distance between nasal base and midline upper lip vermilion border more than 2 SD below the mean. Alternatively, an apparently decreased distance between nasal base and midline upper lip vermilion border.",general,decreased length of philtrum,HPO
13097,Decreased Length of Septum of Nose,general,HPO exact synonym for Short Nasal Septum. HPO HP:0000420: Reduced superior to inferior length of the nasal septum.,general,decreased length of septum of nose,HPO
13098,Decreased Length of Tooth Roots,oral,"HPO exact synonym for Short Dental Root. HPO HP:0006336: Tooth root length more than 2 SD below mean, or subjectively apparently decreased tooth root length.",oral,decreased length of tooth roots,HPO
13099,Decreased Length of Upper Eyelashes,sensory,HPO exact synonym for Short Upper Eyelashes. HPO HP:0040054: Human Phenotype Ontology term HP:0040054: Short Upper Eyelashes.,special_senses,decreased length of upper eyelashes,HPO
13100,"Decreased Level of 1,5 Anhydroglucitol in Serum",general,"HPO HP:0410050: A decrease in the level of 1,5 anhydroglucitol in the serum. 1,5-Anhydrosorbitol is a validated marker of short-term glycemic control. This substance is derived mainly from food, is well absorbed in the intestine, and is distributed to all organs and tissues.",general,decreased level of 1 5 anhydroglucitol in serum,HPO
13101,"Decreased Level of 1,5-AG in Serum",general,"HPO exact synonym for Decreased Level of 1,5 Anhydroglucitol in Serum. HPO HP:0410050: A decrease in the level of 1,5 anhydroglucitol in the serum. 1,5-Anhydrosorbitol is a validated marker of short-term glycemic control. This substance is derived mainly from food, is well absorbed in the intestine, and is distributed t",general,decreased level of 1 5 ag in serum,HPO
13102,"Decreased Level of 1,5-anhydro-D-glucitol in Serum",general,"HPO exact synonym for Decreased Level of 1,5 Anhydroglucitol in Serum. HPO HP:0410050: A decrease in the level of 1,5 anhydroglucitol in the serum. 1,5-Anhydrosorbitol is a validated marker of short-term glycemic control. This substance is derived mainly from food, is well absorbed in the intestine, and is distributed t",general,decreased level of 1 5 anhydro d glucitol in serum,HPO
13103,Decreased Level of Carnosine in Blood,general,HPO exact synonym for Decreased Circulating Carnosine Concentration. HPO HP:0500162: A decreased amount of carnosine in blood.,general,decreased level of carnosine in blood,HPO
13104,Decreased Level of Coenzyme Q10 in Skeletal Muscle,musculoskeletal,"HPO HP:0034369: Reduced amount of coenzyme Q10,a naturally occurring quinone, in skeletal muscle tissue.",musculoskeletal,decreased level of coenzyme q10 in skeletal muscle,HPO
13105,Decreased Level of D-mannose in Urine,general,HPO HP:0410060: A decrease in the level of D-mannose in the urine.,general,decreased level of d mannose in urine,HPO
13106,Decreased Level of Erythritol in Cerebrospinal Fluid,general,HPO exact synonym for Decreased CSF Erythritol Concentration. HPO HP:0410056: Concentration of erythritol in the cerebrospinal fluid below the lower limit of normal.,general,decreased level of erythritol in cerebrospinal fluid,HPO
13107,Decreased Level of Erythritol in Urine,general,HPO HP:0410055: A decrease in the level of erythritol in the urine.,general,decreased level of erythritol in urine,HPO
13108,Decreased Level of Gamma-aminobutyric Acid in Serum,general,HPO exact synonym for Decreased Circulating GABA Concentration. HPO HP:0410054: A decrease in the level of GABA in the serum.,general,decreased level of gamma aminobutyric acid in serum,HPO
13109,Decreased Level of Heparin Co-factor II,general,HPO HP:0040226: An abnormality of coagulation related to a decreased concentration of heparin co-factor II,general,decreased level of heparin co factor ii,HPO
13110,Decreased Level of Histidine-rich Glycoprotein,general,HPO HP:0040227: Decrease of these levels result in increased inhibition of fibrinolysis and reduced inhibition of coagulation,general,decreased level of histidine rich glycoprotein,HPO
13111,Decreased Level of PAF,general,HPO exact synonym for Decreased Level of Platelet-activating Factor. HPO HP:0040179: Human Phenotype Ontology term HP:0040179: Decreased Level of Platelet-activating Factor.,general,decreased level of paf,HPO
13112,Decreased Level of Plasminogen,general,HPO HP:0040228: A decreased level of Plasminogen,general,decreased level of plasminogen,HPO
13113,Decreased Level of Platelet-activating Factor,general,HPO HP:0040179: Human Phenotype Ontology term HP:0040179: Decreased Level of Platelet-activating Factor.,general,decreased level of platelet activating factor,HPO
13114,Decreased Level of Thrombomodulin,general,HPO HP:0040229: Thrombomodulin is a cofactor in the thrombin induced activation of Protein C. In the case of deficiency there will be less Protein C and tendency to clot,general,decreased level of thrombomodulin,HPO
13115,Decreased Level of Tissue Plasminogen Activator,general,"HPO HP:0040230: The tPA protein catalyzes the conversion of plasiminogen to plasmin, and thus break down of clots. When there is a deficiency there will be an increase of thrombosis",general,decreased level of tissue plasminogen activator,HPO
13116,Decreased Level of TPA,general,"HPO exact synonym for Decreased Level of Tissue Plasminogen Activator. HPO HP:0040230: The tPA protein catalyzes the conversion of plasiminogen to plasmin, and thus break down of clots. When there is a deficiency there will be an increase of thrombosis",general,decreased level of tpa,HPO
13117,Decreased Levels of Acid Labile Subunit,general,HPO exact synonym for Reduced Insulin Like Growth Factor Binding Protein Acid Labile Subunit Concentration. HPO HP:0045046: An abnormally decreased concentration of insulin like growth factor binding protein acid labile subunit level in the blood circulation.,general,decreased levels of acid labile subunit,HPO
13118,Decreased Libido,reproductive,ICD-10-CM R68.82: Decreased libido,reproductive,decreased libido,ICD-10-CM
13119,Decreased Light- and Dark-adapted Electroretinogram Amplitude,general,HPO HP:0000654: Decreased amplitude of eletrical response upon electroretinography.,general,decreased light and dark adapted electroretinogram amplitude,HPO
13120,Decreased Lipoprotein Lipase Level,general,HPO exact synonym for Decreased Circulating Lipoprotein Lipase Concentration. HPO HP:0031209: Reduction in the level of lipoprotein lipase in the blood.,general,decreased lipoprotein lipase level,HPO
13121,Decreased Liver Bile Salt Export Pump Expression,general,"HPO HP:6000718: Amount of bile salt export pump (BSEP, coded by the ABCB11 gene) in liver tissue below the lower limit of normal.",general,decreased liver bile salt export pump expression,HPO
13122,Decreased Liver Function,general,HPO HP:0001410: Reduced ability of the liver to perform its functions.,general,decreased liver function,HPO
13123,Decreased Low-density Lipoprotein Particle Size,general,HPO HP:0032193: An abnormal decrease in the average size of low-density lipoprotein particle size in the blood circulation.,general,decreased low density lipoprotein particle size,HPO
13124,Decreased Lower Limb Vibratory Sense,musculoskeletal,HPO exact synonym for Impaired Vibration Sensation in the Lower Limbs. HPO HP:0002166: A decrease in the ability to perceive vibration in the legs.,musculoskeletal,decreased lower limb vibratory sense,HPO
13125,Decreased Lung Function Due to Weak Breathing Muscles,musculoskeletal,HPO exact synonym for Respiratory Insufficiency Due to Muscle Weakness. HPO HP:0002747: Human Phenotype Ontology term HP:0002747: Respiratory Insufficiency Due to Muscle Weakness.,musculoskeletal,decreased lung function due to weak breathing muscles,HPO
13126,Decreased Lymph Node Lymphocyte Cytoplasm,hematologic,HPO HP:0020285: The amount of cytoplasm in lymphocytes is even less than the relatively little cytoplasm found in the majority of lymphocytes within lymph nodes.,general,decreased lymph node lymphocyte cytoplasm,HPO
13127,Decreased Lymph-node Cellular CD19 Expression,general,HPO HP:0020293: Decreased levels of CD19 expression compared to normal B cells.,general,decreased lymph node cellular cd19 expression,HPO
13128,Decreased Lymph-node Cellular CD20 Expression,general,HPO HP:0020292: Decreased levels of CD20 expression compared to normal B cells.,general,decreased lymph node cellular cd20 expression,HPO
13129,Decreased Lymphocyte Proliferation in Response to Anti-CD3,general,"HPO exact synonym for Decreased Anti-CD3/28-induced T-cell Proliferation. HPO HP:0031382: Abnormal decrease of T cell proliferation in response to anti-CD3/28 stimulation. This is commonly measured through intracellular expression of Ki67, decreasing surface expression of carboxyfluorescein diacetate (CFSE), or 3H-thymidin",general,decreased lymphocyte proliferation in response to anti cd3,HPO
13130,Decreased Lymphocyte Proliferation in Response to Mitogen,general,"HPO exact synonym for Decreased Mitogen-induced T-cell Proliferation. HPO HP:0031381: Abnormal decrease of T cell proliferation in response to mitogenic stimuli. This is commonly measured through intracellular expression of Ki67, decreasing surface expression of carboxyfluorescein diacetate (CFSE), or 3H-thymidine inco",general,decreased lymphocyte proliferation in response to mitogen,HPO
13131,Decreased Lysosomal Acid Glucosylceramidase Activity,general,"HPO exact synonym for Decreased Beta-glucocerebrosidase Level. HPO HP:0003656: Reduced level of the enzyme beta-glucosidase, an enzyme that catalyzes the hydrolysis of glucosylceramide into ceramide and glucose.",general,decreased lysosomal acid glucosylceramidase activity,HPO
13132,Decreased Male Libido,reproductive,HPO HP:0040306: Reduced desire for sexual activity on the part of a male.,reproductive,decreased male libido,HPO
