symptom_id,symptom_name,category,description,related_body_system,search_name,source
33015,Recurrent Thromboembolism,general,"HPO HP:0004831: Repeated episodes of obstruction of blood flow due to an embolus, i.e., blood clot that has traveled from its point of origin within the blood stream.",general,recurrent thromboembolism,HPO
33016,Recurrent Thrombophlebitis,general,HPO HP:0004419: Repeated episodes of inflammation of a vein associated with venous thrombosis (blood clot formation within the vein).,general,recurrent thrombophlebitis,HPO
33017,Recurrent Thrombosis,general,HPO exact synonym for Recurrent Thrombophlebitis. HPO HP:0004419: Repeated episodes of inflammation of a vein associated with venous thrombosis (blood clot formation within the vein).,general,recurrent thrombosis,HPO
33018,Recurrent Tonsillitis,infectious,"HPO HP:0011110: Inflammation of the tonsils that has occurred repeatedly. The definition of recurrent may vary somewhat, but the criteria used recently as a measure of severity were five or more episodes of true tonsillitis per year, symptoms recurring for at least a year, and episodes that are disabling and that prevent normal functioning. In some cases recurrent tonsillitis may be related to immunosusceptibility. Evidence exists for a genetic predisposition for recurrent tonsillitis.",immune,recurrent tonsillitis,HPO
33019,Recurrent Trauma-related Distressing Dreams,mental_health,HPO HP:0032938: Recurrent distressing dreams occur when the content and/or emotional impact of the dream is connected to a traumatic event or events.,mental_behavioral,recurrent trauma related distressing dreams,HPO
33020,Recurrent Upper and Lower Respiratory Tract Infections,respiratory,"HPO HP:0200117: Increased susceptibility to upper and lower respiratory tract infections, as manifested by recurrent episodes of upper and lower respiratory tract infections.",respiratory,recurrent upper and lower respiratory tract infections,HPO
33021,Recurrent Upper Respiratory and Lower Respiratory Infections,respiratory,"HPO exact synonym for Recurrent Upper Respiratory Tract Infections. HPO HP:0002788: An increased susceptibility to upper respiratory tract infections as manifested by a history of recurrent upper respiratory tract infections (running ears - otitis, sinusitis, pharyngitis, tonsillitis).",respiratory,recurrent upper respiratory and lower respiratory infections,HPO
33022,Recurrent Upper Respiratory Infection,respiratory,"HPO exact synonym for Recurrent Upper Respiratory Tract Infections. HPO HP:0002788: An increased susceptibility to upper respiratory tract infections as manifested by a history of recurrent upper respiratory tract infections (running ears - otitis, sinusitis, pharyngitis, tonsillitis).",immune,recurrent upper respiratory infection,HPO
33023,Recurrent Upper Respiratory Infections,respiratory,"HPO exact synonym for Recurrent Upper Respiratory Tract Infections. HPO HP:0002788: An increased susceptibility to upper respiratory tract infections as manifested by a history of recurrent upper respiratory tract infections (running ears - otitis, sinusitis, pharyngitis, tonsillitis).",respiratory,recurrent upper respiratory infections,HPO
33024,Recurrent Upper Respiratory Tract Infections,respiratory,"HPO HP:0002788: An increased susceptibility to upper respiratory tract infections as manifested by a history of recurrent upper respiratory tract infections (running ears - otitis, sinusitis, pharyngitis, tonsillitis).",respiratory,recurrent upper respiratory tract infections,HPO
33025,Recurrent URI,general,"HPO exact synonym for Recurrent Upper Respiratory Tract Infections. HPO HP:0002788: An increased susceptibility to upper respiratory tract infections as manifested by a history of recurrent upper respiratory tract infections (running ears - otitis, sinusitis, pharyngitis, tonsillitis).",general,recurrent uri,HPO
33026,Recurrent Urinary Tract Infections,urinary,HPO HP:0000010: Repeated infections of the urinary tract.,urinary,recurrent urinary tract infections,HPO
33027,Recurrent UTIs,general,HPO exact synonym for Recurrent Urinary Tract Infections. HPO HP:0000010: Repeated infections of the urinary tract.,general,recurrent utis,HPO
33028,Recurrent Venous Thrombosis,general,HPO exact synonym for Recurrent Deep Vein Thrombosis. HPO HP:0004850: Repeated episodes of the formation of a blot clot in a deep vein.,general,recurrent venous thrombosis,HPO
33029,Recurrent Viral Infections,infectious,"HPO HP:0004429: Increased susceptibility to viral infections, as manifested by recurrent episodes of viral infection.",immune,recurrent viral infections,HPO
33030,Recurrent Viral Pneumonia,general,"HPO HP:0033214: Increased susceptibility to viral pneumonia, as manifested by recurrent episodes of viral pneumonias.",general,recurrent viral pneumonia,HPO
33031,Recurrent Viral Skin Infections,infectious,"HPO HP:0011371: Increased susceptibility to viral skin infections, as manifested by recurrent episodes of viral skin infections.",immune,recurrent viral skin infections,HPO
33032,Recurrent Viral Upper Respiratory Tract Infections,respiratory,"HPO HP:0033166: An increased susceptibility to viral upper respiratory tract infections as manifested by a history of recurrent viral upper respiratory tract infections (otitis, sinusitis, pharyngitis, tonsillitis).",respiratory,recurrent viral upper respiratory tract infections,HPO
33033,Recurrent Vulvovaginal Candidiasis,reproductive,"HPO HP:0012204: Recurrent infection involving the vulva, vagina, and adjacent crural areas, whereby the causative agent belongs to the genus Candida.",reproductive,recurrent vulvovaginal candidiasis,HPO
33034,"Recurrent, Involuntary, and Intrusive Distressing Memories",mental_health,"HPO HP:0032937: After experiencing psychological trauma, individuals may repeatedly encounter sensory-perceptual impressions of the event that intrude into their consciousness involuntarily. These intrusive memories often manifest as visual images (such as mental pictures), but can also involve sounds, smells, tastes, and physical sensations. They are accompanied by a variety of negative emotions linked to the most intense moments of the traumatic memory.",mental_behavioral,recurrent involuntary and intrusive distressing memories,HPO
33035,Recurring Nosebleed,general,"HPO exact synonym for Spontaneous, Recurrent Epistaxis. HPO HP:0004406: Human Phenotype Ontology term HP:0004406: Spontaneous, Recurrent Epistaxis.",general,recurring nosebleed,HPO
33036,Recurring Pancreas Inflammation,general,HPO exact synonym for Recurrent Pancreatitis. HPO HP:0100027: A recurrent form of pancreatitis.,general,recurring pancreas inflammation,HPO
33037,Recurring Pancreatitis,general,HPO exact synonym for Recurrent Pancreatitis. HPO HP:0100027: A recurrent form of pancreatitis.,general,recurring pancreatitis,HPO
33038,Red and Sore Corners of the Mouth,oral,HPO exact synonym for Angular Cheilitis. HPO HP:0030318: A type of inflammation of the lips involving one or both of the corners of the mouth.,oral,red and sore corners of the mouth,HPO
33039,Red and Swollen Gums,oral,HPO exact synonym for Gingivitis. HPO HP:0000230: Inflammation of the gingiva.,oral,red and swollen gums,HPO
33040,Red Blood Cell Casts,general,HPO exact synonym for Erythrocyte Cylindruria. HPO HP:0012617: Presence of erythrocyte casts (cylindrical structures produced by the kidney in certain disease states) in the urine.,general,red blood cell casts,HPO
33041,Red Blood Cell Keratocytosis,general,HPO HP:0005540: A form of poikilocytosis in which the abnormally shaped erythrocytes have notches that results in projections that look like horns.,general,red blood cell keratocytosis,HPO
33042,Red Cell Acanthocytosis,general,HPO exact synonym for Acanthocytosis. HPO HP:0001927: Acanthocytosis is a type of poikilocytosis characterized by the presence of spikes on the cell surface. The cells have an irregular shape resembling many-pointed stars.,general,red cell acanthocytosis,HPO
33043,Red Cell Aplasia,general,"HPO exact synonym for Pure Red Cell Aplasia. HPO HP:0012410: A type of anemia resulting from suppression of erythropoiesis with little or no abnormality of leukocyte or platelet production. Erythroblasts are virtually absent in bone marrow; however, leukocyte and platelet production show little",general,red cell aplasia,HPO
33044,Red Cell Stomatocytosis,general,HPO exact synonym for Stomatocytosis. HPO HP:0004446: The presence of erythrocytes with a mouth-shaped (stoma) area of central pallor on peripheral blood smear.,general,red cell stomatocytosis,HPO
33045,Red Desaturation,general,HPO HP:0030585: Human Phenotype Ontology term HP:0030585: Red Desaturation.,general,red desaturation,HPO
33046,Red Eye,sensory,HPO HP:0025337: A reddish appearance over the white part (sclera) of the eye ranging from a few enlarged blood vessels appearing as wiggly lines over the sclera to a bright red color completely covering to sclera.,special_senses,red eye,HPO
33047,Red Eyelid,sensory,"HPO exact synonym for Eyelid Erythema. HPO HP:0040323: Redness of the skin of the eyelids, caused by hyperemia of the capillaries in the lower layers of the skin.",special_senses,red eyelid,HPO
33048,Red Eyes,sensory,HPO exact synonym for Red Eye. HPO HP:0025337: A reddish appearance over the white part (sclera) of the eye ranging from a few enlarged blood vessels appearing as wiggly lines over the sclera to a bright red color completely covering to sclera.,special_senses,red eyes,HPO
33049,Red Face,general,"HPO exact synonym for Facial Erythema. HPO HP:0001041: Redness of the skin of the face, caused by hyperemia of the capillaries in the lower layers of the skin.",general,red face,HPO
33050,Red Green Color Blindness,sensory,HPO exact synonym for Red-green Dyschromatopsia. HPO HP:0000642: Difficulty with discriminating red and green hues.,special_senses,red green color blindness,HPO
33051,Red Green Colour Blindness,sensory,HPO exact synonym for Red-green Dyschromatopsia. HPO HP:0000642: Difficulty with discriminating red and green hues.,special_senses,red green colour blindness,HPO
33052,Red Hair,general,HPO HP:0002297: Human Phenotype Ontology term HP:0002297: Red Hair.,general,red hair,HPO
33053,Red Hair Color,general,HPO exact synonym for Red Hair. HPO HP:0002297: Human Phenotype Ontology term HP:0002297: Red Hair.,general,red hair color,HPO
33054,Red Hair Colour,general,HPO exact synonym for Red Hair. HPO HP:0002297: Human Phenotype Ontology term HP:0002297: Red Hair.,general,red hair colour,HPO
33055,Red Head (hair Color),general,HPO exact synonym for Red Hair. HPO HP:0002297: Human Phenotype Ontology term HP:0002297: Red Hair.,general,red head hair color,HPO
33056,Red in the Face,general,"HPO exact synonym for Facial Erythema. HPO HP:0001041: Redness of the skin of the face, caused by hyperemia of the capillaries in the lower layers of the skin.",general,red in the face,HPO
33057,Red or Purple Spots On the Skin,general,"HPO exact synonym for Purpura. HPO HP:0000979: Purpura (from Latin: purpura, meaning purple) is the appearance of red or purple discolorations on the skin that do not blanch on applying pressure. They are caused by bleeding underneath the skin. This term refers to an abnormally in",general,red or purple spots on the skin,HPO
33058,Red Tears,general,HPO exact synonym for Hemolacria. HPO HP:0034803: The presence of blood in tears.,general,red tears,HPO
33059,Red Teeth,general,"HPO exact synonym for Erythrodontia. HPO HP:0030756: Reddish, brown opalescent discoloration of teeth in normal light.",general,red teeth,HPO
33060,Red Urine,general,HPO HP:0040318: An abnormal red color of the urine.,general,red urine,HPO
33061,Red-blind,sensory,HPO exact synonym for Protanopia. HPO HP:0011522: Blue and green cones only; no functional red cones.,special_senses,red blind,HPO
33062,Red-brown Urine,general,HPO HP:0040320: An abnormal red-brown color of the urine.,general,red brown urine,HPO
33063,Red-green Dyschromatopsia,general,HPO HP:0000642: Difficulty with discriminating red and green hues.,general,red green dyschromatopsia,HPO
33064,Red-weak,general,"HPO exact synonym for Protanomaly. HPO HP:0200018: A type of anomalous trichromacy associated with defective long-wavelength-sensitive (L) cones, causing the sensitivity spectrum to be shifted toward medium wavelengths. This leads to difficulties especially in distinguishing red and g",general,red weak,HPO
33065,Redness of Skin or Mucous Membrane,general,"HPO exact synonym for Erythema. HPO HP:0010783: Redness of the skin, caused by hyperemia of the capillaries in the lower layers of the skin.",general,redness of skin or mucous membrane,HPO
33066,Reduce Response to GnRH Stimulation Test,general,"HPO exact synonym for Reduced Response to Gonadotropin-releasing Hormone Stimulation Test. HPO HP:0020159: Failure of the gonadotropin-releasing hormone (GnRH) stimulation test to induce an appropriate increased in luteinizing hormone (LH), follicle-stimulating hormone (FSH) levels.",general,reduce response to gnrh stimulation test,HPO
33067,Reduced 17-beta-hydroxysteroid Dehydrogenase 4 Activity,general,"HPO exact synonym for Reduced Bifunctional Protein Activity. HPO HP:4000164: Diminished activity of hydroxysteroid 17-beta dehydrogenase 4 (HSD17B4), also known as D-bifunctional protein (DBP), a peroxisomal enzyme that catalyzes multiple steps of beta-oxidation of very long chain fatty acids.",general,reduced 17 beta hydroxysteroid dehydrogenase 4 activity,HPO
33068,Reduced 3-beta-hydroxysteroid-delta-5-desaturase Activity in Cultured Fibroblasts,general,"HPO HP:6000199: Activity of 3-beta-hydroxysteroid-delta-5-desaturase, also known as Sterol C5-desaturase (EC 1.3.3.2), or SC5D below the lower limit of normal in cultured fibroblasts.",general,reduced 3 beta hydroxysteroid delta 5 desaturase activity in cultured fibroblasts,HPO
33069,Reduced 3-ketoacyl-CoA Thiolase Activity in Cultured Fibroblasts,general,HPO exact synonym for Diminished Acetyl-CoA C-acyltransferase Activity in Cultured Fibroblasts. HPO HP:6001024: Concentration or activity of acetyl-CoA C-acyltransferase (EC 2.3.1.16) as measured in cultured fibroblasts is below the limits of normal. This enzyme catalyzes the reaction acetyl-CoA + an acyl-CoA = a 3-oxoacyl-CoA + CoA. It is also,general,reduced 3 ketoacyl coa thiolase activity in cultured fibroblasts,HPO
33070,Reduced 3-methylcrotonyl CoA Carboxylase Activity in Cultured Fibroblasts,general,HPO HP:4000206: Activity of 3-methylcrotonyl-CoA carboxylase (EC 6.4.1.4) below the lower limit of normal in cultured fibroblasts.,general,reduced 3 methylcrotonyl coa carboxylase activity in cultured fibroblasts,HPO
33071,Reduced 3-phosphoglycerate Dehydrogenase Activity,general,"HPO HP:0034691: Diminished activity of the enzyme 3-phosphoglycerate dehydrogenase (PGDH), which catalyzes the first step in the pathway by converting D-3-phosphoglycerate (PGA), an intermediate in glycolysis, to phosphohydroxypyruvate concomitant with the reduction of NAD+.",general,reduced 3 phosphoglycerate dehydrogenase activity,HPO
33072,Reduced 4-Hydroxyphenylpyruvate Dioxygenase Level,general,HPO exact synonym for Reduced Circulating 4-Hydroxyphenylpyruvate Dioxygenase Activity. HPO HP:0003637: Activity or concentration of 4-hydroxyphenylpyruvate dioxygenase in the blood circulation below the lower limit of normal.,general,reduced 4 hydroxyphenylpyruvate dioxygenase level,HPO
33073,Reduced 5-oxoprolinase Level,general,HPO exact synonym for Reduced Circulating 5-oxoprolinase Activity. HPO HP:0040142: Activity or concentration of 5-oxoprolinase in the blood circulation below the lower limit of normal. This enzyme catalyzes the reaction 5-oxo-L-proline + ATP + 2 H(2)O = L-glutamate + ADP + 2 H(+) + phosphate.,general,reduced 5 oxoprolinase level,HPO
33074,Reduced 6-hydroxypurine Phosphoribosyltransferase Level,general,HPO exact synonym for Reduced Hypoxanthine-guanine Phosphoribosyltransferase Level. HPO HP:0031823: Abnormally decreased level of the enzyme that catalyzes conversion of hypoxanthine to inosine monophosphate and guanine to guanosine monophosphate via transfer of the 5-phosphoribosyl group from 5-phosphoribosyl 1-pyrophosphate.,general,reduced 6 hydroxypurine phosphoribosyltransferase level,HPO
33075,Reduced 6-mercaptopurine Phosphoribosyltransferase Level,general,HPO exact synonym for Reduced Hypoxanthine-guanine Phosphoribosyltransferase Level. HPO HP:0031823: Abnormally decreased level of the enzyme that catalyzes conversion of hypoxanthine to inosine monophosphate and guanine to guanosine monophosphate via transfer of the 5-phosphoribosyl group from 5-phosphoribosyl 1-pyrophosphate.,general,reduced 6 mercaptopurine phosphoribosyltransferase level,HPO
33076,Reduced Ability to Form Peer Relationships,general,"HPO HP:0000728: Difficulty to establish relations with others in a comparable social group (peers) that may be manifested in pehnomena such as not being able to initiative a conversation, understand social cues, or to discuss shared interests. This feature is associated with poor integration within a community or group.",general,reduced ability to form peer relationships,HPO
33077,Reduced Acetaldehyde Dehydrogenase Level,general,HPO HP:0003533: Decreased level of acetaldehyde dehydrogenase (ALDH). ALDH and alcohol dehydrogenase (ADH) are the primary enzymes involved in alcohol metabolism.,general,reduced acetaldehyde dehydrogenase level,HPO
33078,Reduced Acetylglucosamine-6-sulfatase Activity in Cultured Fibroblasts,general,HPO HP:4000198: Concentration or activity of N-acetylglucosamine-6-sulfatase (EC 3.1.6.14) as measured in cultured fibroblasts is below the limits of normal. N-acetylglucosamine-6-sulfatase hydrolyzes heparan sulfate and keratan sulfate.,general,reduced acetylglucosamine 6 sulfatase activity in cultured fibroblasts,HPO
33079,Reduced Acetylglucosamine-6-sulfate Sulfatase Activity in Cultured Fibroblasts,general,HPO exact synonym for Reduced Acetylglucosamine-6-sulfatase Activity in Cultured Fibroblasts. HPO HP:4000198: Concentration or activity of N-acetylglucosamine-6-sulfatase (EC 3.1.6.14) as measured in cultured fibroblasts is below the limits of normal. N-acetylglucosamine-6-sulfatase hydrolyzes heparan sulfate and keratan sulfate.,general,reduced acetylglucosamine 6 sulfate sulfatase activity in cultured fibroblasts,HPO
33080,Reduced Acyl-CoA:dihydroxyacetone Phosphate Acyltransferase Activity in Cultured Fibroblasts,general,HPO HP:6000426: Activity of acyl-CoA:dihydroxyacetone phosphate acyltransferase below the lower limit of normal in cultured fibroblasts.,general,reduced acyl coa dihydroxyacetone phosphate acyltransferase activity in cultured fibroblasts,HPO
33081,Reduced Albumin Concentration,general,HPO exact synonym for Hypoalbuminemia. HPO HP:0003073: The concentration of albumin in the blood circulation is below the lower limit of normal.,general,reduced albumin concentration,HPO
33082,Reduced Albumin Level,general,HPO exact synonym for Hypoalbuminemia. HPO HP:0003073: The concentration of albumin in the blood circulation is below the lower limit of normal.,general,reduced albumin level,HPO
33083,Reduced Albumin Level in Blood,general,HPO exact synonym for Hypoalbuminemia. HPO HP:0003073: The concentration of albumin in the blood circulation is below the lower limit of normal.,general,reduced albumin level in blood,HPO
33084,Reduced Aldolase Level,general,"HPO exact synonym for Reduced Circulating Aldolase Concentration. HPO HP:0012545: Concentration of fructose 1,6-bisphosphate aldolase in the blood circulation below the lower limit of normal.",general,reduced aldolase level,HPO
33085,Reduced Alkyl-DHAP Synthase Activity in Cultured Fibroblasts,general,HPO exact synonym for Reduced Alkyl-dihydroxyacetonephosphate Synthase Activity in Cultured Fibroblasts. HPO HP:6000427: Activity of alkyl-dihydroxyacetonephosphate (DHAP) synthase below the lower limit of normal in cultured fibroblasts.,general,reduced alkyl dhap synthase activity in cultured fibroblasts,HPO
33086,Reduced Alkyl-dihydroxyacetonephosphate Synthase Activity in Cultured Fibroblasts,general,HPO HP:6000427: Activity of alkyl-dihydroxyacetonephosphate (DHAP) synthase below the lower limit of normal in cultured fibroblasts.,general,reduced alkyl dihydroxyacetonephosphate synthase activity in cultured fibroblasts,HPO
33087,Reduced Alpha-2-antiplasmin Activity,general,HPO HP:0040245: Reduced activity of alpha-2-antiplasmin. This protein inactivates the protease plasmin that drives fibrinolysis.,general,reduced alpha 2 antiplasmin activity,HPO
33088,Reduced Alpha-aminoadipic Semialdehyde Synthase Activity in Cultured Fibroblasts,general,HPO HP:6000081: Activity of alpha-aminoadipic semialdehyde synthase below the lower limit of normal in cultured fibroblasts.,general,reduced alpha aminoadipic semialdehyde synthase activity in cultured fibroblasts,HPO
33089,Reduced Alpha-methylacyl-CoA Racemase Activity in Cultured Fibroblasts,general,HPO HP:6000134: Activity of alpha-methylacyl-CoA racemase (AMACR; EC 5.1.99.4) below the lower limit of normal in cultured fibroblasts.,general,reduced alpha methylacyl coa racemase activity in cultured fibroblasts,HPO
33090,Reduced Alpha/beta Synthesis Ratio,general,HPO HP:0011907: A reduction in the ratio of production of alpha globin to that of beta globin. This is the major abnormality in the various forms of alpha thalassemia.,general,reduced alpha beta synthesis ratio,HPO
33091,Reduced Amount of Scalp Hair,general,HPO exact synonym for Sparse Scalp Hair. HPO HP:0002209: Decreased number of hairs per unit area of skin of the scalp.,general,reduced amount of scalp hair,HPO
33092,Reduced Amplitude of Dark-adapted Bright Flash Electroretinogram A-wave,general,HPO HP:0030483: An abnormal reduction in the amplitude of the a-wave.,general,reduced amplitude of dark adapted bright flash electroretinogram a wave,HPO
33093,Reduced Amplitude of Dark-adapted Bright Flash Electroretinogram B-wave,general,HPO exact synonym for ERG: Reduced Dark-adapted B-wave Amplitude. HPO HP:0007984: A dark-adapted bright flash electroretinogram in which the b-wave that is of markedly lower amplitude than the associated a-wave.,general,reduced amplitude of dark adapted bright flash electroretinogram b wave,HPO
33094,Reduced Amygdala Volume,general,HPO HP:0025444: A decrease in the volume (size) of the amygdyla.,general,reduced amygdala volume,HPO
33095,Reduced Androgen-binding Protein Level,general,HPO exact synonym for Reduced Sex -hormone Binding Protein Level. HPO HP:0031419: A decreased concentration of sex-hormone binding protein in the circulation.,general,reduced androgen binding protein level,HPO
33096,Reduced Anterior Scleral Thickness,general,HPO HP:0025751: A reduction in the height of the anterior portion of the sclera.,general,reduced anterior scleral thickness,HPO
33097,Reduced Anterior-posterior Chest Diameter,general,"HPO exact synonym for Narrow Chest. HPO HP:0000774: Reduced width of the chest from side to side, associated with a reduced distance from the sternal notch to the tip of the shoulder.",general,reduced anterior posterior chest diameter,HPO
33098,Reduced Anterior-posterior Diameter of Vertebral Bodies,general,HPO exact synonym for Narrow Anterio-posterior Vertebral Body Diameter. HPO HP:0008473: An abnormal reduction of the anterioposterior diameter of the vertebral body.,general,reduced anterior posterior diameter of vertebral bodies,HPO
33099,Reduced Antigen-specific T Cell Proliferation,general,HPO HP:0031402: Impaired proliferation and expansion of a T cell population following activation by an antigenic stimulus.,general,reduced antigen specific t cell proliferation,HPO
33100,Reduced Antithrombin Antigen,general,HPO HP:0040246: Reduced antithrombin antigen. A reduced level of antithrombin may lead to an increased risk of thrombus formation.,general,reduced antithrombin antigen,HPO
33101,Reduced Antithrombin III Activity,general,HPO HP:0001976: An abnormality of coagulation related to a decreased concentration of antithrombin-III.,general,reduced antithrombin iii activity,HPO
33102,Reduced Antral Follicle Count,general,HPO HP:0033085: A count of antral follicles that is lower than normal for age.,general,reduced antral follicle count,HPO
33103,Reduced Argininosuccinate Synthetase Activity in Cultured Fibroblasts,general,"HPO exact synonym for Reduced Tissue Argininosuccinate Synthetase Activity. HPO HP:6000353: Concentration of argininosuccinate synthetase (EC 6.3.4.5) in body tissues is below the lower limit of normal. Clinically, argininosuccinate synthetase is measured in the liver or in cultered skin fibroblasts.",general,reduced argininosuccinate synthetase activity in cultured fibroblasts,HPO
33104,Reduced Arm Span,general,HPO HP:0012770: Decreased length of the arm span (length from one end of an individual's arms measured at the fingertips to the other when raised parallel to the ground at shoulder height at a one-hundred eighty degree angle).,general,reduced arm span,HPO
33105,Reduced Aromatase Activity,general,HPO HP:0034700: Enzyme activity of aromatase below the lower limit of normal.,general,reduced aromatase activity,HPO
33106,Reduced Aspartoacylase Activity in Cultured Fibroblasts,general,"HPO HP:6000354: Activity of aspartoacylase below the lower limit of normal in cultured fibroblasts. Aspartoacylase (EC 3.5.1.15), also called aminoacylase-2, is an enzyme that hydrolyzes N-acetyl-L-aspartic acid (NAA) to aspartate and acetate.",general,reduced aspartoacylase activity in cultured fibroblasts,HPO
