symptom_id,symptom_name,category,description,related_body_system,search_name,source
17412,Eyes At Different Heights,sensory,"HPO exact synonym for Vertical Orbital Dystopia. HPO HP:0030867: The orbits do not lie on the same horizontal plane, that is, one eye is lower than the other.",special_senses,eyes at different heights,HPO
17413,Fabry Syndrome,general,HPO exact synonym for Angiokeratoma Corporis Diffusum. HPO HP:0001071: Angiokeratoma corporis diffusum (ACD) is typically characterized by innumerable small red to black papules which occur in clusters and are situated symmetrically in the bathing trunks area. The number of lesions and the extension of t,general,fabry syndrome,HPO
17414,Face Blindness,sensory,HPO exact synonym for Prosopagnosia. HPO HP:0010528: Inability to recognize faces of familiar persons.,special_senses,face blindness,HPO
17415,Face of the Giant Panda Sign,general,"HPO HP:0034254: The face of the giant panda sign on T2-weighted MRI is characterized by preservation of normal signal intensity in the red nuclei and lateral portion of the pars reticulata of the substantia nigra, high signal in the tegmentum, and hypointensity of the superior colliculus. The findings are said to resemble the face of a giant panda.",general,face of the giant panda sign,HPO
17416,Face Tumor,general,HPO exact synonym for Facial Neoplasm. HPO HP:0012289: A tumor (abnormal growth of tissue) of the face.,general,face tumor,HPO
17417,Face Tumour,general,HPO exact synonym for Facial Neoplasm. HPO HP:0012289: A tumor (abnormal growth of tissue) of the face.,general,face tumour,HPO
17418,Face Weakness,neurological,HPO exact synonym for Weakness of Facial Musculature. HPO HP:0030319: Reduced strength of one or more muscles innervated by the facial nerve (the seventh cranial nerve).,nervous,face weakness,HPO
17419,Face with Broad Temples and Narrow Chin,general,"HPO exact synonym for Triangular Face. HPO HP:0000325: Facial contour, as viewed from the front, triangular in shape, with breadth at the temples and tapering to a narrow chin.",general,face with broad temples and narrow chin,HPO
17420,Facet Arthritis,musculoskeletal,HPO exact synonym for Facet Joint Arthrosis. HPO HP:0030871: Osteoarthritis of facet joints in the spine. Degeneration of cartilage in the facet joints results in bone rubbing on bone and reactive new bone formation visible on X-ray.,musculoskeletal,facet arthritis,HPO
17421,Facet Joint Arthrosis,musculoskeletal,HPO HP:0030871: Osteoarthritis of facet joints in the spine. Degeneration of cartilage in the facet joints results in bone rubbing on bone and reactive new bone formation visible on X-ray.,musculoskeletal,facet joint arthrosis,HPO
17422,Facial Abnormality,general,HPO exact synonym for Abnormality of the Face. HPO HP:0000271: An abnormality of the face.,general,facial abnormality,HPO
17423,Facial Agnosia,general,HPO exact synonym for Prosopagnosia. HPO HP:0010528: Inability to recognize faces of familiar persons.,general,facial agnosia,HPO
17424,Facial Angiofibromas,general,HPO exact synonym for Adenoma Sebaceum. HPO HP:0009720: The presence of a sebaceous adenoma with origin in the sebum secreting cells of the skin.,general,facial angiofibromas,HPO
17425,Facial Asymmetry,general,HPO HP:0000324: An abnormal difference between the left and right sides of the face.,general,facial asymmetry,HPO
17426,Facial Capillary Hemangioma,general,"HPO HP:0000996: Hemangioma, a benign tumor of the vascular endothelial cells with small endothelial spaces, occurring in the face.",general,facial capillary hemangioma,HPO
17427,Facial Cleft,general,HPO exact synonym for Tessier Cleft. HPO HP:0002006: A congenital malformation with a cleft (gap or opening) in the face.,general,facial cleft,HPO
17428,Facial Cyanosis,cardiovascular,HPO HP:0034031: Bluish discoloration of one or more regions of the face.,cardiovascular,facial cyanosis,HPO
17429,Facial Diplegia,general,HPO HP:0001349: Facial diplegia refers to bilateral facial palsy (bilateral facial palsy is much rarer than unilateral facial palsy).,general,facial diplegia,HPO
17430,Facial Droop,neurological,HPO exact synonym for Unilateral Facial Palsy. HPO HP:0012799: One-sided weakness of the muscles of facial expression and eye closure.,nervous,facial droop,HPO
17431,Facial Dysmorphism,general,HPO exact synonym for Abnormal Facial Shape. HPO HP:0001999: An abnormal morphology (form) of the face or its components.,general,facial dysmorphism,HPO
17432,Facial Edema,cardiovascular,HPO HP:0000282: Human Phenotype Ontology term HP:0000282: Facial Edema.,cardiovascular,facial edema,HPO
17433,Facial Erythema,dermatological,"HPO HP:0001041: Redness of the skin of the face, caused by hyperemia of the capillaries in the lower layers of the skin.",integumentary,facial erythema,HPO
17434,Facial Expressions Not Directed to Others,general,HPO HP:5200100: Human Phenotype Ontology term HP:5200100: Facial Expressions Not Directed to Others.,general,facial expressions not directed to others,HPO
17435,Facial Expressions That Do Not Match the Context,general,HPO HP:4000088: Production of facial expressions that are misaligned with the social context.,general,facial expressions that do not match the context,HPO
17436,Facial Fat Atrophy,general,HPO exact synonym for Progressive Loss of Facial Adipose Tissue. HPO HP:0009019: Human Phenotype Ontology term HP:0009019: Progressive Loss of Facial Adipose Tissue.,general,facial fat atrophy,HPO
17437,Facial Fat Wasting,general,HPO exact synonym for Progressive Loss of Facial Adipose Tissue. HPO HP:0009019: Human Phenotype Ontology term HP:0009019: Progressive Loss of Facial Adipose Tissue.,general,facial fat wasting,HPO
17438,Facial Flushing After Alcohol Intake,general,HPO HP:0001033: Human Phenotype Ontology term HP:0001033: Facial Flushing After Alcohol Intake.,general,facial flushing after alcohol intake,HPO
17439,Facial Grimacing,general,HPO HP:0000273: Human Phenotype Ontology term HP:0000273: Facial Grimacing.,general,facial grimacing,HPO
17440,Facial Hemangioma,general,"HPO HP:0000329: Hemangioma, a benign tumor of the vascular endothelial cells, occurring in the face.",general,facial hemangioma,HPO
17441,Facial Hemangiomata,general,"HPO exact synonym for Facial Hemangioma. HPO HP:0000329: Hemangioma, a benign tumor of the vascular endothelial cells, occurring in the face.",general,facial hemangiomata,HPO
17442,Facial Hemiatrophy,general,"HPO exact synonym for Hemifacial Atrophy. HPO HP:0011331: Unilateral atrophy of facial tissues, including muscles, bones and skin.",general,facial hemiatrophy,HPO
17443,Facial Hemihypertophy,general,"HPO exact synonym for Hemifacial Hypertrophy. HPO HP:0005323: Unilateral overgrowth of facial tissues, including muscles, bones and skin.",general,facial hemihypertophy,HPO
17444,Facial Hirsutism,general,HPO HP:0009937: Excess facial hair.,general,facial hirsutism,HPO
17445,Facial Hyperostosis,general,"HPO HP:0005465: Excessive growth (overgrowth) of the facial bones, that is of the facial skeleton.",general,facial hyperostosis,HPO
17446,Facial Hypertrichosis,general,"HPO HP:0002219: Excessive, increased hair growth located in the facial region.",general,facial hypertrichosis,HPO
17447,Facial Hypoplasia,general,HPO exact synonym for Small Face. HPO HP:0000274: A face that is short and narrow.,general,facial hypoplasia,HPO
17448,Facial Hypotonia,general,HPO HP:0000297: Reduced muscle tone of a muscle that is innervated by the facial nerve (the seventh cranial nerve).,general,facial hypotonia,HPO
17449,Facial Melanosis,general,"HPO exact synonym for Melasma. HPO HP:0025272: Symmetrical, blotchy, brownish facial pigmentation.",general,facial melanosis,HPO
17450,Facial Midline Hemangioma,general,"HPO HP:0004664: Hemangioma, a benign tumor of the vascular endothelial cells, occurring in the midline region of the face.",general,facial midline hemangioma,HPO
17451,Facial Muscle Hypertrophy,musculoskeletal,HPO HP:0012892: Hypertrophy of one or more muscles innervated by the facial nerve (the seventh cranial nerve).,musculoskeletal,facial muscle hypertrophy,HPO
17452,Facial Muscle Issue,musculoskeletal,HPO exact synonym for Abnormality of Facial Musculature. HPO HP:0000301: An anomaly of a muscle that is innervated by the facial nerve (the seventh cranial nerve).,musculoskeletal,facial muscle issue,HPO
17453,Facial Muscle Weakness,neurological,HPO exact synonym for Weakness of Facial Musculature. HPO HP:0030319: Reduced strength of one or more muscles innervated by the facial nerve (the seventh cranial nerve).,nervous,facial muscle weakness,HPO
17454,Facial Myokymia,general,HPO HP:0000317: Facial myokymia is a fine fibrillary activity of one or more muscles innervated by the facial nerve (the seventh cranial nerve).,general,facial myokymia,HPO
17455,Facial Neoplasm,general,HPO HP:0012289: A tumor (abnormal growth of tissue) of the face.,general,facial neoplasm,HPO
17456,Facial Nerve Compression,general,"HPO HP:6000411: Impingement of another object such as a blood vessel upon the facial nerve, causing it to lose volume in the compressed region.",general,facial nerve compression,HPO
17457,Facial Nerve Palsy,general,HPO exact synonym for Facial Palsy. HPO HP:0010628: Facial nerve palsy is a dysfunction of cranial nerve VII (the facial nerve) that results in inability to control facial muscles on the affected side with weakness of the muscles of facial expression and eye closure. This can either be,general,facial nerve palsy,HPO
17458,Facial Nerve Paralysis,neurological,HPO exact synonym for Facial Palsy. HPO HP:0010628: Facial nerve palsy is a dysfunction of cranial nerve VII (the facial nerve) that results in inability to control facial muscles on the affected side with weakness of the muscles of facial expression and eye closure. This can either be,nervous,facial nerve paralysis,HPO
17459,Facial Oedema,cardiovascular,HPO exact synonym for Facial Edema. HPO HP:0000282: Human Phenotype Ontology term HP:0000282: Facial Edema.,cardiovascular,facial oedema,HPO
17460,Facial Palsy,general,HPO HP:0010628: Facial nerve palsy is a dysfunction of cranial nerve VII (the facial nerve) that results in inability to control facial muscles on the affected side with weakness of the muscles of facial expression and eye closure. This can either be present in unilateral or bilateral form.,general,facial palsy,HPO
17461,Facial Palsy Caused By Enlargement of Cranial Bones,musculoskeletal,HPO exact synonym for Facial Palsy Secondary to Cranial Hyperostosis. HPO HP:0007285: Paralysis of the facial nerves on the basis of overgrowth of the cranial bones causing impingement upon the seventh cranial nerve.,musculoskeletal,facial palsy caused by enlargement of cranial bones,HPO
17462,Facial Palsy Caused By Excessive Growth of Facial Bones,musculoskeletal,HPO exact synonym for Facial Palsy Secondary to Cranial Hyperostosis. HPO HP:0007285: Paralysis of the facial nerves on the basis of overgrowth of the cranial bones causing impingement upon the seventh cranial nerve.,musculoskeletal,facial palsy caused by excessive growth of facial bones,HPO
17463,Facial Palsy Caused By Overgrowth of Cranial Bones,musculoskeletal,HPO exact synonym for Facial Palsy Secondary to Cranial Hyperostosis. HPO HP:0007285: Paralysis of the facial nerves on the basis of overgrowth of the cranial bones causing impingement upon the seventh cranial nerve.,musculoskeletal,facial palsy caused by overgrowth of cranial bones,HPO
17464,Facial Palsy Secondary to Cranial Hyperostosis,general,HPO HP:0007285: Paralysis of the facial nerves on the basis of overgrowth of the cranial bones causing impingement upon the seventh cranial nerve.,general,facial palsy secondary to cranial hyperostosis,HPO
17465,Facial Palsy Secondary to Hypertrophy of Cranial Bones,musculoskeletal,HPO exact synonym for Facial Palsy Secondary to Cranial Hyperostosis. HPO HP:0007285: Paralysis of the facial nerves on the basis of overgrowth of the cranial bones causing impingement upon the seventh cranial nerve.,musculoskeletal,facial palsy secondary to hypertrophy of cranial bones,HPO
17466,"Facial Palsy, Unilateral or Bilateral",general,HPO exact synonym for Facial Palsy. HPO HP:0010628: Facial nerve palsy is a dysfunction of cranial nerve VII (the facial nerve) that results in inability to control facial muscles on the affected side with weakness of the muscles of facial expression and eye closure. This can either be,general,facial palsy unilateral or bilateral,HPO
17467,Facial Papilloma,general,HPO HP:0040167: Human Phenotype Ontology term HP:0040167: Facial Papilloma.,general,facial papilloma,HPO
17468,Facial Paralysis,neurological,"HPO HP:0007209: Complete loss of ability to move facial muscles innervated by the facial nerve (i.e., the seventh cranial nerve).",nervous,facial paralysis,HPO
17469,Facial Paresis,general,"HPO exact synonym for Facial Paralysis. HPO HP:0007209: Complete loss of ability to move facial muscles innervated by the facial nerve (i.e., the seventh cranial nerve).",general,facial paresis,HPO
17470,"Facial Paresis, Bilateral",general,HPO exact synonym for Facial Diplegia. HPO HP:0001349: Facial diplegia refers to bilateral facial palsy (bilateral facial palsy is much rarer than unilateral facial palsy).,general,facial paresis bilateral,HPO
17471,Facial Puffiness,general,HPO exact synonym for Facial Edema. HPO HP:0000282: Human Phenotype Ontology term HP:0000282: Facial Edema.,general,facial puffiness,HPO
17472,Facial Shape Compression,general,HPO exact synonym for Facial Shape Deformation. HPO HP:0011334: Human Phenotype Ontology term HP:0011334: Facial Shape Deformation.,general,facial shape compression,HPO
17473,Facial Shape Deformation,general,HPO HP:0011334: Human Phenotype Ontology term HP:0011334: Facial Shape Deformation.,general,facial shape deformation,HPO
17474,Facial Spasms,musculoskeletal,"HPO exact synonym for Facial Tics. HPO HP:0011468: Sudden, repetitive, nonrhythmic motor movements (spasms), involving the eyes and muscles of the face.",musculoskeletal,facial spasms,HPO
17475,Facial Swelling,cardiovascular,HPO exact synonym for Facial Edema. HPO HP:0000282: Human Phenotype Ontology term HP:0000282: Facial Edema.,cardiovascular,facial swelling,HPO
17476,Facial Synkinesis,general,HPO HP:0034979: Unintentional movement in one area of the face produced during intentional movement of another area of the face.,general,facial synkinesis,HPO
17477,Facial Telangiectasia,general,HPO HP:0007380: Telangiectases (small dilated blood vessels) located near the surface of the skin of the face.,general,facial telangiectasia,HPO
17478,Facial Telangiectasia in Butterfly Midface Distribution,general,HPO HP:0005598: Telangiectases (small dilated blood vessels) located near the surface of the skin in a butterfly midface distribution.,general,facial telangiectasia in butterfly midface distribution,HPO
17479,Facial Telangiectatic Vessels,general,HPO exact synonym for Facial Telangiectasia. HPO HP:0007380: Telangiectases (small dilated blood vessels) located near the surface of the skin of the face.,general,facial telangiectatic vessels,HPO
17480,Facial Tics,general,"HPO HP:0011468: Sudden, repetitive, nonrhythmic motor movements (spasms), involving the eyes and muscles of the face.",general,facial tics,HPO
17481,Facial Verruca,general,HPO exact synonym for Facial Papilloma. HPO HP:0040167: Human Phenotype Ontology term HP:0040167: Facial Papilloma.,general,facial verruca,HPO
17482,Facial Wart,general,HPO exact synonym for Facial Papilloma. HPO HP:0040167: Human Phenotype Ontology term HP:0040167: Facial Papilloma.,general,facial wart,HPO
17483,Facial Weakness,neurological,Weakness on one or both sides of the face; may indicate facial nerve palsy.,nervous,facial weakness,ICD-10-CM
17484,Facial Wrinkling,general,HPO HP:0009762: Excessive wrinkling of the skin of the face.,general,facial wrinkling,HPO
17485,Facial-lingual Fasciculations,general,HPO HP:0007089: Fasciculations affecting the tongue muscle and the musculature of the face.,general,facial lingual fasciculations,HPO
17486,Factor X Activation Deficiency,general,HPO HP:0008354: Reduced ability to transform factor X into its activated form factor Xa.,general,factor x activation deficiency,HPO
17487,Factor XII Deficiency,general,"HPO exact synonym for Reduced Factor XII Activity. HPO HP:0004841: Decreased activity of coagulation factor XII. Factor XII (fXII) is part of the intrinsic coagulation pathway and binds to exposed collagen at site of vessel wall injury, activated by high-MW kininogen and kallikrein, thereby initiatin",general,factor xii deficiency,HPO
17488,Factor XIII Subunit a Deficiency,general,"HPO HP:0040233: Deficiency of factor XIII subunit A, leading to a reduced factor XIII activity. Activated Factor XIII cross-links fibrin polymers solidifying the clot.",general,factor xiii subunit a deficiency,HPO
17489,Factor XIII Subunit B Deficiency,general,"HPO HP:0040234: Deficiency of factor XIII subunit B, leading to a reduced factor XIII activity. Activated Factor XIII cross-links fibrin polymers solidifying the clot.",general,factor xiii subunit b deficiency,HPO
17490,Faecal Incontinence,urinary,HPO exact synonym for Bowel Incontinence. HPO HP:0002607: Involuntary fecal soiling in adults and children who have usually already been toilet trained.,urinary,faecal incontinence,HPO
17491,Faecal Urgency,urinary,"HPO exact synonym for Bowel Urgency. HPO HP:0012701: A sudden, irresistible need to have a bowel movement.",urinary,faecal urgency,HPO
17492,Faecal Vomiting,gastrointestinal,HPO exact synonym for Feculent Vomiting. HPO HP:0025089: Vomiting of material that is of fecal origin.,gastrointestinal,faecal vomiting,HPO
17493,Failed Liver Development,general,HPO exact synonym for Hepatic Agenesis. HPO HP:0100839: Absence of the liver owing to a failure of the liver to develop.,general,failed liver development,HPO
17494,Failure of Dental Eruption Due to Mucopolysaccharidoses,general,HPO exact synonym for Buried Teeth Encased in Mucopolysaccharide. HPO HP:0006326: Human Phenotype Ontology term HP:0006326: Buried Teeth Encased in Mucopolysaccharide.,general,failure of dental eruption due to mucopolysaccharidoses,HPO
17495,Failure of Development of a Tooth,oral,"HPO exact synonym for Selective Tooth Agenesis. HPO HP:0001592: Agenesis specifically affecting one of the classes incisor, premolar, or molar.",oral,failure of development of a tooth,HPO
17496,Failure of Development of All Teeth,general,HPO exact synonym for Anodontia. HPO HP:0000674: The absence of all teeth from the normal series by a failure to develop.,general,failure of development of all teeth,HPO
17497,Failure of Development of Between One and Six Teeth,general,HPO exact synonym for Hypodontia. HPO HP:0000668: The absence of five or less teeth from the normal series by a failure to develop.,general,failure of development of between one and six teeth,HPO
17498,Failure of Development of Bicuspid,general,HPO exact synonym for Agenesis of Premolar. HPO HP:0011051: Agenesis of premolar tooth.,general,failure of development of bicuspid,HPO
17499,Failure of Development of Canine,general,HPO exact synonym for Agenesis of Canine. HPO HP:0012738: Agenesis of canine tooth.,general,failure of development of canine,HPO
17500,Failure of Development of Cartilage of Nose,general,HPO exact synonym for Absent Nasal Cartilage. HPO HP:0030028: Lack of a palpable nasal cartilage.,general,failure of development of cartilage of nose,HPO
17501,Failure of Development of Central Incisor,general,"HPO exact synonym for Agenesis of Central Incisor. HPO HP:0006289: Agenesis of one or more central incisors, i.e., of lower secondary incisor, lower primary incisor, upper secondary incisor, or of upper central primary incisor.",general,failure of development of central incisor,HPO
17502,Failure of Development of Cupid's Bow,general,HPO exact synonym for Absent Cupid's Bow. HPO HP:0010800: Lack of paramedian peaks and median notch of the upper lip vermilion.,general,failure of development of cupid s bow,HPO
17503,Failure of Development of Deciduous Mandibular Central Incisor,general,HPO exact synonym for Agenesis of Primary Mandibular Central Incisor. HPO HP:0011047: Agenesis of lower primary incisor.,general,failure of development of deciduous mandibular central incisor,HPO
17504,Failure of Development of Deciduous Mandibular Lateral Incisor,general,HPO exact synonym for Agenesis of Primary Mandibular Lateral Incisor. HPO HP:0200159: Human Phenotype Ontology term HP:0200159: Agenesis of Primary Mandibular Lateral Incisor.,general,failure of development of deciduous mandibular lateral incisor,HPO
17505,Failure of Development of Deciduous Maxillary Central Incisor,general,HPO exact synonym for Agenesis of Primary Maxillary Central Incisor. HPO HP:0011046: Agenesis of upper central primary incisor.,general,failure of development of deciduous maxillary central incisor,HPO
17506,Failure of Development of Deciduous Maxillary Lateral Incisor,general,"HPO exact synonym for Agenesis of Primary Maxillary Lateral Incisor. HPO HP:0011049: Agenesis of one or more maxillary lateral incisor, comprising the maxillary lateral primary incisor.",general,failure of development of deciduous maxillary lateral incisor,HPO
17507,Failure of Development of Ethmoid Sinuses,general,HPO exact synonym for Absent Ethmoidal Sinuses. HPO HP:0005456: Lack (aplasia) of the ethmoidal sinus.,general,failure of development of ethmoid sinuses,HPO
17508,Failure of Development of Eye Tooth,sensory,HPO exact synonym for Agenesis of Canine. HPO HP:0012738: Agenesis of canine tooth.,oral,failure of development of eye tooth,HPO
17509,Failure of Development of Eyeball,sensory,HPO exact synonym for Anophthalmia. HPO HP:0000528: Absence of the globe or eyeball.,special_senses,failure of development of eyeball,HPO
17510,Failure of Development of Eyebrows,sensory,HPO exact synonym for Absent Eyebrow. HPO HP:0002223: Absence of the eyebrow.,special_senses,failure of development of eyebrows,HPO
17511,Failure of Development of Eyelashes,sensory,HPO exact synonym for Absent Eyelashes. HPO HP:0000561: Lack of eyelashes.,special_senses,failure of development of eyelashes,HPO
17512,Failure of Development of Eyelid,sensory,HPO exact synonym for Aplasia/Hypoplasia of the Eyelid. HPO HP:0011226: Absence or underdevelopment of the eyelid.,special_senses,failure of development of eyelid,HPO
17513,Failure of Development of Facial Bones,musculoskeletal,HPO exact synonym for Aplasia of Facial Bones. HPO HP:0040008: Human Phenotype Ontology term HP:0040008: Aplasia of Facial Bones.,musculoskeletal,failure of development of facial bones,HPO
17514,Failure of Development of First Permanent Molar,general,HPO exact synonym for Agenesis of First Permanent Molar Tooth. HPO HP:0011056: Agenesis of either maxillary first permanent molar or mandibular first permanent molar or both.,general,failure of development of first permanent molar,HPO
17515,Failure of Development of Incisor,general,HPO exact synonym for Agenesis of Incisor. HPO HP:0006485: Agenesis of incisor.,general,failure of development of incisor,HPO
17516,Failure of Development of Lateral Incisor,general,HPO exact synonym for Agenesis of Lateral Incisor. HPO HP:0200153: Human Phenotype Ontology term HP:0200153: Agenesis of Lateral Incisor.,general,failure of development of lateral incisor,HPO
17517,Failure of Development of Lower Eyelashes,sensory,HPO exact synonym for Absent Lower Eyelashes. HPO HP:0007646: Lack of eyelashes on the lower lid.,special_senses,failure of development of lower eyelashes,HPO
17518,Failure of Development of Lower Jaw,general,HPO exact synonym for Mandibular Aplasia. HPO HP:0009939: Absence of the mandible.,general,failure of development of lower jaw,HPO
17519,Failure of Development of Mandible,general,HPO exact synonym for Mandibular Aplasia. HPO HP:0009939: Absence of the mandible.,general,failure of development of mandible,HPO
17520,Failure of Development of Mandibular Central Incisor,general,HPO exact synonym for Agenesis of Mandibular Central Incisor. HPO HP:0006355: Agenesis of lower secondary incisor or lower primary incisor.,general,failure of development of mandibular central incisor,HPO
17521,Failure of Development of Mandibular Incisor,general,HPO exact synonym for Agenesis of Mandibular Incisor. HPO HP:0200161: Human Phenotype Ontology term HP:0200161: Agenesis of Mandibular Incisor.,general,failure of development of mandibular incisor,HPO
17522,Failure of Development of Mandibular Lateral Incisor,general,HPO exact synonym for Agenesis of Mandibular Lateral Incisor. HPO HP:0200154: Human Phenotype Ontology term HP:0200154: Agenesis of Mandibular Lateral Incisor.,general,failure of development of mandibular lateral incisor,HPO
17523,Failure of Development of Mandibular Premolar,general,HPO exact synonym for Agenesis of Mandibular Premolar. HPO HP:0011053: Agenesis of mandibular premolar.,general,failure of development of mandibular premolar,HPO
17524,Failure of Development of Mastoid,general,HPO exact synonym for Absent Mastoid. HPO HP:0012761: A developmental anomaly in which the mastoid process fails to form and is thus found to be congenitally absent.,general,failure of development of mastoid,HPO
17525,Failure of Development of Maxilla,general,HPO exact synonym for Aplasia of the Maxilla. HPO HP:0010667: A congenital defect characterized by absence of the Maxilla.,general,failure of development of maxilla,HPO
17526,Failure of Development of Maxillary Bicuspid,general,HPO exact synonym for Agenesis of Maxillary Premolar. HPO HP:0011052: Agenesis of maxillary premolar.,general,failure of development of maxillary bicuspid,HPO
