symptom_id,symptom_name,category,description,related_body_system,search_name,source
24992,Language Delayed,general,HPO exact synonym for Delayed Speech and Language Development. HPO HP:0000750: A degree of language development that is significantly below the norm for a child of a specified age.,general,language delayed,HPO
24993,Language Development Deficit,general,HPO exact synonym for Delayed Speech and Language Development. HPO HP:0000750: A degree of language development that is significantly below the norm for a child of a specified age.,general,language development deficit,HPO
24994,Language Disorder,general,"HPO exact synonym for Language Impairment. HPO HP:0002463: Language impairment is a deficit in comprehension or production of language that includes reduced vocabulary, limited sentence structure, or impairments in written or spoken communication. Language abilities are substantially and quan",general,language disorder,HPO
24995,Language Impairment,general,"HPO HP:0002463: Language impairment is a deficit in comprehension or production of language that includes reduced vocabulary, limited sentence structure, or impairments in written or spoken communication. Language abilities are substantially and quantifiably below age expectations.",general,language impairment,HPO
24996,Language Problems,general,MedlinePlus Symptoms Index synonym for Speech and Communication Disorders.,general,language problems,MedlinePlus_Symptoms_Index
24997,Languor,general,"HPO exact synonym for Lethargy. HPO HP:0001254: A state of fatigue, either physical or mental slowness and sluggishness, with difficulties in initiating or performing simple tasks. Distinguished from apathy which implies indifference and a lack of desire or interest in the task. A",general,languor,HPO
24998,Lanoxin Exposure,general,HPO exact synonym for Digoxin Exposure. HPO HP:6001138: History of having been treateed with digoxin.,general,lanoxin exposure,HPO
24999,Laquer Cracks of the Retina,general,HPO exact synonym for Angioid Streaks. HPO HP:0001102: Irregular lines in the outer retina and Bruch membrane that are typically configured in a radiating fashion and emanate from the optic disc. Angioid streaks are crack-like dehiscences in abnormally thickened and calcified Bruch membra,general,laquer cracks of the retina,HPO
25000,Large Ankle Bones,musculoskeletal,HPO exact synonym for Large Tarsal Bones. HPO HP:0004679: Human Phenotype Ontology term HP:0004679: Large Tarsal Bones.,musculoskeletal,large ankle bones,HPO
25001,Large Antegonial Notch of Mandible,general,HPO exact synonym for Antegonial Notching of Mandible. HPO HP:0003779: Human Phenotype Ontology term HP:0003779: Antegonial Notching of Mandible.,general,large antegonial notch of mandible,HPO
25002,Large Anterior Fontanel,general,HPO exact synonym for Wide Anterior Fontanel. HPO HP:0000260: Enlargement of the anterior fontanelle with respect to age-dependent norms.,general,large anterior fontanel,HPO
25003,Large Anterior Fontanelle,general,HPO exact synonym for Wide Anterior Fontanel. HPO HP:0000260: Enlargement of the anterior fontanelle with respect to age-dependent norms.,general,large anterior fontanelle,HPO
25004,Large Basal Ganglia,general,HPO HP:0007048: Increased size of the basal ganglia.,general,large basal ganglia,HPO
25005,Large Breast,general,HPO exact synonym for Breast Hypertrophy. HPO HP:0010313: The presence of hypertrophy of the breast.,general,large breast,HPO
25006,Large Cafe-au-lait Macules with Irregular Margins,general,HPO HP:0005605: Large hypermelanotic macules with jagged borders.,general,large cafe au lait macules with irregular margins,HPO
25007,Large Capitate Bone,musculoskeletal,HPO HP:0004263: Human Phenotype Ontology term HP:0004263: Large Capitate Bone.,musculoskeletal,large capitate bone,HPO
25008,Large Carpal Bones,musculoskeletal,HPO HP:0004237: Increased size of carpal bones.,musculoskeletal,large carpal bones,HPO
25009,Large Carpals,general,HPO exact synonym for Large Carpal Bones. HPO HP:0004237: Increased size of carpal bones.,general,large carpals,HPO
25010,Large Cavum Septi Pellucidi,general,HPO exact synonym for Cavum Septum Pellucidum. HPO HP:0002389: If the two laminae of the septum pellucidum are not fused then a fluid-filled space or cavum is present. The cavum septum pellucidum is present at birth but usually obliterates by the age of 3 to 6 months. It is up to 1cm in width and,general,large cavum septi pellucidi,HPO
25011,Large Cell Lung Carcinoma,general,"HPO HP:0030360: A type of non-small cell lung carcinoma that is derived from undifferentiated malignant neoplasms originating from transformed epithelial cells in the lung, and which is differentiate from small-cell lung carcinoma by the larger size of the anaplastic cells, a higher cytoplasmic-to-nuclear size ratio, and a lack of salt-and-pepper appearance of the chromatin.",general,large cell lung carcinoma,HPO
25012,Large Central Loss of Field of Vision,sensory,HPO exact synonym for Large Central Visual Field Defect. HPO HP:0001129: Human Phenotype Ontology term HP:0001129: Large Central Visual Field Defect.,special_senses,large central loss of field of vision,HPO
25013,Large Central Visual Field Defect,general,HPO HP:0001129: Human Phenotype Ontology term HP:0001129: Large Central Visual Field Defect.,general,large central visual field defect,HPO
25014,Large Cerebral Ventricles and Cisternae,general,HPO exact synonym for Ventriculomegaly. HPO HP:0002119: An increase in size of the ventricular system of the brain.,general,large cerebral ventricles and cisternae,HPO
25015,Large Cheeks,general,HPO exact synonym for Full Cheeks. HPO HP:0000293: Increased prominence or roundness of soft tissues between zygomata and mandible.,general,large cheeks,HPO
25016,Large Cisterna Magna,general,"HPO exact synonym for Enlarged Cisterna Magna. HPO HP:0002280: Increase in size of the cisterna magna, one of three principal openings in the subarachnoid space between the arachnoid and pia mater, located between the cerebellum and the dorsal surface of the medulla oblongata.",general,large cisterna magna,HPO
25017,Large Clumps of Pigment Irregularly Distributed Along Hair Shaft,general,HPO HP:0004527: Human Phenotype Ontology term HP:0004527: Large Clumps of Pigment Irregularly Distributed Along Hair Shaft.,general,large clumps of pigment irregularly distributed along hair shaft,HPO
25018,Large Corpus Callosum,general,HPO exact synonym for Thick Corpus Callosum. HPO HP:0007074: Increased vertical dimension of the corpus callosum. This feature can be visualized by sagittal sections on magnetic resonance tomography imaging of the brain.,general,large corpus callosum,HPO
25019,Large Cranial Suture,general,HPO exact synonym for Wide Cranial Sutures. HPO HP:0010537: An abnormally increased width of the cranial sutures for age-related norms (generally resulting from delayed closure).,general,large cranial suture,HPO
25020,Large Cranium Present At Birth,general,HPO exact synonym for Macrocephaly At Birth. HPO HP:0004488: The presence of an abnormally large skull with onset at birth.,general,large cranium present at birth,HPO
25021,Large Cranium Present Since Birth,general,HPO exact synonym for Macrocephaly At Birth. HPO HP:0004488: The presence of an abnormally large skull with onset at birth.,general,large cranium present since birth,HPO
25022,Large Distal Femoral Epiphyses,oral,HPO exact synonym for Enlargement of the Distal Femoral Epiphysis. HPO HP:0006438: An abnormal enlargement of the distal epiphysis of the femur.,oral,large distal femoral epiphyses,HPO
25023,Large Distal Tibial Epiphysis,general,HPO exact synonym for Enlarged Distal Tibial Epiphysis. HPO HP:6000886: Size (volume) of the distal epiphysis of the tiba above the upper limit of normal.,general,large distal tibial epiphysis,HPO
25024,Large Earlobe,general,"HPO HP:0009748: Increased volume of the earlobe, that is, abnormally prominent ear lobules.",general,large earlobe,HPO
25025,Large Ears,general,"HPO exact synonym for Macrotia. HPO HP:0000400: Median longitudinal ear length greater than two standard deviations above the mean and median ear width greater than two standard deviations above the mean (objective); or, apparent increase in length and width of the pinna (subjectiv",general,large ears,HPO
25026,Large Elbow,general,HPO HP:0030865: Abnormal increased size of the elbow joint.,general,large elbow,HPO
25027,Large End Part of Bone,musculoskeletal,HPO exact synonym for Enlarged Epiphyses. HPO HP:0010580: Increased size of epiphyses.,musculoskeletal,large end part of bone,HPO
25028,Large End Part of Long Bone in Upper Arm,musculoskeletal,HPO exact synonym for Large Humeral Epiphyses. HPO HP:0003898: Human Phenotype Ontology term HP:0003898: Large Humeral Epiphyses.,musculoskeletal,large end part of long bone in upper arm,HPO
25029,Large Epiphyses,general,HPO exact synonym for Enlarged Epiphyses. HPO HP:0010580: Increased size of epiphyses.,general,large epiphyses,HPO
25030,Large Epiphysis of Proximal Index Finger Phalanx,general,HPO exact synonym for Enlarged Epiphysis of the Proximal Phalanx of the 2nd Finger. HPO HP:0009527: Human Phenotype Ontology term HP:0009527: Enlarged Epiphysis of the Proximal Phalanx of the 2nd Finger.,general,large epiphysis of proximal index finger phalanx,HPO
25031,Large Epiphysis of Proximal Middle-finger Phalanx,general,HPO exact synonym for Enlarged Epiphysis of the Proximal Phalanx of the 3rd Finger. HPO HP:0009349: Abnormally large size of the epiphysis located at the proximal end of the proximal phalanx of the 3rd finger with respect to age-dependent norms.,general,large epiphysis of proximal middle finger phalanx,HPO
25032,Large Eyes,sensory,HPO exact synonym for Abnormally Large Globe. HPO HP:0001090: Diffusely large eye (with megalocornea) without glaucoma.,special_senses,large eyes,HPO
25033,Large Face,general,HPO HP:0100729: Human Phenotype Ontology term HP:0100729: Large Face.,general,large face,HPO
25034,Large Facial Muscles,musculoskeletal,HPO exact synonym for Facial Muscle Hypertrophy. HPO HP:0012892: Hypertrophy of one or more muscles innervated by the facial nerve (the seventh cranial nerve).,musculoskeletal,large facial muscles,HPO
25035,Large Facies,general,HPO exact synonym for Large Face. HPO HP:0100729: Human Phenotype Ontology term HP:0100729: Large Face.,general,large facies,HPO
25036,Large Feet,general,HPO exact synonym for Long Foot. HPO HP:0001833: Increased back to front length of the foot.,general,large feet,HPO
25037,Large Fleshy Ears,general,HPO HP:0002265: Human Phenotype Ontology term HP:0002265: Large Fleshy Ears.,general,large fleshy ears,HPO
25038,Large Fontanel,general,"HPO exact synonym for Large Fontanelles. HPO HP:0000239: In newborns, the two frontal bones, two parietal bones, and one occipital bone are joined by fibrous sutures, which form a small posterior fontanelle, and a larger, diamond-shaped anterior fontanelle. These regions allow for the skull",general,large fontanel,HPO
25039,Large Fontanelle,general,"HPO exact synonym for Large Fontanelles. HPO HP:0000239: In newborns, the two frontal bones, two parietal bones, and one occipital bone are joined by fibrous sutures, which form a small posterior fontanelle, and a larger, diamond-shaped anterior fontanelle. These regions allow for the skull",general,large fontanelle,HPO
25040,Large Fontanelles,general,"HPO HP:0000239: In newborns, the two frontal bones, two parietal bones, and one occipital bone are joined by fibrous sutures, which form a small posterior fontanelle, and a larger, diamond-shaped anterior fontanelle. These regions allow for the skull to pass the birth canal and for later growth. The fontanelles gradually ossify, whereby the posterior fontanelle usually closes by eight weeks and the anterior fontanelle by the 9th to 16th month of age. Large fontanelles are diagnosed if the fontanelles are larger than age-dependent norms.",general,large fontanelles,HPO
25041,Large Fontanels,general,"HPO exact synonym for Large Fontanelles. HPO HP:0000239: In newborns, the two frontal bones, two parietal bones, and one occipital bone are joined by fibrous sutures, which form a small posterior fontanelle, and a larger, diamond-shaped anterior fontanelle. These regions allow for the skull",general,large fontanels,HPO
25042,Large for Gestational Age,general,HPO HP:0001520: The term large for gestational age applies to babies whose birth weight lies above the 90th percentile for that gestational age.,general,large for gestational age,HPO
25043,Large Foramen Magnum,general,HPO HP:0002700: An abnormal increase in the size of the foramen magnum.,general,large foramen magnum,HPO
25044,Large Forehead,general,HPO HP:0002003: Human Phenotype Ontology term HP:0002003: Large Forehead.,general,large forehead,HPO
25045,Large Frontal Sinus,general,HPO exact synonym for Prominent Frontal Sinuses. HPO HP:0005478: Human Phenotype Ontology term HP:0005478: Prominent Frontal Sinuses.,general,large frontal sinus,HPO
25046,Large Half of Tongue,general,HPO exact synonym for Hemimacroglossia. HPO HP:0100875: Increased length and width of one half of the tongue.,general,large half of tongue,HPO
25047,Large Halluces,general,HPO exact synonym for Long Hallux. HPO HP:0001847: Increased length of the big toe.,general,large halluces,HPO
25048,Large Hamate Bone,musculoskeletal,HPO HP:0004260: Human Phenotype Ontology term HP:0004260: Large Hamate Bone.,musculoskeletal,large hamate bone,HPO
25049,Large Hand,general,HPO exact synonym for Large Hands. HPO HP:0001176: Human Phenotype Ontology term HP:0001176: Large Hands.,general,large hand,HPO
25050,Large Hands,general,HPO HP:0001176: Human Phenotype Ontology term HP:0001176: Large Hands.,general,large hands,HPO
25051,Large Head,general,"HPO exact synonym for Macrocephaly. HPO HP:0000256: Occipitofrontal (head) circumference greater than 97th centile compared to appropriate, age matched, sex-matched normal standards. Alternatively, a apparently increased size of the cranium.",general,large head,HPO
25052,Large Head Circumference,general,"HPO exact synonym for Macrocephaly. HPO HP:0000256: Occipitofrontal (head) circumference greater than 97th centile compared to appropriate, age matched, sex-matched normal standards. Alternatively, a apparently increased size of the cranium.",general,large head circumference,HPO
25053,Large Humeral Epiphyses,general,HPO HP:0003898: Human Phenotype Ontology term HP:0003898: Large Humeral Epiphyses.,general,large humeral epiphyses,HPO
25054,Large Hyperpigmented Retinal Spots,general,HPO HP:0007658: Human Phenotype Ontology term HP:0007658: Large Hyperpigmented Retinal Spots.,general,large hyperpigmented retinal spots,HPO
25055,Large Iliac Wing,general,HPO HP:0008818: Increased size of the ilium ala.,general,large iliac wing,HPO
25056,Large Iliac Wings,general,HPO exact synonym for Large Iliac Wing. HPO HP:0008818: Increased size of the ilium ala.,general,large iliac wings,HPO
25057,Large Intestinal Atresia,general,"HPO exact synonym for Colonic Atresia. HPO HP:0010448: A developmental defect resulting in complete obliteration of the lumen of the colon. That is, there is an abnormal closure, or atresia of the tubular structure of the colon.",general,large intestinal atresia,HPO
25058,Large Intestinal Polyposis,general,HPO HP:0030255: The presence of multiple polyps in the large intestine.,general,large intestinal polyposis,HPO
25059,Large Intestine Tumor,general,HPO exact synonym for Neoplasm of the Large Intestine. HPO HP:0100834: The presence of a neoplasm of the large intestine.,general,large intestine tumor,HPO
25060,Large Intestine Tumour,general,HPO exact synonym for Neoplasm of the Large Intestine. HPO HP:0100834: The presence of a neoplasm of the large intestine.,general,large intestine tumour,HPO
25061,Large Jaw,general,HPO exact synonym for Increased Size of the Mandible. HPO HP:0040309: Human Phenotype Ontology term HP:0040309: Increased Size of the Mandible.,general,large jaw,HPO
25062,Large Joint Dislocations,musculoskeletal,HPO HP:0005008: Human Phenotype Ontology term HP:0005008: Large Joint Dislocations.,musculoskeletal,large joint dislocations,HPO
25063,Large Joint Hypermobilty,musculoskeletal,"HPO HP:0430047: The capability that a large joint (or a group of joints) has to move, passively and/or actively, beyond normal limits along physiological axes. Large joints include shoulders, elbows, hips, knees, and ankles.",musculoskeletal,large joint hypermobilty,HPO
25064,Large Joint Predominance,musculoskeletal,HPO HP:6000110: Refers to a phenotypic abnormality that mainly affect large joints.,musculoskeletal,large joint predominance,HPO
25065,Large Keratohyaline Granules,general,HPO HP:0034927: Abnormally large keratohyalin granules (KHG). KHG are typically present in the stratum granulosum of the epidermal layer of the skin (and epithelium of the mucosae). KHG are protein structures found in the keratinocytes of the stratum granulosum.,general,large keratohyaline granules,HPO
25066,Large Kidneys,urinary,HPO exact synonym for Enlarged Kidney. HPO HP:0000105: An abnormal increase in the size of the kidney.,urinary,large kidneys,HPO
25067,Large Knee,general,HPO HP:0030866: Abnormally increased size of the knee joint.,general,large knee,HPO
25068,Large Lateral Palatal Folds,general,HPO exact synonym for Prominent Palatine Ridges. HPO HP:0010291: Increased size and/or number of soft tissue folds on the palatal side of the maxillary alveolar ridge.,general,large lateral palatal folds,HPO
25069,Large Lateral Palatal Ridges,general,HPO exact synonym for Prominent Palatine Ridges. HPO HP:0010291: Increased size and/or number of soft tissue folds on the palatal side of the maxillary alveolar ridge.,general,large lateral palatal ridges,HPO
25070,Large Lower Jaw,general,HPO exact synonym for Mandibular Prognathia. HPO HP:0000303: Abnormal prominence of the chin related to increased length of the mandible.,general,large lower jaw,HPO
25071,Large Mandible,general,HPO exact synonym for Mandibular Prognathia. HPO HP:0000303: Abnormal prominence of the chin related to increased length of the mandible.,general,large mandible,HPO
25072,Large Maxilla,general,"HPO exact synonym for Hyperplasia of the Maxilla. HPO HP:0430028: Abnormally increased dimension of the maxilla, especially relative to the mandible, resulting in a malocclusion or malalignment between the upper and lower teeth or in anterior positioning of the nasal base, increased convexity of the",general,large maxilla,HPO
25073,Large Mouth,oral,"HPO exact synonym for Wide Mouth. HPO HP:0000154: Distance between the oral commissures more than 2 SD above the mean. Alternatively, an apparently increased width of the oral aperture (subjective).",oral,large mouth,HPO
25074,Large Nares,general,HPO exact synonym for Enlarged Naris. HPO HP:0009931: Increased aperture of the nostril.,general,large nares,HPO
25075,Large Nasal Tip,general,HPO exact synonym for Prominent Nasal Tip. HPO HP:0005274: Human Phenotype Ontology term HP:0005274: Prominent Nasal Tip.,general,large nasal tip,HPO
25076,Large Neck Muscles,musculoskeletal,HPO exact synonym for Neck Muscle Hypertrophy. HPO HP:0012893: Muscle hypertrophy affecting the muscles of the neck.,musculoskeletal,large neck muscles,HPO
25077,Large Nose,general,"HPO exact synonym for Prominent Nose. HPO HP:0000448: Distance between subnasale and pronasale more than two standard deviations above the mean, or alternatively, an apparently increased anterior protrusion of the nasal tip.",general,large nose,HPO
25078,Large Open Anterior Fontanel,general,HPO exact synonym for Wide Anterior Fontanel. HPO HP:0000260: Enlargement of the anterior fontanelle with respect to age-dependent norms.,general,large open anterior fontanel,HPO
25079,Large Open Anterior Fontanelle,general,HPO exact synonym for Wide Anterior Fontanel. HPO HP:0000260: Enlargement of the anterior fontanelle with respect to age-dependent norms.,general,large open anterior fontanelle,HPO
25080,Large Oral Aperture,oral,"HPO exact synonym for Wide Mouth. HPO HP:0000154: Distance between the oral commissures more than 2 SD above the mean. Alternatively, an apparently increased width of the oral aperture (subjective).",oral,large oral aperture,HPO
25081,Large Pelvis Bone,musculoskeletal,HPO HP:0010779: The presence of an abnormally large pelvis.,musculoskeletal,large pelvis bone,HPO
25082,Large Pinnae,general,"HPO exact synonym for Macrotia. HPO HP:0000400: Median longitudinal ear length greater than two standard deviations above the mean and median ear width greater than two standard deviations above the mean (objective); or, apparent increase in length and width of the pinna (subjectiv",general,large pinnae,HPO
25083,Large Placenta,general,HPO HP:0006267: Increased size of the placenta.,general,large placenta,HPO
25084,Large Platelets,general,HPO exact synonym for Increased Mean Platelet Volume. HPO HP:0011877: Average platelet volume above the upper limit of the normal reference interval.,general,large platelets,HPO
25085,Large Posterior Fontanel,general,HPO exact synonym for Large Posterior Fontanelle. HPO HP:0004491: An enlargement of the posterior fontanelle relative to age-dependent norms.,general,large posterior fontanel,HPO
25086,Large Posterior Fontanelle,general,HPO HP:0004491: An enlargement of the posterior fontanelle relative to age-dependent norms.,general,large posterior fontanelle,HPO
25087,Large Premaxilla,general,HPO exact synonym for Hyperplasia of the Premaxilla. HPO HP:0430029: An abnormality of the premaxilla (the embryonic structure that forms the anterior part of the maxilla) causing it to appear relatively large in size compared to the other parts of the maxilla or other facial structures.,general,large premaxilla,HPO
25088,Large Primary Palate Bone,musculoskeletal,HPO exact synonym for Hyperplasia of the Premaxilla. HPO HP:0430029: An abnormality of the premaxilla (the embryonic structure that forms the anterior part of the maxilla) causing it to appear relatively large in size compared to the other parts of the maxilla or other facial structures.,musculoskeletal,large primary palate bone,HPO
25089,Large Radial Epiphyses,general,HPO HP:0004005: Human Phenotype Ontology term HP:0004005: Large Radial Epiphyses.,general,large radial epiphyses,HPO
25090,Large Sella Turcica,general,HPO HP:0002690: An abnormal enlargement of the sella turcica.,general,large sella turcica,HPO
25091,Large Skull Present At Birth,general,HPO exact synonym for Macrocephaly At Birth. HPO HP:0004488: The presence of an abnormally large skull with onset at birth.,general,large skull present at birth,HPO
25092,Large Skull Present Since Birth,general,HPO exact synonym for Macrocephaly At Birth. HPO HP:0004488: The presence of an abnormally large skull with onset at birth.,general,large skull present since birth,HPO
25093,Large Spleen,general,HPO exact synonym for Splenomegaly. HPO HP:0001744: Abnormal increased size of the spleen.,general,large spleen,HPO
25094,Large Sternal Ossification Centers,general,HPO HP:0006642: Human Phenotype Ontology term HP:0006642: Large Sternal Ossification Centers.,general,large sternal ossification centers,HPO
25095,Large Sternal Ossification Centres,general,HPO exact synonym for Large Sternal Ossification Centers. HPO HP:0006642: Human Phenotype Ontology term HP:0006642: Large Sternal Ossification Centers.,general,large sternal ossification centres,HPO
25096,Large Tarsal Bones,musculoskeletal,HPO HP:0004679: Human Phenotype Ontology term HP:0004679: Large Tarsal Bones.,musculoskeletal,large tarsal bones,HPO
25097,Large Terminal Thumb Phalanx Epiphysis,general,HPO exact synonym for Enlarged Epiphysis of the Distal Phalanx of the Thumb. HPO HP:0009678: Abnormally large size of the epiphysis located at the proximal end of the distal phalanx of the thumb with respect to age-dependent norms.,general,large terminal thumb phalanx epiphysis,HPO
25098,Large Testicles,general,HPO exact synonym for Macroorchidism. HPO HP:0000053: The presence of abnormally large testes.,general,large testicles,HPO
25099,Large Testis,general,HPO exact synonym for Macroorchidism. HPO HP:0000053: The presence of abnormally large testes.,general,large testis,HPO
25100,Large Thyroid,endocrine_metabolic,HPO exact synonym for Thyroid Hyperplasia. HPO HP:0008249: Hyperplasia of the thyroid gland.,endocrine,large thyroid,HPO
25101,Large Tip of Nose,general,HPO exact synonym for Prominent Nasal Tip. HPO HP:0005274: Human Phenotype Ontology term HP:0005274: Prominent Nasal Tip.,general,large tip of nose,HPO
25102,Large Tongue,general,HPO exact synonym for Macroglossia. HPO HP:0000158: Increased length and width of the tongue.,general,large tongue,HPO
25103,Large Tooth,oral,"HPO exact synonym for Macrodontia. HPO HP:0001572: Increased size of the teeth, which can be defined as a mesiodistal tooth diameter (width) more than 2 SD above mean for age. Alternatively, an apparently increased maximum width of the tooth.",oral,large tooth,HPO
25104,Large Tragus,general,HPO exact synonym for Prominent Tragus. HPO HP:0011271: Increase posterolateral protrusion of the tragus.,general,large tragus,HPO
25105,Large Unciform Bone,musculoskeletal,HPO exact synonym for Large Hamate Bone. HPO HP:0004260: Human Phenotype Ontology term HP:0004260: Large Hamate Bone.,musculoskeletal,large unciform bone,HPO
25106,Large Upper Jaw,general,"HPO exact synonym for Hyperplasia of the Maxilla. HPO HP:0430028: Abnormally increased dimension of the maxilla, especially relative to the mandible, resulting in a malocclusion or malalignment between the upper and lower teeth or in anterior positioning of the nasal base, increased convexity of the",general,large upper jaw,HPO
