symptom_id,symptom_name,category,description,related_body_system,search_name,source
34411,S-shaped Palpebral Fissures,general,HPO HP:0007835: Human Phenotype Ontology term HP:0007835: S-shaped Palpebral Fissures.,general,s shaped palpebral fissures,HPO
34412,S-sulfocysteine High in Blood,general,HPO exact synonym for Elevated Circulating S-sulfocysteine Concentration. HPO HP:0034745: Concentration of S-sulfocysteine in the blood circulation above the upper limit of normal.,general,s sulfocysteine high in blood,HPO
34413,S-sulfocysteine High in Urine,general,HPO exact synonym for Elevated Urinary S-sulfocysteine Level. HPO HP:0034744: Level of S-sulfocysteine high in urine above the upper limit of normal.,general,s sulfocysteine high in urine,HPO
34414,S/p Organ Transplantation,general,HPO exact synonym for Status Post Organ Transplantation. HPO HP:0032444: The affected individual has received an organ transplant previous to the current medical encounter.,general,s p organ transplantation,HPO
34415,S3,general,HPO exact synonym for Third Heart Sound. HPO HP:0031658: The third heart sound (S3) is related to rapid filling in diastole. S3 can be a normal finding in children and adolescents but suggests heart failure in older patients.,general,s3,HPO
34416,S4,general,"HPO exact synonym for Fourth Heart Sound. HPO HP:0031659: The fourth heart sound (S4) is a low-pitched sound that occurs just before the first heart sound (S1) when the atria contract to force blood into the left ventricle, that is, coincident with late diastolic filling of the ventricle due",general,s4,HPO
34417,Saber Shin,general,HPO exact synonym for Anterior Tibial Bowing. HPO HP:0006390: An abnormal anterior bending or curvature of the tibia.,general,saber shin,HPO
34418,Saber Tibia,general,HPO exact synonym for Anterior Tibial Bowing. HPO HP:0006390: An abnormal anterior bending or curvature of the tibia.,general,saber tibia,HPO
34419,Sabre Shin,general,HPO exact synonym for Anterior Tibial Bowing. HPO HP:0006390: An abnormal anterior bending or curvature of the tibia.,general,sabre shin,HPO
34420,Saccadic Intrusion,general,HPO HP:0032114: An involuntary abnormality of fixation in which there is an abnormal saccade away from fixation followed by a delayed corrective saccade.,general,saccadic intrusion,HPO
34421,Saccadic Oscillation,general,HPO HP:0032104: An involuntary abnormality of fixation in which there is an abnormal saccade away from fixation followed by an immediate corrective saccade.,general,saccadic oscillation,HPO
34422,Saccadic Oscillations,general,HPO exact synonym for Saccadic Oscillation. HPO HP:0032104: An involuntary abnormality of fixation in which there is an abnormal saccade away from fixation followed by an immediate corrective saccade.,general,saccadic oscillations,HPO
34423,Saccadic Pursuit Movements,general,HPO exact synonym for Saccadic Smooth Pursuit Interruptions. HPO HP:0001152: An abnormality of tracking eye movements in which smooth pursuit is interrupted by an abnormally high number of saccadic movements.,general,saccadic pursuit movements,HPO
34424,Saccadic Slow Pursuit,general,HPO exact synonym for Saccadic Smooth Pursuit Interruptions. HPO HP:0001152: An abnormality of tracking eye movements in which smooth pursuit is interrupted by an abnormally high number of saccadic movements.,general,saccadic slow pursuit,HPO
34425,Saccadic Smooth Pursuit,general,HPO exact synonym for Saccadic Smooth Pursuit Interruptions. HPO HP:0001152: An abnormality of tracking eye movements in which smooth pursuit is interrupted by an abnormally high number of saccadic movements.,general,saccadic smooth pursuit,HPO
34426,Saccadic Smooth Pursuit Interruptions,general,HPO HP:0001152: An abnormality of tracking eye movements in which smooth pursuit is interrupted by an abnormally high number of saccadic movements.,general,saccadic smooth pursuit interruptions,HPO
34427,Saccharopine Present in CSF,general,HPO exact synonym for Elevated CSF Saccharopine Concentration. HPO HP:6000270: Concentration of saccharopine in the cerebrospinal fluid (CSF) above the upper limit of normal.,general,saccharopine present in csf,HPO
34428,Saccharopinuria,general,"HPO exact synonym for Elevated Urinary Saccharopine Level. HPO HP:6000283: The amount of saccharopine in the urine, when normalized to urine concentration, is above the upper limit of normal.",general,saccharopinuria,HPO
34429,Saccular Abdominal Aortic Aneurysm,gastrointestinal,HPO HP:0031645: An eccentric abnormal localized widening (dilatation) of the abdominal aorta that involves only a portion of the circumference of the vessel wall.,gastrointestinal,saccular abdominal aortic aneurysm,HPO
34430,Saccular Aortic Arch Aneurysm,general,HPO HP:0031647: An eccentric abnormal localized widening (dilatation) of the aortic arch that involves only a portion of the circumference of the vessel wall.,general,saccular aortic arch aneurysm,HPO
34431,Saccular Conjunctival Dilatations,general,HPO HP:0007721: Presence of multiple dilatations (sac-like outpouchings) in the blood vessels of the conjunctiva.,general,saccular conjunctival dilatations,HPO
34432,Saccular Descending Thoracic Aortic Aneurysm,general,HPO HP:0012729: An eccentric abnormal localized widening (dilatation) of the descending thoracic aorta that involves only a portion of the circumference of the vessel wall,general,saccular descending thoracic aortic aneurysm,HPO
34433,Sacral Agenesis,general,HPO exact synonym for Absence of the Sacrum. HPO HP:0010305: Absence (aplasia) of the sacrum.,general,sacral agenesis,HPO
34434,Sacral Appendage,general,HPO exact synonym for Caudal Appendage. HPO HP:0002825: The presence of a tail-like skin appendage located adjacent to the sacrum.,general,sacral appendage,HPO
34435,Sacral Dimple,general,HPO HP:0000960: A cutaneous indentation resulting from tethering of the skin to underlying structures (bone) of the intergluteal cleft.,general,sacral dimple,HPO
34436,Sacral Dysgenesis,general,"HPO exact synonym for Dysplastic Sacrum. HPO HP:0008455: A developmental defect of the sacrum characterized by partial or disordered development of the sacrum in which portions of the sacrum, which normally is formed by fusion of five sacral vertebrae S1-S5, fail to form or fail to form nor",general,sacral dysgenesis,HPO
34437,Sacral Hypertrichosis,general,"HPO HP:0004532: Excessive, increased hair growth located in the sacral region.",general,sacral hypertrichosis,HPO
34438,Sacral Kidney,urinary,HPO exact synonym for Pelvic Kidney. HPO HP:0000125: A developmental defect in which a kidney is located in an abnormal anatomic position within the pelvis.,urinary,sacral kidney,HPO
34439,Sacral Lipoma,general,HPO HP:0012033: Presence of a lipoma in the region of the sacrum.,general,sacral lipoma,HPO
34440,Sacral Meningocele,general,HPO HP:0005765: Human Phenotype Ontology term HP:0005765: Sacral Meningocele.,general,sacral meningocele,HPO
34441,Sacral Segmentation Defect,general,HPO HP:0008490: Human Phenotype Ontology term HP:0008490: Sacral Segmentation Defect.,general,sacral segmentation defect,HPO
34442,Sacralization of the Fifth Lumbar Vertebra,general,"HPO HP:0030125: A congenital anomaly, in which the transverse process of the last lumbar vertebra (L5) fuses to the sacrum on one side or both, or to ilium, or both.",general,sacralization of the fifth lumbar vertebra,HPO
34443,Sacrococcygeal Fistula,general,HPO exact synonym for Pilonidal Abscess. HPO HP:0010771: A hair-containing cyst or sinus usually in the coccygeal region.,general,sacrococcygeal fistula,HPO
34444,Sacrococcygeal Pilonidal Abnormality,general,"HPO HP:0010767: The presence of a cyst, fistula, or abscess in the sacrococcygeal region (gluteal crease) characteristically accompanied by hair and skin folds.",general,sacrococcygeal pilonidal abnormality,HPO
34445,Sacrococcygeal Teratoma,general,HPO HP:0030736: A teratoma arising in the sacro-coccygeal region.,general,sacrococcygeal teratoma,HPO
34446,Sacroiliac Arthritis,musculoskeletal,"HPO HP:0012317: Inflammation of the sacroiliac joint, generally accompanied by lower back pain.",musculoskeletal,sacroiliac arthritis,HPO
34447,Sacroiliac Joint Synovitis,musculoskeletal,HPO HP:0012449: Inflammation of the synovial membrane of the sacroiliac joint.,musculoskeletal,sacroiliac joint synovitis,HPO
34448,Sacroiliitis,general,"HPO exact synonym for Sacroiliac Arthritis. HPO HP:0012317: Inflammation of the sacroiliac joint, generally accompanied by lower back pain.",general,sacroiliitis,HPO
34449,Saddle Nose,general,HPO exact synonym for Concave Nasal Ridge. HPO HP:0011120: Nasal ridge curving posteriorly to an imaginary line that connects the nasal root and tip.,general,saddle nose,HPO
34450,Saddle Shaped Nasal Dorsum,general,HPO exact synonym for Concave Nasal Ridge. HPO HP:0011120: Nasal ridge curving posteriorly to an imaginary line that connects the nasal root and tip.,general,saddle shaped nasal dorsum,HPO
34451,Saddle-back Type ST Segment Elevation,musculoskeletal,"HPO HP:6000985: An ST-segment elevation of at least 0.5 mm (generally at least 2 mm in V2) in at least one right precordial lead (V1 to V3), followed by a convex ST. The r'-wave may or may not overlap the J point, but it has a slow downward slope. The ST segment is followed by a positive T-wave in V2 and is of variable morphology in V1.",musculoskeletal,saddle back type st segment elevation,HPO
34452,Sagging Uterus,general,HPO exact synonym for Uterine Prolapse. HPO HP:0000139: The presence of prolapse of the uterus.,general,sagging uterus,HPO
34453,"Sagging, Redundant Skin",general,HPO exact synonym for Redundant Skin. HPO HP:0001582: Loose and sagging skin often associated with loss of skin elasticity.,general,sagging redundant skin,HPO
34454,Saggy Upper Eyelid Skin,sensory,"HPO exact synonym for Blepharochalasis. HPO HP:0010749: Blepharochalasis is characterized by recurrent, non-painful, nonerythematous episodes of eyelid edema. It has been divided into hypertrophic and atrophic forms. In the hypertrophic form recurrent edema results in orbital fat herniatio",special_senses,saggy upper eyelid skin,HPO
34455,Sagittal Clefting of Vertebrae,general,HPO exact synonym for Butterfly Vertebrae. HPO HP:0003316: A butterfly vertebra (sagittal cleft vertebra or anterior rachischisis) is a sagittal defect in the vertebral body caused by failure of fusion of the two lateral chondrification centers during embryogenesis. The name is based on the a,general,sagittal clefting of vertebrae,HPO
34456,Sagittal Craniosynostosis,general,HPO HP:0004442: A kind of craniosynostosis affecting the sagittal suture.,general,sagittal craniosynostosis,HPO
34457,Sagittal Suture Synostosis,general,HPO exact synonym for Sagittal Craniosynostosis. HPO HP:0004442: A kind of craniosynostosis affecting the sagittal suture.,general,sagittal suture synostosis,HPO
34458,Salaam Convulsion,general,"HPO exact synonym for Epileptic Spasm. HPO HP:0011097: A sudden flexion, extension, or mixed extension-flexion of predominantly proximal and truncal muscles that is usually more sustained than a myoclonic movement but not as sustained as a tonic seizure. Limited forms may occur: Grimacing",general,salaam convulsion,HPO
34459,Salaam Convulsions,general,"HPO exact synonym for Epileptic Spasm. HPO HP:0011097: A sudden flexion, extension, or mixed extension-flexion of predominantly proximal and truncal muscles that is usually more sustained than a myoclonic movement but not as sustained as a tonic seizure. Limited forms may occur: Grimacing",general,salaam convulsions,HPO
34460,Salaam Seizure,neurological,"HPO exact synonym for Epileptic Spasm. HPO HP:0011097: A sudden flexion, extension, or mixed extension-flexion of predominantly proximal and truncal muscles that is usually more sustained than a myoclonic movement but not as sustained as a tonic seizure. Limited forms may occur: Grimacing",nervous,salaam seizure,HPO
34461,Salaam Seizures,neurological,"HPO exact synonym for Epileptic Spasm. HPO HP:0011097: A sudden flexion, extension, or mixed extension-flexion of predominantly proximal and truncal muscles that is usually more sustained than a myoclonic movement but not as sustained as a tonic seizure. Limited forms may occur: Grimacing",nervous,salaam seizures,HPO
34462,Salivary Basal Cell Adenoma,general,"HPO HP:6000007: A rare neoplasm consisting of a monomorphic population of basaloid epithelial cells, and it accounts for approximately 1-2% of all salivary gland tumors.",general,salivary basal cell adenoma,HPO
34463,Salivary Gland Neoplasia,general,HPO exact synonym for Salivary Gland Neoplasm. HPO HP:0100684: A tumor (abnormal growth of tissue) of a salivary gland.,general,salivary gland neoplasia,HPO
34464,Salivary Gland Neoplasm,general,HPO HP:0100684: A tumor (abnormal growth of tissue) of a salivary gland.,general,salivary gland neoplasm,HPO
34465,Salivary Gland Oncocytoma,general,"HPO HP:0031523: A benign epithelial neoplasm composed of layers of oncocytes (small round nucleus, micro-granular, eosinophilic cytoplasm with numerous tightly-packed mitochondria)",general,salivary gland oncocytoma,HPO
34466,Salmonella Bone Infection,musculoskeletal,"HPO exact synonym for Salmonella Osteomyelitis. HPO HP:0005661: Osteomyelitis caused by infection with the bacteria, salmonella.",immune,salmonella bone infection,HPO
34467,Salmonella Osteomyelitis,general,"HPO HP:0005661: Osteomyelitis caused by infection with the bacteria, salmonella.",general,salmonella osteomyelitis,HPO
34468,Salpingitis,general,HPO HP:0034492: An inflammation of the fallopian tube.,general,salpingitis,HPO
34469,Salt and Pepper Retinal Pigmentation,general,"HPO exact synonym for Retinal Pigment Epithelial Mottling. HPO HP:0007814: Mottling (spots or blotches of different shades) of the retinal pigment epithelium, i.e., localized or generalized fundus pigment granularity associated with processes at the level of the retinal pigment epithelium.",general,salt and pepper retinal pigmentation,HPO
34470,Salt and Pepper Retinopathy,general,"HPO exact synonym for Retinal Pigment Epithelial Mottling. HPO HP:0007814: Mottling (spots or blotches of different shades) of the retinal pigment epithelium, i.e., localized or generalized fundus pigment granularity associated with processes at the level of the retinal pigment epithelium.",general,salt and pepper retinopathy,HPO
34471,Salt Craving,general,"HPO HP:0030083: Hypersalivation, also known as salt craving, refers to an excessive desire to consume salt (sodium chloride) or salty foods.",general,salt craving,HPO
34472,Salt Wasting,general,HPO exact synonym for Renal Salt Wasting. HPO HP:0000127: A high concentration of one or more electrolytes in the urine in the presence of low serum concentrations of the electrolyte(s).,general,salt wasting,HPO
34473,Salter I Fracture,musculoskeletal,"HPO HP:6001244: A type of physeal (Salter-Harris) fracture in which the fracture line extends through the physis or within the growth plate. Type I fractures are due to the longitudinal force applied through the physis, which splits the epiphysis from the metaphysis.",musculoskeletal,salter i fracture,HPO
34474,Salter II Fracture,musculoskeletal,"HPO HP:6001245: A type of physeal (Salter-Harris) fracture in which the fracture extends through both the physis and metaphysis. These are most common and occur away from the joint space. When the small corner of the metaphysis is visible, this is known as a corner sign or Thurston-Holland fragment.",musculoskeletal,salter ii fracture,HPO
34475,Salter III Fracture,musculoskeletal,HPO HP:6001246: A type of physeal (Salter-Harris) fracture in which the fracture is intra-articular and extends from the physis into the epiphysis.,musculoskeletal,salter iii fracture,HPO
34476,Salter IV Fracture,musculoskeletal,"HPO HP:6001247: A type of physeal (Salter-Harris) fracture in which the fracture is intra-articular and passes through the epiphysis, physis, and metaphysis.",musculoskeletal,salter iv fracture,HPO
34477,Salter V Fracture,musculoskeletal,"HPO HP:6001248: A type of physeal (Salter-Harris) fracture that is due to a crush or compression injury of the growth plate. In type V, the force is transmitted through the epiphysis and physis, potentially disrupting the germinal matrix, hypertrophic region, and vascular supply.",musculoskeletal,salter v fracture,HPO
34478,Salty Tasting Skin,general,HPO HP:6000725: Skin tastes marked salty without an obvious explanation such as heat or exercise. This finding can be observed in infants with cystic fibrosis.,general,salty tasting skin,HPO
34479,Salzmann Corneal Nodules,general,"HPO HP:6001230: The formation of large, bluish, nodular lesions in the superficial corneal stroma, often associated with chronic keratitis or aging. These nodules may lead to visual impairment.",general,salzmann corneal nodules,HPO
34480,Salzmann Nodular Corneal Degeneration,general,"HPO exact synonym for Salzmann Corneal Nodules. HPO HP:6001230: The formation of large, bluish, nodular lesions in the superficial corneal stroma, often associated with chronic keratitis or aging. These nodules may lead to visual impairment.",general,salzmann nodular corneal degeneration,HPO
34481,Salzmann Nodular Corneal Dystrophy,general,"HPO exact synonym for Salzmann Corneal Nodules. HPO HP:6001230: The formation of large, bluish, nodular lesions in the superficial corneal stroma, often associated with chronic keratitis or aging. These nodules may lead to visual impairment.",general,salzmann nodular corneal dystrophy,HPO
34482,Salzmann's Nodules,general,"HPO exact synonym for Salzmann Corneal Nodules. HPO HP:6001230: The formation of large, bluish, nodular lesions in the superficial corneal stroma, often associated with chronic keratitis or aging. These nodules may lead to visual impairment.",general,salzmann s nodules,HPO
34483,Sandal Gap,general,HPO HP:0001852: A widely spaced gap between the first toe (the great toe) and the second toe.,general,sandal gap,HPO
34484,Sandal Gap Between First and Second Toes,general,HPO exact synonym for Sandal Gap. HPO HP:0001852: A widely spaced gap between the first toe (the great toe) and the second toe.,general,sandal gap between first and second toes,HPO
34485,Sandwich Appearance of Vertebral Bodies,general,HPO HP:0004618: Human Phenotype Ontology term HP:0004618: Sandwich Appearance of Vertebral Bodies.,general,sandwich appearance of vertebral bodies,HPO
34486,Sandy Hair Color,general,HPO exact synonym for Fair Hair. HPO HP:0002286: A lesser degree of hair pigmentation than would otherwise be expected.,general,sandy hair color,HPO
34487,Sandy Hair Colour,general,HPO exact synonym for Fair Hair. HPO HP:0002286: A lesser degree of hair pigmentation than would otherwise be expected.,general,sandy hair colour,HPO
34488,Sarcoma,neurological,HPO HP:0100242: A connective tissue neoplasm formed by proliferation of mesodermal cells. Bone and soft tissue sarcomas are the main types of sarcoma. Sarcoma is usually highly malignant.,nervous,sarcoma,HPO
34489,Sarcomatoid Carcinoma of the Tongue,neurological,"HPO HP:0030415: Sarcomatoid (spindle cell) carcinomas of the tongue is a variant of squamous carcinoma of tongue that is monoclonal, having evolved from a conventional squamous carcinoma with dedifferentiation associated with sarcomatoid transformation.",nervous,sarcomatoid carcinoma of the tongue,HPO
34490,Sarcoplasmic Bodies,general,HPO HP:0034722: Rounded or oval structures that appeared brown on hematoxylin and eosin and red on the modified Gomori trichrome stain.,general,sarcoplasmic bodies,HPO
34491,Sarcosine High in CSF,general,HPO exact synonym for Elevated CSF Sarcosine Concentration. HPO HP:0034739: Concentration of sarcosine in the cerebrospinal fluid (CSF) above the upper limit of normal.,general,sarcosine high in csf,HPO
34492,Satisfactory Anal Smear But Lacking Transformation Zone,general,ICD-10-CM R85.616: Satisfactory anal smear but lacking transformation zone,general,satisfactory anal smear but lacking transformation zone,ICD-10-CM
34493,Satisfactory Cervical Smear But Lacking Transformation Zone,general,ICD-10-CM R87.616: Satisfactory cervical smear but lacking transformation zone,general,satisfactory cervical smear but lacking transformation zone,ICD-10-CM
34494,Satyr Ear,general,"HPO HP:0030676: Sharp pointed superior portion of the ear, with variable overfolding of the helix.",general,satyr ear,HPO
34495,Sausage Fingers,general,HPO exact synonym for Finger Dactylitis. HPO HP:0031090: Fingers appear swollen and plump owing to inflammation of the complete finger.,general,sausage fingers,HPO
34496,Sausage Toes,general,HPO exact synonym for Toe Dactylitis. HPO HP:0031091: Toes appear swollen and plump owing to inflammation of the complete toe.,general,sausage toes,HPO
34497,Sawtooth Acanthosis,oral,HPO HP:0025122: A type of epidermal acanthosis characterized by a jagged (sawtooth) appearance of the rete ridges of the epidermis.,oral,sawtooth acanthosis,HPO
34498,Sawtoothed Acanthosis,oral,HPO exact synonym for Sawtooth Acanthosis. HPO HP:0025122: A type of epidermal acanthosis characterized by a jagged (sawtooth) appearance of the rete ridges of the epidermis.,oral,sawtoothed acanthosis,HPO
34499,Scales On Eyebrows,sensory,"HPO exact synonym for Eyebrow Scaling Skin. HPO HP:0025813: Loss of the outer layer of the epidermis in the area of the eyebrow in large, scale-like flakes.",special_senses,scales on eyebrows,HPO
34500,Scaling Skin,general,"HPO HP:0040189: Refers to the loss of the outer layer of the epidermis in large, scale-like flakes.",general,scaling skin,HPO
34501,Scaling Skin On Fingertip,general,"HPO HP:0025525: Loss of the outer layer of the epidermis in large, scale-like flakes localized to one or more fingertips.",general,scaling skin on fingertip,HPO
34502,Scalloped Appearance of Liver Surface,general,"HPO HP:6000628: A lesion associated with pseudomyxoma peritonei whosetypical CT appearance is scalloping of the surface of the liver and spleen caused by loculated accumulations of mucin, which distinguishes mucin from fluid ascites. The mucinous material is similar in density to water. There are also islands of higher attenuation due to scattered solid elements and calcification within mucinous material.",general,scalloped appearance of liver surface,HPO
34503,Scalloping of Surface of Liver and Spleen,general,"HPO exact synonym for Scalloped Appearance of Liver Surface. HPO HP:6000628: A lesion associated with pseudomyxoma peritonei whosetypical CT appearance is scalloping of the surface of the liver and spleen caused by loculated accumulations of mucin, which distinguishes mucin from fluid ascites. The mucinous mat",general,scalloping of surface of liver and spleen,HPO
34504,Scalloping of the Surface of the Liver and Spleen,general,"HPO exact synonym for Scalloped Appearance of Liver Surface. HPO HP:6000628: A lesion associated with pseudomyxoma peritonei whosetypical CT appearance is scalloping of the surface of the liver and spleen caused by loculated accumulations of mucin, which distinguishes mucin from fluid ascites. The mucinous mat",general,scalloping of the surface of the liver and spleen,HPO
34505,Scalloping of Vertebral Bodies,general,"HPO exact synonym for Biconcave Vertebral Bodies. HPO HP:0004586: Exaggerated concavity of the anterior or posterior surface of the vertebral body, i.e., the upper and lower vertebral endplates are hollowed inward.",general,scalloping of vertebral bodies,HPO
34506,Scalp Aplasia Cutis Congenita,general,HPO exact synonym for Aplasia Cutis Congenita of Scalp. HPO HP:0007385: A developmental defect resulting in the congenital absence of skin on the scalp.,general,scalp aplasia cutis congenita,HPO
34507,Scalp Edema,cardiovascular,HPO HP:6000959: A palpable swelling in the scalp caused by an increase in interstitial fluid volume (excess fluid).,cardiovascular,scalp edema,HPO
34508,Scalp Hair Loss,dermatological,HPO exact synonym for Alopecia of Scalp. HPO HP:0002293: Human Phenotype Ontology term HP:0002293: Alopecia of Scalp.,integumentary,scalp hair loss,HPO
34509,Scalp Hypersensitivity,general,HPO exact synonym for Scalp Tenderness. HPO HP:0100809: Pain or discomfort of the scalp elicited by palpation.,general,scalp hypersensitivity,HPO
34510,Scalp Hypotrichosis,general,HPO exact synonym for Sparse Scalp Hair. HPO HP:0002209: Decreased number of hairs per unit area of skin of the scalp.,general,scalp hypotrichosis,HPO
34511,Scalp Nodule,general,HPO HP:6000726: A small firm lump located in the skin of the scalp that is greater than one cm in diameter.,general,scalp nodule,HPO
34512,Scalp Nodules,general,HPO exact synonym for Scalp Nodule. HPO HP:6000726: A small firm lump located in the skin of the scalp that is greater than one cm in diameter.,general,scalp nodules,HPO
34513,Scalp Rugae,general,"HPO exact synonym for Cutis Gyrata of Scalp. HPO HP:0010541: The presence of convoluted folds and furrows formed from thickened skin of the scalp, resembling cerebriform pattern. The scalp has convoluted and elevated folds, 1 to 2 cm in thickness. The convolutions generally cannot be flattened",general,scalp rugae,HPO
34514,Scalp Tenderness,general,HPO HP:0100809: Pain or discomfort of the scalp elicited by palpation.,general,scalp tenderness,HPO
34515,Scaly Skin,general,"HPO exact synonym for Scaling Skin. HPO HP:0040189: Refers to the loss of the outer layer of the epidermis in large, scale-like flakes.",general,scaly skin,HPO
34516,Scanning Speech,neurological,"HPO HP:0002168: An abnormal pattern of speech in which the words are as if measured or scanned; there is a pause after every syllable, and the syllables themselves are pronounced slowly.",nervous,scanning speech,HPO
34517,Scant Eyelashes,sensory,HPO exact synonym for Sparse Eyelashes. HPO HP:0000653: Decreased density/number of eyelashes.,special_senses,scant eyelashes,HPO
