symptom_id,symptom_name,category,description,related_body_system,search_name,source
25439,Limited Gross Motor Development,general,"HPO exact synonym for Delayed Gross Motor Development. HPO HP:0002194: A type of motor delay characterized by a delay in acquiring the ability to control the large muscles of the body for walking, running, sitting, and crawling.",general,limited gross motor development,HPO
25440,Limited Gross Motor Skills,general,"HPO exact synonym for Delayed Gross Motor Development. HPO HP:0002194: A type of motor delay characterized by a delay in acquiring the ability to control the large muscles of the body for walking, running, sitting, and crawling.",general,limited gross motor skills,HPO
25441,Limited Hair On End of Eyebrow,sensory,HPO exact synonym for Sparse Lateral Eyebrow. HPO HP:0005338: Decreased density/number and/or decreased diameter of lateral eyebrow hairs.,special_senses,limited hair on end of eyebrow,HPO
25442,Limited Head Nodding or Shaking,general,HPO HP:5200056: Absence or reduction in the use of head nodding to indicate agreement or head shaking to indicate disagreement.,general,limited head nodding or shaking,HPO
25443,Limited Head Rotation,general,HPO HP:0033357: Reduced range of motion turning the head side to side.,general,limited head rotation,HPO
25444,Limited Hip Abduction,general,HPO exact synonym for Decreased Hip Abduction. HPO HP:0003184: Reduced ability to move the femur outward to the side.,general,limited hip abduction,HPO
25445,Limited Hip Extension,general,"HPO HP:0003093: Limitation of the extension of the hip, i.e., decreased ability to straighten the hip joint and thereby increase the angle between torso and thigh; moving the thigh or top of the pelvis backward.",general,limited hip extension,HPO
25446,Limited Hip Movement,general,HPO HP:0008800: A decreased ability to move the femur at the hip joint associated with a decreased range of motion of the hip.,general,limited hip movement,HPO
25447,Limited Horizontal Extraocular Movement,general,HPO HP:0025720: Limited mobility of the eye to move from side to side (horizontally) within its socket.,general,limited horizontal extraocular movement,HPO
25448,Limited Interphalangeal Movement,general,HPO HP:0006064: Human Phenotype Ontology term HP:0006064: Limited Interphalangeal Movement.,general,limited interphalangeal movement,HPO
25449,Limited Joint Mobility,musculoskeletal,HPO exact synonym for Limitation of Joint Mobility. HPO HP:0001376: A reduction in the freedom of movement of one or more joints.,musculoskeletal,limited joint mobility,HPO
25450,Limited Joint Motion,musculoskeletal,HPO exact synonym for Limitation of Joint Mobility. HPO HP:0001376: A reduction in the freedom of movement of one or more joints.,musculoskeletal,limited joint motion,HPO
25451,Limited Knee Extension,general,HPO HP:0003066: Reduced ability to extend (straighten) the knee joint.,general,limited knee extension,HPO
25452,Limited Knee Flexion,general,HPO HP:0006389: Reduced ability to flex (bend) the knee joint.,general,limited knee flexion,HPO
25453,Limited Knee Flexion/extension,general,HPO HP:0005085: A limited ability of the knee joint to perform extension and flexion.,general,limited knee flexion extension,HPO
25454,Limited Knee Movement,general,HPO exact synonym for Limitation of Knee Mobility. HPO HP:0010501: An abnormal limitation of knee joint mobility.,general,limited knee movement,HPO
25455,Limited Knee Straightening,general,HPO exact synonym for Limited Knee Extension. HPO HP:0003066: Reduced ability to extend (straighten) the knee joint.,general,limited knee straightening,HPO
25456,Limited Lateral Neck Flexion,musculoskeletal,HPO HP:0033481: Reduced range of motion resulting in decreased ability to move the ear toward the top of the shoulder.,musculoskeletal,limited lateral neck flexion,HPO
25457,Limited Mobility of Innermost Hinge Joint,musculoskeletal,HPO exact synonym for Limited Mobility of Proximal Interphalangeal Joint. HPO HP:0006217: Human Phenotype Ontology term HP:0006217: Limited Mobility of Proximal Interphalangeal Joint.,musculoskeletal,limited mobility of innermost hinge joint,HPO
25458,Limited Mobility of Proximal Interphalangeal Joint,musculoskeletal,HPO HP:0006217: Human Phenotype Ontology term HP:0006217: Limited Mobility of Proximal Interphalangeal Joint.,musculoskeletal,limited mobility of proximal interphalangeal joint,HPO
25459,Limited Movement of Hinge Joints,musculoskeletal,HPO exact synonym for Limited Interphalangeal Movement. HPO HP:0006064: Human Phenotype Ontology term HP:0006064: Limited Interphalangeal Movement.,musculoskeletal,limited movement of hinge joints,HPO
25460,Limited Movement of the Wrist,general,HPO exact synonym for Limited Wrist Movement. HPO HP:0006248: An abnormal limitation of the mobility of the wrist.,general,limited movement of the wrist,HPO
25461,Limited Neck Extension,musculoskeletal,HPO HP:0033453: Reduced ability to move the head back towards the ceiling so that one is looking upwards.,musculoskeletal,limited neck extension,HPO
25462,Limited Neck Flexibility,musculoskeletal,HPO exact synonym for Limited Neck Flexion. HPO HP:0005991: Reduced ability to lower the chin towards the chest by bending the neck.,musculoskeletal,limited neck flexibility,HPO
25463,Limited Neck Flexion,musculoskeletal,HPO HP:0005991: Reduced ability to lower the chin towards the chest by bending the neck.,musculoskeletal,limited neck flexion,HPO
25464,Limited Neck Movement,musculoskeletal,HPO exact synonym for Decreased Cervical Spine Mobility. HPO HP:0004637: Human Phenotype Ontology term HP:0004637: Decreased Cervical Spine Mobility.,musculoskeletal,limited neck movement,HPO
25465,Limited Neck Range of Motion,musculoskeletal,HPO HP:0000466: Human Phenotype Ontology term HP:0000466: Limited Neck Range of Motion.,musculoskeletal,limited neck range of motion,HPO
25466,Limited Peripheral Vision,sensory,HPO exact synonym for Constriction of Peripheral Visual Field. HPO HP:0001133: An absolute or relative decrease in retinal sensitivity extending from edge (periphery) of the visual field in a concentric pattern. The visual field is the area that is perceived simultaneously by a fixating eye.,special_senses,limited peripheral vision,HPO
25467,Limited Pointing,general,HPO HP:5200057: Absence or reduction in the use of pointing to request or direct another's attention.,general,limited pointing,HPO
25468,Limited Pronation/supination of Forearm,general,HPO HP:0006394: A limitation of the ability to place the forearm in a position such that the palm faces anteriorly (supination) and to place the forearm in a position such that the palm faces posteriorly (pronation).,general,limited pronation supination of forearm,HPO
25469,Limited Range of Motion,musculoskeletal,Reduced ability to move a joint; clinical term: limited range of motion.,musculoskeletal,limited range of motion,Clinical_Curated
25470,Limited Repertoire of Facial Expression,general,HPO HP:5200002: An abnormally limited range of facial expressions demonstrated by a lack of nuance of facial expression to match specific social situations or an inability to demonstrate a normal range of emotions with one's face.,general,limited repertoire of facial expression,HPO
25471,Limited Repertoire of Gestures,general,HPO HP:5200101: Human Phenotype Ontology term HP:5200101: Limited Repertoire of Gestures.,general,limited repertoire of gestures,HPO
25472,Limited Shoulder Abduction,general,HPO HP:0033475: Decreased ability to move the arm away from the midline of the body.,general,limited shoulder abduction,HPO
25473,Limited Shoulder External Rotation,general,"HPO HP:6001194: Difficulty rotating the lower part of the arm away from the body (tested with the elbow flexed and the elbow held next to the side of the body) secondary to pain, weakness, or mechanical block.",general,limited shoulder external rotation,HPO
25474,Limited Shoulder Flexion,general,HPO HP:0033482: A reduced ability to flex the shoulder. Shoulder flexion is the motion that moves the arms from a resting position by the side of the body to a position above the head.,general,limited shoulder flexion,HPO
25475,Limited Shoulder Internal Rotation,general,"HPO HP:6001170: Difficulty rotating the lower part of the arm towards the body (tested with the elbow flexed and the elbow held next to the side of the body or shoulder 90 degrees abducted to the side) secondary to pain, weakness, or mechanical block.",general,limited shoulder internal rotation,HPO
25476,Limited Shoulder Movement,general,HPO HP:0006467: A limitation of the range of movement of the shoulder joint.,general,limited shoulder movement,HPO
25477,Limited Vertical Extraocular Movement,general,HPO HP:0025721: Limited mobility of the eye to move up and down (vertically) within its socket.,general,limited vertical extraocular movement,HPO
25478,Limited Wrist Extension,general,HPO HP:0006251: Human Phenotype Ontology term HP:0006251: Limited Wrist Extension.,general,limited wrist extension,HPO
25479,Limited Wrist Movement,general,HPO HP:0006248: An abnormal limitation of the mobility of the wrist.,general,limited wrist movement,HPO
25480,Linear Arrays of Macular Hyperkeratoses in Flexural Areas,general,HPO HP:0007490: Human Phenotype Ontology term HP:0007490: Linear Arrays of Macular Hyperkeratoses in Flexural Areas.,general,linear arrays of macular hyperkeratoses in flexural areas,HPO
25481,Linear Atelectasis,general,"HPO HP:0033657: Linear atelectasis is a focal area of subsegmental atelectasis with a linear configuration, almost always extending to the pleura. It is commonly horizontal but sometimes oblique or vertical. The thickness of the atelectasis may range from a few millimeters to more than 1 cm.",general,linear atelectasis,HPO
25482,Linear C3 Deposits Along the Epidermal Basement Membrane Zone,general,HPO HP:0031541: Presence of complement C3 in the dermoepidermal junction that are distributed in a linear pattern. This feature can be appreciated by immunofluorescence microscopy.,general,linear c3 deposits along the epidermal basement membrane zone,HPO
25483,Linear Earlobe Crease,general,HPO HP:0031510: A transverse linear fissure (crease) in the lobule of the ear.,general,linear earlobe crease,HPO
25484,Linear Hyperpigmentation,general,HPO HP:0007546: Human Phenotype Ontology term HP:0007546: Linear Hyperpigmentation.,general,linear hyperpigmentation,HPO
25485,Linear Hyperpigmentation Along Blaschko's Lines,general,HPO HP:6000010: Linear streaks and swirls of macular hyperpigmentation along the lines of Blaschko.,general,linear hyperpigmentation along blaschko s lines,HPO
25486,Linear IgA Deposits Along the Epidermal Basement Membrane Zone,general,HPO HP:0031539: Presence of IgA antibodies in the dermoepidermal junction that are distributed in a linear pattern. This feature can be appreciated by immunofluorescence microscopy.,general,linear iga deposits along the epidermal basement membrane zone,HPO
25487,Linear IgG Deposits Along the Epidermal Basement Membrane Zone,general,HPO HP:0031540: Presence of IgG antibodies in the dermoepidermal junction that are distributed in a linear pattern. This feature can be appreciated by immunofluorescence microscopy.,general,linear igg deposits along the epidermal basement membrane zone,HPO
25488,Linear Nevus Sebaceous,general,"HPO HP:0010817: A type of nevus sebaceous with a linear form, raised borders and yellowish color.",general,linear nevus sebaceous,HPO
25489,Linear Retina Heme,general,HPO exact synonym for Flame-shaped Retinal Hemorrhage. HPO HP:0025241: A type of retinal hemorrhage that is located within the nerve fiber layer (NFL) of the retina and that exhibits a characteristic flame shape which results from constraints by the structure of the NFL (axons of the ganglion cells).,general,linear retina heme,HPO
25490,Lingua Plicata,general,HPO exact synonym for Furrowed Tongue. HPO HP:0000221: Accentuation of the grooves on the dorsal surface of the tongue.,general,lingua plicata,HPO
25491,Lingual Abnormality,general,HPO exact synonym for Abnormality of the Tongue. HPO HP:0000157: Any abnormality of the tongue.,general,lingual abnormality,HPO
25492,Lingual Aplasia/hypoplasia,general,HPO exact synonym for Aplasia/Hypoplasia of the Tongue. HPO HP:0010295: Absence or underdevelopment of the tongue.,general,lingual aplasia hypoplasia,HPO
25493,Lingual Atrophy,general,HPO exact synonym for Tongue Atrophy. HPO HP:0012473: Wasting of the tongue.,general,lingual atrophy,HPO
25494,Lingual Claudication,cardiovascular,HPO exact synonym for Tongue Claudication. HPO HP:6001463: Pain in the tongue induced by speaking or chewing.,cardiovascular,lingual claudication,HPO
25495,Lingual Dystonia,general,"HPO HP:0031008: Involuntary protrusions, movements, spams and contortions of the tongue.",general,lingual dystonia,HPO
25496,Lingual Erythema Migrans,dermatological,"HPO exact synonym for Geographic Tongue. HPO HP:0025252: An anomaly of the tongue characterized by loss (atrophy) of filiform papillae of the tongue, leaving areas of erythema (redness), surrounded by a serpiginous, white, hyperkeratotic border. The name geographic tongue refers to an appea",integumentary,lingual erythema migrans,HPO
25497,Lingual Fasciculations,general,HPO exact synonym for Tongue Fasciculations. HPO HP:0001308: Fasciculations or fibrillation affecting the tongue muscle.,general,lingual fasciculations,HPO
25498,Lingual Fibrillations,general,HPO exact synonym for Tongue Fasciculations. HPO HP:0001308: Fasciculations or fibrillation affecting the tongue muscle.,general,lingual fibrillations,HPO
25499,Lingual Furrow,general,HPO exact synonym for Furrowed Tongue. HPO HP:0000221: Accentuation of the grooves on the dorsal surface of the tongue.,general,lingual furrow,HPO
25500,Lingual Hamartoma,general,HPO exact synonym for Hamartoma of Tongue. HPO HP:0011802: A benign (noncancerous) tumorlike malformation made up of an abnormal mixture of cells and tissues that originates in the tongue.,general,lingual hamartoma,HPO
25501,Lingual Hypoplasia,general,HPO exact synonym for Microglossia. HPO HP:0000171: Decreased length and width of the tongue.,general,lingual hypoplasia,HPO
25502,Lingual Inflammation,general,HPO exact synonym for Glossitis. HPO HP:0000206: Inflammation of the tongue.,general,lingual inflammation,HPO
25503,Lingual Lobules,general,HPO exact synonym for Lobulated Tongue. HPO HP:0000180: Multiple indentations and/or elevations on the edge and/or surface of the tongue producing an irregular surface contour.,general,lingual lobules,HPO
25504,Lingual Nodules,general,HPO exact synonym for Tongue Nodules. HPO HP:0000199: Human Phenotype Ontology term HP:0000199: Tongue Nodules.,general,lingual nodules,HPO
25505,Lingual Prolapse,general,HPO exact synonym for Protruding Tongue. HPO HP:0010808: Tongue extending beyond the alveolar ridges or teeth at rest.,general,lingual prolapse,HPO
25506,Lingual Prominence,general,HPO exact synonym for Protruding Tongue. HPO HP:0010808: Tongue extending beyond the alveolar ridges or teeth at rest.,general,lingual prominence,HPO
25507,Lingual Protrusion,general,HPO exact synonym for Protruding Tongue. HPO HP:0010808: Tongue extending beyond the alveolar ridges or teeth at rest.,general,lingual protrusion,HPO
25508,Lingual Retraction,general,"HPO exact synonym for Glossoptosis. HPO HP:0000162: Posterior displacement of the tongue into the pharynx, i.e., a tongue that is mislocalised posteriorly.",general,lingual retraction,HPO
25509,Lingual Telangiectasia,general,"HPO exact synonym for Tongue Telangiectasia. HPO HP:0000227: Telangiectasia (that is, the presence of small dilated superficial blood vessels) of the tongue.",general,lingual telangiectasia,HPO
25510,Lingual Thyroid,endocrine_metabolic,"HPO HP:0100029: An aberrant thyroid gland or Ectopic thyroid located at the base of the tongue, just posterior to the foramen cecum as a result of a failure of the thyroid to descend.",endocrine,lingual thyroid,HPO
25511,Lingual Twitching,general,HPO exact synonym for Tongue Fasciculations. HPO HP:0001308: Fasciculations or fibrillation affecting the tongue muscle.,general,lingual twitching,HPO
25512,Lingual Wasting,general,HPO exact synonym for Tongue Atrophy. HPO HP:0012473: Wasting of the tongue.,general,lingual wasting,HPO
25513,Lip Abnormality,general,HPO exact synonym for Abnormal Lip Morphology. HPO HP:0000159: An abnormality of the lip.,general,lip abnormality,HPO
25514,Lip Cyanosis,cardiovascular,HPO HP:0034030: Bluish discoloration of the lips.,cardiovascular,lip cyanosis,HPO
25515,Lip Discoloration,general,HPO HP:0025118: Lightening or darkening of the lips from their usual coloring.,general,lip discoloration,HPO
25516,Lip Fissure,general,"HPO HP:0031250: A severe crack in a lip. A lip fissure may be painful, may bleed and often is a recurring manifestation.",general,lip fissure,HPO
25517,Lip Freckle,general,HPO HP:0010798: Increased focal pigmentation of the vermilion of the lips.,general,lip freckle,HPO
25518,Lip Hyperpigmentation,general,HPO HP:0100816: Human Phenotype Ontology term HP:0100816: Lip Hyperpigmentation.,general,lip hyperpigmentation,HPO
25519,Lip Lentigo,general,HPO exact synonym for Lip Freckle. HPO HP:0010798: Increased focal pigmentation of the vermilion of the lips.,general,lip lentigo,HPO
25520,Lip Pit,general,HPO HP:0100267: A depression located on a lip.,general,lip pit,HPO
25521,Lip Pits At Corners of the Mouth,oral,HPO exact synonym for Commissural Lip Pit. HPO HP:0002710: A depression located at an oral commissure.,oral,lip pits at corners of the mouth,HPO
25522,Lip Swelling,cardiovascular,HPO exact synonym for Swollen Lip. HPO HP:0031244: Enlargement of the lip typically due to fluid buildup or inflammation.,cardiovascular,lip swelling,HPO
25523,Lip Telangiectases,general,"HPO exact synonym for Lip Telangiectasia. HPO HP:0000214: Telangiectasia (that is, the presence of small dilated superficial blood vessels) of the lips.",general,lip telangiectases,HPO
25524,Lip Telangiectasia,general,"HPO HP:0000214: Telangiectasia (that is, the presence of small dilated superficial blood vessels) of the lips.",general,lip telangiectasia,HPO
25525,Lip Tremor,neurological,"HPO HP:0032006: An unintentional, oscillating to-and-fro muscle movement affecting the lip.",nervous,lip tremor,HPO
25526,Lip Tumor,general,HPO exact synonym for Neoplasm of the Lip. HPO HP:0100604: A tumor (abnormal growth of tissue) of the lip.,general,lip tumor,HPO
25527,Lip Tumour,general,HPO exact synonym for Neoplasm of the Lip. HPO HP:0100604: A tumor (abnormal growth of tissue) of the lip.,general,lip tumour,HPO
25528,Lipedema,cardiovascular,HPO HP:0100695: Excess deposit and expansion of adipose tissue in an unusual pattern which cannot be lost through diet and exercise .,cardiovascular,lipedema,HPO
25529,Lipemia Retinalis,general,"HPO HP:0000660: A creamy appearance of the retinal blood vessels that occurs when the concentration of lipids in the blood is extremely increased, with pale pink to milky white retinal vessels and altered pale reflexes from choroidal vasculature.",general,lipemia retinalis,HPO
25530,Lipid Accumulation in Hepatocytes,general,HPO HP:0006561: Human Phenotype Ontology term HP:0006561: Lipid Accumulation in Hepatocytes.,general,lipid accumulation in hepatocytes,HPO
25531,Lipid Accumulation in Skeletal Muscle,musculoskeletal,HPO exact synonym for Increased Muscle Lipid Content. HPO HP:0009058: An abnormal accumulation of lipids in skeletal muscle.,musculoskeletal,lipid accumulation in skeletal muscle,HPO
25532,Lipid-laden Bone-marrow Macrophages,musculoskeletal,HPO HP:6000640: Bone marrow with increased numbers of macrophages heavily laden with lipids.,musculoskeletal,lipid laden bone marrow macrophages,HPO
25533,Lipid-laden Histiocytes,general,"HPO exact synonym for Foam Cells. HPO HP:0003651: The presence of foam cells, a type of macrophage that localizes to fatty deposits on blood vessel walls, where they ingest low-density lipoproteins and become laden with lipids, giving them a foamy appearance.",general,lipid laden histiocytes,HPO
25534,Lipid-laden Lymph Node Macrophages,hematologic,HPO HP:0034583: Lymph node with increased numbers of macrophages heavily laden with lipids.,general,lipid laden lymph node macrophages,HPO
25535,Lipid-laden Macrophages in Bronchoalveolar Fluid,general,HPO HP:0032978: Accumulation of lipids in alveolar macrophages with droplet-shaped fat inclusions.,general,lipid laden macrophages in bronchoalveolar fluid,HPO
25536,Lipiduria,general,HPO HP:0032567: An increased lipid content in the urine.,general,lipiduria,HPO
25537,Lipoatrophy,general,HPO HP:0100578: Localized loss of fat tissue.,general,lipoatrophy,HPO
25538,Lipodystrophy,general,HPO HP:0009125: Degenerative changes of the fat tissue.,general,lipodystrophy,HPO
25539,"Lipodystrophy, Generalised",general,HPO exact synonym for Generalized Lipodystrophy. HPO HP:0009064: Generalized degenerative changes of the fat tissue.,general,lipodystrophy generalised,HPO
25540,"Lipodystrophy, Generalized",general,HPO exact synonym for Generalized Lipodystrophy. HPO HP:0009064: Generalized degenerative changes of the fat tissue.,general,lipodystrophy generalized,HPO
25541,Lipogranulomatosis,general,HPO HP:0040139: Yellow nodules of lipoid material are deposited in the skin and mucosae. This gives rise to granulomatous reactions.,general,lipogranulomatosis,HPO
25542,Lipoid Pneumonia,general,HPO HP:0033364: A specific form of lung inflammation that results from accumulation of lipids in the alveoli. Lipoid pneumonia can be either exogenous or endogenous in cause based on the source of the lipid.,general,lipoid pneumonia,HPO
25543,Lipoma,general,HPO HP:0012032: Benign neoplasia derived from lipoblasts or lipocytes of white or brown fat. May be angiomatous or hibernomatous.,general,lipoma,HPO
25544,Lipoma of Bone,musculoskeletal,HPO exact synonym for Intraosseous Lipoma. HPO HP:0025786: Intraosseous lipomas are rare benign lesions composed of mature fat that reside within the intramedullary canal.,musculoskeletal,lipoma of bone,HPO
25545,Lipoma of Corpus Callosum,general,"HPO exact synonym for Pericallosal Lipoma. HPO HP:0006931: Pericallosal lipomas are congenital soft masses of adipose cells encapsulated by a thin layer of fibrous tissue, appearing adjacent to the corpus callosum of the brain.",general,lipoma of corpus callosum,HPO
25546,Lipoma of Filum Terminale,general,HPO exact synonym for Filum Terminale Lipoma. HPO HP:6000184: Filum terminale lipomas (FTLs) are a type of lumbosacral lipoma in which the fat is entirely within the filum terminale and separate from the conus medullaris.,general,lipoma of filum terminale,HPO
25547,Lipoma of the Filum Terminale,general,HPO exact synonym for Filum Terminale Lipoma. HPO HP:6000184: Filum terminale lipomas (FTLs) are a type of lumbosacral lipoma in which the fat is entirely within the filum terminale and separate from the conus medullaris.,general,lipoma of the filum terminale,HPO
25548,Lipoma of the Tongue,general,"HPO HP:0030815: A lipoma localized to the tongue. May present as a nontender, soft, spherical mass of the tongue.",general,lipoma of the tongue,HPO
25549,Lipomas of Eyelids,sensory,HPO HP:0040164: Fatty tumors on the eyelids.,special_senses,lipomas of eyelids,HPO
25550,Lipomas of the Central Nervous System,general,HPO exact synonym for Multiple Central Nervous System Lipomas. HPO HP:0100251: The presence of multiple lipomas located in the central nervous system.,general,lipomas of the central nervous system,HPO
25551,Lipomata,general,HPO exact synonym for Multiple Lipomas. HPO HP:0001012: The presence of multiple lipomas (a type of benign tissue made of fatty tissue).,general,lipomata,HPO
25552,Lipomatous Tumor,general,HPO HP:0012031: Human Phenotype Ontology term HP:0012031: Lipomatous Tumor.,general,lipomatous tumor,HPO
25553,Lipomatous Tumour,general,HPO exact synonym for Lipomatous Tumor. HPO HP:0012031: Human Phenotype Ontology term HP:0012031: Lipomatous Tumor.,general,lipomatous tumour,HPO
25554,Lipomeningocele,general,HPO HP:0030710: A form of closed neural tube defect in which the spinal tissue lies within the spinal cord having a junction between the spinal cord and the lipoma. Intact skin covers the defect. Neurologic findings first appear during the second year of life.,general,lipomeningocele,HPO
25555,Lipomyelomeningocele,general,"HPO HP:0025480: A type of spinal dysraphism presenting as a subcutaneous fatty mass, that is, a spinal defect associated with lipomatous tissue, and covered by skin. The most usual location for lipomyelomeningocele is at the gluteal cleft.",general,lipomyelomeningocele,HPO
25556,Liposarcoma,neurological,HPO HP:0012034: Malignant neoplasms which probably originate in primitive mesenchymal stem cell populations differentiating down a lipomatous pathway.,nervous,liposarcoma,HPO
25557,Liquefactive Necrosis of the Arcuate Artery Intima/media,general,HPO exact synonym for Arcuate Artery Intima/media Liquefactive Necrosis. HPO HP:0033933: A type of arcuate artery intima/media necrosis in which the dead (necrotic) tissue breaks down such that cellular detail is no longer recognized.,general,liquefactive necrosis of the arcuate artery intima media,HPO
25558,Liquefactive Necrosis of the Renal Arteriolar Intima/media,urinary,HPO exact synonym for Renal Arteriole Intima/media Liquefactive Necrosis. HPO HP:0033939: A type of renal arteriole intima/media necrosis in which the dead (necrotic) tissue breaks down such that cellular detail is no longer recognized.,urinary,liquefactive necrosis of the renal arteriolar intima media,HPO
