symptom_key,aliases,display_name,category,tip_1,tip_2,tip_3,tip_4,when_to_seek_care,active
chest_congestion_mild,"chest congestion|phlegm sa dibdib|malapot uhog|productive chest mild","Mild chest congestion",respiratory,"Drink warm fluids and rest to help loosen phlegm.","Use steamy air carefully; avoid smoke exposure.","Honey (adults/older children) may soothe cough; expectorants only if labeled for you.","Do not suppress a productive cough completely if mucus is clearing.","Seek care for shortness of breath, chest pain, bluish lips, high fever, or coughing blood.",1
sciatica_mild,"sciatica|sakit nerbiyos binti|shooting leg pain mild|nerve pain leg mild","Mild sciatica-like pain",musculoskeletal,"Avoid prolonged sitting; take short walking breaks.","Use ice or heat packs as comfortable for short sessions.","Gentle stretches for hips/hamstrings within pain limits may help.","Sleep on a supportive surface; a pillow between knees can reduce strain.","Seek care for progressive weakness, numbness in the groin, or loss of bladder/bowel control.",1
wrist_strain,"wrist pain|sakit pulso|carpal strain mild|nastrain kamay","Mild wrist strain",musculoskeletal,"Rest from repetitive straining tasks for 24–48 hours.","Ice briefly with a cloth barrier if swollen.","A soft wrist support may help daytime tasks if sensation stays normal.","Return to typing/lifting gradually with neutral wrist posture.","Seek care after a fall onto the wrist, visible deformity, or numbness that does not improve.",1
heel_pain,"heel pain|sakit sakong|plantar fasciitis mild|sakit talampakan","Mild heel pain",musculoskeletal,"Reduce high-impact activity for a few days; choose supportive shoes.","Gentle calf stretches before standing first thing in the morning may help.","Ice the heel briefly after activity if sore.","Avoid walking barefoot on hard floors while symptomatic.","Seek care for inability to walk, heel bruising after injury, or pain that worsens over weeks.",1
dry_skin_eczema_mild,"dry skin|eczema mild|pagkatuyo ng balat|itchy dry skin|kaliskis balat mild","Dry skin / mild eczema",skin,"Moisturize often with fragrance-free cream after bathing.","Use lukewarm (not hot) water and gentle cleanser; pat dry.","Wear soft cotton layers; avoid known irritants (harsh soaps, wool if triggering).","Keep nails short to reduce scratch damage.","Seek care for oozing infection, fever, rapidly spreading redness, or severe sleep-disturbing itch.",1
dengue_watch_home,"dengue|dengue watch|dengue mild watch|possible dengue home|lagnat dengue watch|dengge","Fever with body pain (dengue-watch home care)",general,"Rest and drink ORS/water frequently; monitor urine output.","Use acetaminophen/paracetamol only as labeled for fever/pain if suitable — avoid aspirin/ibuprofen if dengue is possible unless a clinician says otherwise.","Use mosquito nets/repellent to protect others; eliminate standing water around the home.","Watch warning signs closely: severe belly pain, persistent vomiting, bleeding gums/nose, black stools, restlessness, cold clammy skin.","Seek urgent care for any warning signs, fever with bleeding, severe lethargy, or inability to drink — dengue can worsen quickly after the fever drops.",1
covid_mild_home,"covid mild|covid-19 home|positive covid mild|corona mild","Mild COVID-like illness",respiratory,"Rest at home, isolate as advised locally, and improve room ventilation when possible.","Drink fluids; use labeled fever/pain medicine for comfort if appropriate.","Monitor breathing and oxygen needs if you have a pulse oximeter and know your baseline.","Contact a clinician early if you are high risk — antivirals work best soon after symptoms start.","Seek urgent care for trouble breathing, chest pain, confusion, blue lips, or inability to stay awake.",1
vaccination_sore_arm,"sore arm after vaccine|baka pain|vaccine side effect mild|masakit braso bakuna","Mild vaccine arm soreness",general,"Move the arm gently through normal range several times a day.","A cool compress can ease local soreness.","Labeled OTC pain relievers may help if suitable for you.","Rest if you feel briefly fatigued; stay hydrated.","Seek care for rash with breathing difficulty, high fever lasting days, or arm swelling that rapidly worsens.",1
diaper_rash,"diaper rash|lampin|pulang puwet bata|nappy rash","Diaper rash",skin,"Change wet/soiled diapers promptly and clean gently with water.","Pat dry and allow short diaper-free air time when practical.","Use a thick barrier cream (zinc oxide style) as labeled.","Avoid harsh wipes with alcohol/fragrance if they irritate.","Seek care for open sores, fever, spreading redness, or rash lasting more than a few days.",1
teething,"teething|ngingipin|baby teething|sakit gilagid bata","Teething discomfort",dental,"Offer a clean cool (not frozen hard) teething ring if age-appropriate.","Gently massage the gum with a clean finger.","Keep the face dry; drool can irritate the chin — apply a thin barrier cream if needed.","Avoid teething gels with benzocaine in young children unless a clinician advises.","Seek care for high fever, rash, diarrhea with dehydration, or refusal to drink — teething alone rarely causes high fever.",1
hiccups,"hiccups|singultus|solok-solok|hikab hiccup","Hiccups",general,"Sip cold water slowly or hold a brief breath, then exhale gently.","Breathe into a paper bag briefly only if safe and not for people with breathing disease.","Relax the diaphragm; avoid carbonated drinks and rapid eating for a while.","Most hiccup bouts stop on their own within minutes to hours.","Seek care if hiccups last >48 hours, interfere with sleep/eating, or follow recent surgery/illness.",1
splinter,"splinter|tinik|aspili sa balat|tuhog kahoy","Splinter",first_aid,"Wash hands and the area with soap and water.","Use cleaned tweezers to remove a visible splinter along the entry track.","If the tip is under skin, a sterilized needle may help lift it — then wash again.","Apply a clean bandage; watch for redness.","Seek care if the splinter is deep, under a nail, from rusty/dirty metal, or infection signs appear.",1
friction_blister,"blister|paltos|blister from shoes|paltos paa","Friction blister",first_aid,"Leave intact blisters closed when possible — the skin is a natural bandage.","Cover with a clean blister plaster or soft padding to reduce rub.","If a blister opens, wash gently and cover with a non-stick dressing.","Wear better-fitting socks/shoes to prevent repeat blisters.","Seek care for spreading redness, pus, fever, or blisters in people with diabetes/poor circulation.",1
loss_of_appetite,"loss of appetite|walang gana|reduced appetite mild|ayaw kumain mild","Mild loss of appetite",general,"Offer small frequent easy meals rather than large plates.","Choose nutrient-dense soft foods and keep fluids up.","Light activity and fresh air before meals may help appetite.","Avoid forcing large meals; track weight if appetite stays low.","Seek care if appetite loss lasts weeks, with weight loss, fever, vomiting, or severe fatigue.",1
gout_flare_mild,"gout mild|sakit daliri paa bigla|gouty toe mild|uric acid pain mild","Mild gout-like joint flare",musculoskeletal,"Rest the joint and elevate it; avoid pressure from tight shoes.","Ice briefly with a cloth barrier for comfort.","Drink water unless fluid-restricted; avoid alcohol during a flare.","Do not start new strong pain medicines without advice if kidney disease or ulcers are known.","Seek care for hot swollen joint with fever, first-time severe attack, or inability to walk.",1
allergic_eye,"itchy eyes allergy|hapong mata|watery allergic eyes|allergic conjunctivitis mild","Allergic itchy eyes",eye,"Avoid rubbing; use cool compresses.","Reduce exposure to dust/pollen; wash face and change pillowcases.","Preservative-free lubricating drops may soothe; ask about antihistamine eye drops if needed.","Wash hands before any eye drop use.","Seek care for pain, vision change, thick yellow discharge, or light sensitivity.",1
pinworm_suspect,"pinworm|bulate sa puwit|anal itch night|enterobius mild","Suspected pinworm itch",gastrointestinal,"Bathe in the morning and change underwear daily.","Wash hands after toilet and before meals; keep nails short.","Wash bedding/pajamas frequently in hot water when possible.","Do not share towels; clean bathroom surfaces.","See a clinician for confirmed treatment — self-medicating worm tablets without advice is not recommended for all ages.",1
default_non_urgent,"general|non urgent|mild symptoms|not sure","General mild symptoms",general,"Rest, drink water, and monitor how you feel over the next 24–48 hours.","Write down when symptoms started and what makes them better or worse.","Use only labeled OTC remedies appropriate for your age/health conditions.","Avoid sharing medicines prescribed for someone else.","Book a consultation if symptoms persist, worsen, or you become unsure — you may choose to see a licensed doctor anytime.",1
